A0,A0.35_Verb,A1,A2,Polarity,RelatedSentence
"bombings ,",kill.01,34 people,,Affirmative,"Sinn Féin MLA Raymond McCartney has called on the British government to release all files on the Dublin and Monaghan bombings , which killed 34 people in 1974 . "
Féin justice spokesperson,speak.01,on,,Affirmative,"Speaking on the 40th anniversary of the bombings , the Sinn Féin justice spokesperson said the families of those killed are entitled to justice . "
Féin justice spokesperson,say.01,are entitled to justice,,Affirmative,"Speaking on the 40th anniversary of the bombings , the Sinn Féin justice spokesperson said the families of those killed are entitled to justice . "
their relatives,campaign.01,for truth and justice for,,Affirmative,"34 people were killed in these bombings and many more injured and their relatives have been tirelessly campaigning for truth and justice for 40 years , said Mr. McCartney . "
Sinn Fein MLA Raymond McCartney,say.01,people were killed in,,Affirmative,"34 people were killed in these bombings and many more injured and their relatives have been tirelessly campaigning for truth and justice for 40 years , said Mr. McCartney . "
by,feel.01,The hurt felt by,,Affirmative,The hurt felt by the loss of their loved ones has been made worse by four decades of cover up and silence from the British government . 
by,make.02,worse,,Affirmative,The hurt felt by the loss of their loved ones has been made worse by four decades of cover up and silence from the British government . 
Mr. McCartney,say.01,government have,,Affirmative,Mr. McCartney went on to say that the British government have a responsibility to the families of those killed and injured in the bombings and called on the Irish government to put pressure on their British counterparts to release the information . 
the British government,have.03,a responsibility to,,Affirmative,Mr. McCartney went on to say that the British government have a responsibility to the families of those killed and injured in the bombings and called on the Irish government to put pressure on their British counterparts to release the information . 
The families of,take.01,a civil case,as,Affirmative,The families of the those killed in the bombings have been forced to take a civil case as a last resort because of the refusal of the British government to fully disclose all papers relating to the bombings and we support the families in that . 
The families of,disclose.01,all papers relating to,,Affirmative,The families of the those killed in the bombings have been forced to take a civil case as a last resort because of the refusal of the British government to fully disclose all papers relating to the bombings and we support the families in that . 
their British counterparts,support.01,the families,,Affirmative,The families of the those killed in the bombings have been forced to take a civil case as a last resort because of the refusal of the British government to fully disclose all papers relating to the bombings and we support the families in that . 
the British government,shirk.01,a responsibility to the families of those killed and injured in the bombings and called on the Irish government to put pressure on their British counterparts to release the information,,Affirmative,The British government were a party to the conflict and can not be allowed to shirk its responsibility in dealing with the past . 
the British government,fail.01,many other victims,by,Affirmative,"As well as failing the families of those killed in Dublin and Monaghan , the British government is failing many other victims by its refusal to sign up to the Haass proposals on dealing with the past . "
you,have.03,a complaint about,,Affirmative,"If you have a complaint about editorial content which relates to inaccuracy or intrusion , then contact the Editor by clicking here . "
your,contact.01,the PCC,,Affirmative,If you remain dissatisfied with the response provided then you can contact the PCC by clicking here . 
Derry Journal,provide.01,"news , events and",,Affirmative,"Derry Journal provides news , events and sport features from the Derry area . "
you,enjoy.01,all the features of,,Affirmative,For you to enjoy all the features of this website Derry Journal requires permission to use cookies . 
For you to enjoy,require.01,permission,,Affirmative,For you to enjoy all the features of this website Derry Journal requires permission to use cookies . 
your,visit.01,a website,,Affirmative,"Cookies are small data files which are sent to your browser ( Internet Explorer , Firefox , Chrome etc ) from a website you visit . "
by,collect.01,a type of cookie,,Affirmative,This is a type of cookie which is collected by Adobe Flash media player ( it is also called a Local Shared Object ) - a piece of software you may already have on your electronic device to help you watch online videos and listen to podcasts . 
you,have.03,on,,Affirmative,This is a type of cookie which is collected by Adobe Flash media player ( it is also called a Local Shared Object ) - a piece of software you may already have on your electronic device to help you watch online videos and listen to podcasts . 
you,help.01,you watch,,Affirmative,This is a type of cookie which is collected by Adobe Flash media player ( it is also called a Local Shared Object ) - a piece of software you may already have on your electronic device to help you watch online videos and listen to podcasts . 
you,watch.01,online videos,,Affirmative,This is a type of cookie which is collected by Adobe Flash media player ( it is also called a Local Shared Object ) - a piece of software you may already have on your electronic device to help you watch online videos and listen to podcasts . 
you,listen.01,to podcasts,,Affirmative,This is a type of cookie which is collected by Adobe Flash media player ( it is also called a Local Shared Object ) - a piece of software you may already have on your electronic device to help you watch online videos and listen to podcasts . 
your,set.02,your browser,either to reject,Affirmative,"Yes there are a number of options available , you can set your browser either to reject all cookies , to allow only trusted sites to set them , or to only accept them from the site you are currently on . "
your,reject.01,all cookies,,Affirmative,"Yes there are a number of options available , you can set your browser either to reject all cookies , to allow only trusted sites to set them , or to only accept them from the site you are currently on . "
sites,set.02,them,,Affirmative,"Yes there are a number of options available , you can set your browser either to reject all cookies , to allow only trusted sites to set them , or to only accept them from the site you are currently on . "
your,delete.01,all cookies,,Affirmative,"However , please note - if you block / delete all cookies , some features of our websites , such as remembering your login details , or the site branding for your local newspaper may not function as a result . "
some features of,function.01,as,,Affirmative,"However , please note - if you block / delete all cookies , some features of our websites , such as remembering your login details , or the site branding for your local newspaper may not function as a result . "
by some of,use.01,A tool used by some of,to target adverts to you,Affirmative,A tool used by some of our advertisers to target adverts to you based on pages you have visited in the past . 
you,visit.01,pages,,Affirmative,A tool used by some of our advertisers to target adverts to you based on pages you have visited in the past . 
To opt out of,visit.01,website,,Affirmative,To opt out of this type of targeting you can visit the ' Your Online Choices ' website by clicking here . 
Our sites,contain.01,advertising,,Affirmative,Our sites contain advertising from Google ; these use cookies to ensure you get adverts relevant to you . 
these,use.01,cookies,to ensure,Affirmative,Our sites contain advertising from Google ; these use cookies to ensure you get adverts relevant to you . 
you,get.01,adverts relevant to you,,Affirmative,Our sites contain advertising from Google ; these use cookies to ensure you get adverts relevant to you . 
You,tailor.01,the type of ads,,Affirmative,You can tailor the type of ads you receive by visiting here or to opt out of this type of targeting you can visit the ' Your Online Choices ' website by clicking here . 
you,receive.01,the type of ads,,Affirmative,You can tailor the type of ads you receive by visiting here or to opt out of this type of targeting you can visit the ' Your Online Choices ' website by clicking here . 
You,opt.01,out of,,Affirmative,You can tailor the type of ads you receive by visiting here or to opt out of this type of targeting you can visit the ' Your Online Choices ' website by clicking here . 
You,visit.01,website,,Affirmative,You can tailor the type of ads you receive by visiting here or to opt out of this type of targeting you can visit the ' Your Online Choices ' website by clicking here . 
This,help.01,us identify,,Affirmative,This is used to help us identify unique visitors to our websites . 
us,identify.01,unique visitors,,Affirmative,This is used to help us identify unique visitors to our websites . 
we,use.01,this,to uniquely identify individuals and,Affirmative,This data is anonymous and we can not use this to uniquely identify individuals and their usage of the sites . 
we,identify.01,individuals and,,Affirmative,This data is anonymous and we can not use this to uniquely identify individuals and their usage of the sites . 
ad,serve.01,serving technology,,Affirmative,"This comes from our ad serving technology and is used to track how many times you have seen a particular ad on our sites , so that you do n't just see one advert but an even spread . "
you,see.01,a particular ad,,Affirmative,"This comes from our ad serving technology and is used to track how many times you have seen a particular ad on our sites , so that you do n't just see one advert but an even spread . "
you,see.01,one advert,,Affirmative,"This comes from our ad serving technology and is used to track how many times you have seen a particular ad on our sites , so that you do n't just see one advert but an even spread . "
by us,use.01,This information,for,Affirmative,This information is not used by us for any other type of audience recording or monitoring . 
"Our Classified websites ( Photos , Motors , Jobs and",use.01,cookies,to ensure,Affirmative,"Our Classified websites ( Photos , Motors , Jobs and Property Today ) use cookies to ensure you get the correct local newspaper branding and content when you visit them . "
you,get.01,the correct local newspaper branding and content,,Affirmative,"Our Classified websites ( Photos , Motors , Jobs and Property Today ) use cookies to ensure you get the correct local newspaper branding and content when you visit them . "
you,visit.01,them,,Affirmative,"Our Classified websites ( Photos , Motors , Jobs and Property Today ) use cookies to ensure you get the correct local newspaper branding and content when you visit them . "
These cookies,store.01,identifiable information,,Affirmative,These cookies store no personally identifiable information . 
We,use.01,Grapeshot,as,Affirmative,"We use Grapeshot as a contextual targeting technology , allowing us to create custom groups of stories outside out of our usual site navigation . "
We,allow.01,us to create,,Affirmative,"We use Grapeshot as a contextual targeting technology , allowing us to create custom groups of stories outside out of our usual site navigation . "
us,create.01,custom groups of stories outside out of,,Affirmative,"We use Grapeshot as a contextual targeting technology , allowing us to create custom groups of stories outside out of our usual site navigation . "
Grapeshot,store.01,the categories of story,,Affirmative,Grapeshot stores the categories of story you have been exposed to . 
Their privacy policy and opt out option,opt.01,option,,Affirmative,Their privacy policy and opt out option can be accessed here . 
Our partner for,increase.01,the usability of,,Affirmative,Our partner for Newspaper subscriptions online stores data from the forms you complete in these to increase the usability of the site and enhance user experience . 
This,provide.01,networking widget found in many of,,Affirmative,Add This provides the social networking widget found in many of our pages . 
This widget,give.01,the tools,you,Affirmative,"This widget gives you the tools to bookmark our websites , blog , share , tweet and email our content to a friend . "
