A0,A0.35_Verb,A1,A2,Polarity,RelatedSentence
him,go.02,on,,Affirmative,"The case of a murderer being given day release , allowing him to go on the run for the the third time , is unacceptable Justice Secretary Chris Grayling said , adding the government would speed up a planned tightening of the rules around releasing prisoners on temporary licence . "
Secretary Chris Grayling,say.01,", is unacceptable",,Affirmative,"The case of a murderer being given day release , allowing him to go on the run for the the third time , is unacceptable Justice Secretary Chris Grayling said , adding the government would speed up a planned tightening of the rules around releasing prisoners on temporary licence . "
Secretary Chris Grayling,add.01,government would speed up,,Affirmative,"The case of a murderer being given day release , allowing him to go on the run for the the third time , is unacceptable Justice Secretary Chris Grayling said , adding the government would speed up a planned tightening of the rules around releasing prisoners on temporary licence . "
the government,speed.02,a planned tightening of,,Affirmative,"The case of a murderer being given day release , allowing him to go on the run for the the third time , is unacceptable Justice Secretary Chris Grayling said , adding the government would speed up a planned tightening of the rules around releasing prisoners on temporary licence . "
Arnold Pickering,try.01,to escape before,,Affirmative,"Arnold Pickering , 44 , absconded from prison at the weekend , while on day release , despite the fact he had twice tried to escape before . "
"Pickering , from Chadderton",leave.01,C jail,on,Affirmative,"Pickering , from Chadderton , Greater Manchester , failed to return to HMP Kennet in Maghull , Merseyside , after leaving the Category C jail on day release at about 9.30 am on Saturday . "
a prisoner,wander.01,"stringent risk assessments , and",,Affirmative,"Grayling pledged the abolition of town leave , where a prisoner can be temporarily allowed to wander around town all day , more stringent risk assessments , and electronic tags for prisoners on day release . "
Justice Secretary Chris Grayling,tell.01,4's,BBC Radio,Affirmative,"On Monday , Grayling told BBC Radio 4's Today programme : I think most people would struggle to find this remotely acceptable , I certainly do . "
Justice Secretary Chris Grayling,think.01,people would struggle,,Affirmative,"On Monday , Grayling told BBC Radio 4's Today programme : I think most people would struggle to find this remotely acceptable , I certainly do . "
most people,struggle.02,to find,,Affirmative,"On Monday , Grayling told BBC Radio 4's Today programme : I think most people would struggle to find this remotely acceptable , I certainly do . "
most people,find.01,this remotely acceptable,,Affirmative,"On Monday , Grayling told BBC Radio 4's Today programme : I think most people would struggle to find this remotely acceptable , I certainly do . "
prisoners on day release,accelerate.01,planned changes,,Affirmative,This comes off the back of a series of planned changes that we are now accelerating . 
Justice Secretary Chris Grayling,look.01,at,,Affirmative,"If you look at what 's happened over the past 12 months , as I say we 've got a system where most people treat it properly and appropriately and there are very few people who cause trouble . "
this,say.01,we 've got,,Affirmative,"If you look at what 's happened over the past 12 months , as I say we 've got a system where most people treat it properly and appropriately and there are very few people who cause trouble . "
prisoners on day release,get.02,a system,,Affirmative,"If you look at what 's happened over the past 12 months , as I say we 've got a system where most people treat it properly and appropriately and there are very few people who cause trouble . "
most people,treat.01,the past 12 months,,Affirmative,"If you look at what 's happened over the past 12 months , as I say we 've got a system where most people treat it properly and appropriately and there are very few people who cause trouble . "
few people,cause.01,trouble,,Affirmative,"If you look at what 's happened over the past 12 months , as I say we 've got a system where most people treat it properly and appropriately and there are very few people who cause trouble . "
prisoners on day release,have.03,a number of,,Affirmative,But the reality is we have had a number of serious incidents with people out on temporary licence . 
Kent Police,confirm.01,were arrested on suspicion,,Affirmative,"Kent Police confirmed that two men , aged 55 and 53 were arrested on suspicion to commit armed robbery , at an address in East London by Met Police officers . "
"two men , aged 55 and 53",commit.02,armed robbery,,Affirmative,"Kent Police confirmed that two men , aged 55 and 53 were arrested on suspicion to commit armed robbery , at an address in East London by Met Police officers . "
DCI Ann Lisseman from,say.01,longer looking for,,Affirmative,DCI Ann Lisseman from Kent Police said : We are no longer looking for Michael Wheatley . 
two men,look.01,for,,Affirmative,DCI Ann Lisseman from Kent Police said : We are no longer looking for Michael Wheatley . 
"Police outside a branch of the Chelsea Building Society in Sunbury-on-Thames , Surrey which was robbed today , Police are investigating whether armed robber Michael Wheatley also known as the `` Skull Cracker '' has struck again .",investigate.01,Wheatley also known,,Affirmative,"Police outside a branch of the Chelsea Building Society in Sunbury - on - Thames , Surrey which was robbed today , Police are investigating whether armed robber Michael Wheatley also known as the Skull Cracker has struck again . "
"Police outside a branch of the Chelsea Building Society in Sunbury-on-Thames , Surrey which was robbed today , Police are investigating whether armed robber Michael Wheatley also known as the `` Skull Cracker '' has struck again .",investigate.01,has struck again,,Affirmative,"Police outside a branch of the Chelsea Building Society in Sunbury - on - Thames , Surrey which was robbed today , Police are investigating whether a fugitive armed robber known as the Skull Cracker has struck again . "
by,issue.01,Undated handout photo issued by,,Affirmative,"Undated handout photo issued by the Metropolitan Police in 2002 of Michael Wheatley performing an armed raid , as Wheatley , dubbed the Skull Cracker , who went missing after temporarily being allowed out of jail , has been seen in south west London , Scotland Yard said . "
Michael Wheatley,perform.01,"an armed raid ,",,Affirmative,"Undated handout photo issued by the Metropolitan Police in 2002 of Michael Wheatley performing an armed raid , as Wheatley , dubbed the Skull Cracker , who went missing after temporarily being allowed out of jail , has been seen in south west London , Scotland Yard said . "
Police handout,issue.01,"Tuesday October 1 , 2002 , of",,Affirmative,"EDITORIAL USE ONLY : Metropolitan Police handout issued Tuesday October 1 , 2002 , of Michael Wheatley performing an armed raid . "
Michael Wheatley,perform.01,an armed raid,,Affirmative,"EDITORIAL USE ONLY : Metropolitan Police handout issued Tuesday October 1 , 2002 , of Michael Wheatley performing an armed raid . "
he,spend.01,life,behind bars,Affirmative,Wheatley will learn at the Old Bailey in London today if he is to spend life behind bars when he is sentenced for 13 raids on building societies and banks over 10 months . 
He,earn.01,his nickname,,Affirmative,He earned his nickname after pistol - whipping victims and was described in court as a career criminal . 
