A0,A0.35_Verb,A1,A2,Polarity,RelatedSentence
the ex-wife of,emerge.01,as,,Affirmative,A row over the way older women are portrayed in the media has erupted in Italy - with the ex-wife of Silvio Berlusconi emerging as a perhaps unlikely crusader against female objectification . 
"Veronica Lario ,",leave.01,the former prime minister,,Affirmative,"Veronica Lario , who left the former prime minister in 2009 after nearly 20 years of marriage , reacted with fury after the celebrity gossip magazine Chi published a spread of paparazzi photographs of her under unflattering headlines claiming she had put on weight and asking experts what kind of plastic surgery could help her combat the ageing process . "
"Veronica Lario ,",react.01,with fury after,,Affirmative,"Veronica Lario , who left the former prime minister in 2009 after nearly 20 years of marriage , reacted with fury after the celebrity gossip magazine Chi published a spread of paparazzi photographs of her under unflattering headlines claiming she had put on weight and asking experts what kind of plastic surgery could help her combat the ageing process . "
Chi,publish.01,a spread of,,Affirmative,"Veronica Lario , who left the former prime minister in 2009 after nearly 20 years of marriage , reacted with fury after the celebrity gossip magazine Chi published a spread of paparazzi photographs of her under unflattering headlines claiming she had put on weight and asking experts what kind of plastic surgery could help her combat the ageing process . "
unflattering headlines claiming,claim.01,she had put on weight,,Affirmative,"Veronica Lario , who left the former prime minister in 2009 after nearly 20 years of marriage , reacted with fury after the celebrity gossip magazine Chi published a spread of paparazzi photographs of her under unflattering headlines claiming she had put on weight and asking experts what kind of plastic surgery could help her combat the ageing process . "
Chi,ask.01,could help,experts,Affirmative,"Veronica Lario , who left the former prime minister in 2009 after nearly 20 years of marriage , reacted with fury after the celebrity gossip magazine Chi published a spread of paparazzi photographs of her under unflattering headlines claiming she had put on weight and asking experts what kind of plastic surgery could help her combat the ageing process . "
by Mondadori,publish.01,Chi,,Affirmative,"The fact that Chi is published by Mondadori , controlled by the Berlusconi family holding company Fininvest , and regularly attacks the centre-right leader 's enemies , only served to rub salt in the wounds . "
by,control.01,Chi,,Affirmative,"The fact that Chi is published by Mondadori , controlled by the Berlusconi family holding company Fininvest , and regularly attacks the centre-right leader 's enemies , only served to rub salt in the wounds . "
"holding company Fininvest ,",hold.04,Berlusconi family,,Affirmative,"The fact that Chi is published by Mondadori , controlled by the Berlusconi family holding company Fininvest , and regularly attacks the centre-right leader 's enemies , only served to rub salt in the wounds . "
"holding company Fininvest ,",attack.01,enemies,,Affirmative,"The fact that Chi is published by Mondadori , controlled by the Berlusconi family holding company Fininvest , and regularly attacks the centre-right leader 's enemies , only served to rub salt in the wounds . "
The fact,serve.01,to rub salt in,,Affirmative,"The fact that Chi is published by Mondadori , controlled by the Berlusconi family holding company Fininvest , and regularly attacks the centre-right leader 's enemies , only served to rub salt in the wounds . "
The fact,rub.01,salt,in,Affirmative,"The fact that Chi is published by Mondadori , controlled by the Berlusconi family holding company Fininvest , and regularly attacks the centre-right leader 's enemies , only served to rub salt in the wounds . "
"Lario ,",call.01,the Chi feature,an unacceptable attack,Affirmative,"Lario , who is reported to have pushed for a divorce settlement of more than €500 m ( £408 mm ) , called the Chi feature an unacceptable attack that wounded not only her but all women who , like me , want to age without subjugating themselves to the ' young at all costs ' stereotype . "
an unacceptable attack,wound.01,her but,,Affirmative,"Lario , who is reported to have pushed for a divorce settlement of more than €500 m ( £408 mm ) , called the Chi feature an unacceptable attack that wounded not only her but all women who , like me , want to age without subjugating themselves to the ' young at all costs ' stereotype . "
all women,want.01,to age without subjugating themselves to,,Affirmative,"Lario , who is reported to have pushed for a divorce settlement of more than €500 m ( £408 mm ) , called the Chi feature an unacceptable attack that wounded not only her but all women who , like me , want to age without subjugating themselves to the ' young at all costs ' stereotype . "
"The former actor , 57",tell.01,", I am not ageing well",Il Messaggero,Affirmative,"The former actor , 57 , told Il Messaggero : I am almost 60 years old ; probably , according to current obsessive standards , I am not ageing well . "
"The former actor , 57",attend.01,to,,Affirmative,I do n't attend to my waistline or the wrinkles on my neck ... 
"Italia ( FI ) party ,",lead.02,a lacklustre campaign,,Affirmative,"The interview , published on Sunday , was met with support from women across the political spectrum , including from within Berlusconi 's Forza Italia ( FI ) party , which is leading a lacklustre campaign ahead of this week 's European elections . "
Everyone,have.03,the right,,Affirmative,"Everyone has the right to grow old as they wish and no one should feel they can tell a lady what she should do , said Renata Polverini , an FI MP . "
no one,feel.02,they can tell,,Affirmative,"Everyone has the right to grow old as they wish and no one should feel they can tell a lady what she should do , said Renata Polverini , an FI MP . "
they,tell.01,what she should do,a lady,Affirmative,"Everyone has the right to grow old as they wish and no one should feel they can tell a lady what she should do , said Renata Polverini , an FI MP . "
"Renata Polverini ,",say.01,Everyone has,,Affirmative,"Everyone has the right to grow old as they wish and no one should feel they can tell a lady what she should do , said Renata Polverini , an FI MP . "
Alessandra Moretti,say.01,piece was,,Affirmative,"Alessandra Moretti , from the centre-left Democratic party , said the Chi piece was an example of a last legacy of macho culture that wants to chain us women to a stereotype of beauty . "
macho culture,want.01,to chain us women to,,Affirmative,"Alessandra Moretti , from the centre-left Democratic party , said the Chi piece was an example of a last legacy of macho culture that wants to chain us women to a stereotype of beauty . "
macho culture,chain.01,women,to,Affirmative,"Alessandra Moretti , from the centre-left Democratic party , said the Chi piece was an example of a last legacy of macho culture that wants to chain us women to a stereotype of beauty . "
She,cite.01,winning actor,,Affirmative,"She cited the formidable Oscar - winning actor Anna Magnani , famed not only for her films but for having defended her wrinkles . "
"Lorella Zanardo , director of",say.01,she gave Lario,,Affirmative,"Lorella Zanardo , director of a 2009 documentary entitled Il Corpo delle Donne ( Women 's Bodies ) , also said she gave Lario her total solidarity . "
-LSB-,give.01,her total solidarity,Lario,Affirmative,"Lorella Zanardo , director of a 2009 documentary entitled Il Corpo delle Donne ( Women 's Bodies ) , also said she gave Lario her total solidarity . "
Older women,represent.01,4.8 % of,,Affirmative,Older women represent just 4.8 % of [ faces on ] TV ... 
The media,represent.01,women,,Affirmative,"The media must represent women as they are and must give space not only to women who have had cosmetic surgery but to those who age with their own face , she was quoted as saying . "
they,give.01,space,to women,Affirmative,"The media must represent women as they are and must give space not only to women who have had cosmetic surgery but to those who age with their own face , she was quoted as saying . "
women,have.03,cosmetic surgery,,Affirmative,"The media must represent women as they are and must give space not only to women who have had cosmetic surgery but to those who age with their own face , she was quoted as saying . "
I,read.01,] interview,,Affirmative,"As soon as I read her [ Lario 's ] interview , I laughed , Alfonso Signorini , editor of Chi , told Il Messaggero . "
I,laugh.01,", told",,Affirmative,"As soon as I read her [ Lario 's ] interview , I laughed , Alfonso Signorini , editor of Chi , told Il Messaggero . "
Italy,have.03,all the problems,,Affirmative,"With all the problems that Italy has , is Veronica Lario 's cellulite really becoming a national political problem ? "
politicians and intellectuals,concern.02,themselves,,Affirmative,But politicians and intellectuals should concern themselves with much more serious matters . 
Miriam Bartolini -,accuse.01,the magazine,of setting,Affirmative,"In her attack , Lario - whose real name is Miriam Bartolini - accused the magazine of setting a bad example to young women who today ask for liposuction for their birthday and said its use of so - called medical experts was ethically reprehensible . "
the magazine,set.02,a bad example to,,Affirmative,"In her attack , Lario - whose real name is Miriam Bartolini - accused the magazine of setting a bad example to young women who today ask for liposuction for their birthday and said its use of so - called medical experts was ethically reprehensible . "
young women,ask.02,for liposuction,,Affirmative,"In her attack , Lario - whose real name is Miriam Bartolini - accused the magazine of setting a bad example to young women who today ask for liposuction for their birthday and said its use of so - called medical experts was ethically reprehensible . "
Signorini,have.03,none of it,,Affirmative,But Signorini was having none of it . 
some reports,represent.01,a good model for,,Affirmative,"Mrs Lario , when she was very young , posed for some reports that did not represent a good model for 16 - year - olds then or now , he said . "
he,say.01,"Mrs Lario ,",,Affirmative,"Mrs Lario , when she was very young , posed for some reports that did not represent a good model for 16 - year - olds then or now , he said . "
I,like.02,to ask :,,Affirmative,"Also , to her who speaks of examples , I would like to ask : do you think it sets a good example , for a country like ours in crisis and with many Italians almost reduced to starvation , to live on Berlusconi 's €47,000 a day ? "
I,ask.01,do you think,,Affirmative,"Also , to her who speaks of examples , I would like to ask : do you think it sets a good example , for a country like ours in crisis and with many Italians almost reduced to starvation , to live on Berlusconi 's €47,000 a day ? "
you,think.01,it sets,,Affirmative,"Also , to her who speaks of examples , I would like to ask : do you think it sets a good example , for a country like ours in crisis and with many Italians almost reduced to starvation , to live on Berlusconi 's €47,000 a day ? "
it,set.02,a good example,,Affirmative,"Also , to her who speaks of examples , I would like to ask : do you think it sets a good example , for a country like ours in crisis and with many Italians almost reduced to starvation , to live on Berlusconi 's €47,000 a day ? "
Lario,receive.01,€1.4 m,from Berlusconi,Affirmative,"The figure appeared to be a reference to a temporary alimony agreement , according to which Lario reportedly receives €1.4 m a month from Berlusconi . "
The ex-couple,agree.01,to,,Affirmative,The ex-couple have agreed to a divorce but the financial settlement remains subject to court proceedings . 
she,ask.02,for,,Affirmative,"According to a report earlier this month , she asked for a one - off payment of €540m . "
Lario,meet.02,"Berlusconi ,",,Affirmative,"Lario first met Berlusconi , a television magnate whose channels abound with scantily - clad showgirls , during a performance in a Milan theatre in 1980 in which she appeared topless . "
The couple,have.03,three children,,Affirmative,The couple went on to have three children together . 
SheLario,announce.01,she was leaving him,,Affirmative,SheLario announced she was leaving him after reports surfaced that he had attended the 18th birthday party of a young woman who reportedly called him Daddy . 
she,leave.01,him,,Affirmative,SheLario announced she was leaving him after reports surfaced that he had attended the 18th birthday party of a young woman who reportedly called him Daddy . 
he,attend.01,the 18th birthday party of,,Affirmative,SheLario announced she was leaving him after reports surfaced that he had attended the 18th birthday party of a young woman who reportedly called him Daddy . 
a young woman,call.01,him,Daddy,Affirmative,SheLario announced she was leaving him after reports surfaced that he had attended the 18th birthday party of a young woman who reportedly called him Daddy . 
"Berlusconi , 77 ,",serve.01,community service,,Affirmative,"Berlusconi , 77 , currently serving community service for a tax fraud conviction and expelled from the Italian senate , is now dating former television showgirl Francesca Pascale . "
