A0,A0.35_Verb,A1,A2,Polarity,RelatedSentence
local residents,spend.01,just another quiet weekend,as usual,Affirmative,"On the day when nationwide anti-China protests had been expected to burst in Vietnam , local residents spent just another quiet weekend as usual but under tightened security both on the streets and on the Internet . "
Vietnamese rioters,rampage.01,into hundreds of,,Affirmative,Vietnamese rioters have rampaged into hundreds of foreign factories in Ha Tinh Province and three provinces near Ho Chi Minh City in the south since May 13 during violent protests . 
Related violence,leave.01,two Chinese killed and,,Affirmative,Related violence has left two Chinese killed and more than 100 injured . 
Vietnamese ships and personnel,harass.01,the normal operations,by,Affirmative,The protests came after Vietnamese ships and personnel repeatedly harassed the normal operations by a Chinese oil company in undisputed waters in the South China Sea . 
Vietnamese authorities,urge.01,the People 's,to protest in,Affirmative,Vietnamese authorities have urged the people to protest in a peaceful way and said the government would not tolerate any more illegal activities and trouble - makers . 
Vietnamese authorities,say.01,government would not tolerate,,Affirmative,Vietnamese authorities have urged the people to protest in a peaceful way and said the government would not tolerate any more illegal activities and trouble - makers . 
the government,tolerate.01,any more illegal activities and,,Affirmative,Vietnamese authorities have urged the people to protest in a peaceful way and said the government would not tolerate any more illegal activities and trouble - makers . 
century building shooting pictures,shoot.01,pictures,,Affirmative,A local young couple in wedding dresses were also seen with a photographer outside the 19th - century building shooting pictures . 
government workers,use.01,loudspeakers,to urge citizens,Affirmative,"On the main streets , government workers were cruising in vehicles and using loudspeakers to urge citizens to ignore extremists ' incitement and not to participate in illegal protests . "
government workers,urge.01,citizens,to ignore,Affirmative,"On the main streets , government workers were cruising in vehicles and using loudspeakers to urge citizens to ignore extremists ' incitement and not to participate in illegal protests . "
citizens,ignore.01,incitement,,Affirmative,"On the main streets , government workers were cruising in vehicles and using loudspeakers to urge citizens to ignore extremists ' incitement and not to participate in illegal protests . "
citizens,participate.01,in,,Affirmative,"On the main streets , government workers were cruising in vehicles and using loudspeakers to urge citizens to ignore extremists ' incitement and not to participate in illegal protests . "
police,take.01,A man,,Affirmative,"A man was blocked and his bag searched by security staff before police took him away in front of the People 's Committee , or government , of the city 's District One , where apparently the man attempted to demonstrate anti-China banners . "
the man,attempt.01,to demonstrate,,Affirmative,"A man was blocked and his bag searched by security staff before police took him away in front of the People 's Committee , or government , of the city 's District One , where apparently the man attempted to demonstrate anti-China banners . "
the man,demonstrate.01,anti-China banners,,Affirmative,"A man was blocked and his bag searched by security staff before police took him away in front of the People 's Committee , or government , of the city 's District One , where apparently the man attempted to demonstrate anti-China banners . "
a Xinhua team,try.01,to record,,Affirmative,"When a Xinhua team tried to record a video footage , security men showed up and prohibited them from doing so . "
a Xinhua team,record.01,a video footage,,Affirmative,"When a Xinhua team tried to record a video footage , security men showed up and prohibited them from doing so . "
security men,prohibit.01,security men,from doing so,Affirmative,"When a Xinhua team tried to record a video footage , security men showed up and prohibited them from doing so . "
security men,do.02,so,,Affirmative,"When a Xinhua team tried to record a video footage , security men showed up and prohibited them from doing so . "
Vietnamese security authorities,reinforce.01,police protection for,,Affirmative,"Vietnamese security authorities have reinforced police protection for the Chinese Consulate General in Ho Chi Minh City , which has been a major target of Vietnamese protesters . "
Some protestors,attempt.01,to break in,,Affirmative,Some protestors even attempted to break in last week . 
20 uniformed guards wearing,wear.01,proof vests,,Affirmative,"In addition to the routine deployment of two policemen at the consulate 's front gate , more than 20 uniformed guards wearing bullet - proof vests and carrying rifles were stationed to defend two crossroads near the Chinese diplomatic mission throughout the day . "
20 uniformed guards wearing,carry.01,rifles,,Affirmative,"In addition to the routine deployment of two policemen at the consulate 's front gate , more than 20 uniformed guards wearing bullet - proof vests and carrying rifles were stationed to defend two crossroads near the Chinese diplomatic mission throughout the day . "
20 uniformed guards wearing,defend.01,two crossroads,,Affirmative,"In addition to the routine deployment of two policemen at the consulate 's front gate , more than 20 uniformed guards wearing bullet - proof vests and carrying rifles were stationed to defend two crossroads near the Chinese diplomatic mission throughout the day . "
Minister Nguyen Tan Dung,send.01,three text messages,to,Affirmative,"Vietnamese Prime Minister Nguyen Tan Dung sent three text messages via telecom networks to almost all mobile phone users in the country on Sunday , urging citizens not to participate in any protests without government permission . "
Minister Nguyen Tan Dung,urge.01,citizens,not to participate in,Affirmative,"Vietnamese Prime Minister Nguyen Tan Dung sent three text messages via telecom networks to almost all mobile phone users in the country on Sunday , urging citizens not to participate in any protests without government permission . "
citizens,participate.01,in,,Affirmative,"Vietnamese Prime Minister Nguyen Tan Dung sent three text messages via telecom networks to almost all mobile phone users in the country on Sunday , urging citizens not to participate in any protests without government permission . "
the People 's,use.01,the Internet,to organize protests or demonstrations,Affirmative,"To prevent people from using the Internet to organize protests or demonstrations , Vietnamese authorities shut down access to Facebook during Sunday 's daytime . "
the People 's,organize.01,protests or demonstrations,,Affirmative,"To prevent people from using the Internet to organize protests or demonstrations , Vietnamese authorities shut down access to Facebook during Sunday 's daytime . "
Vietnamese authorities,shut.05,access to Facebook,,Affirmative,"To prevent people from using the Internet to organize protests or demonstrations , Vietnamese authorities shut down access to Facebook during Sunday 's daytime . "
Xinhua,learn.01,demonstrations took place on Sunday,from sources throughout,Affirmative,Xinhua learned from sources throughout the country that no large - scale demonstrations took place on Sunday . 
by rioters,storm.02,a factory of,,Affirmative,"In Binh Duong Province , where a factory of Taiwan - based Formosa Plastics Group was stormed by rioters on May 13 , police arrested another seven people who participated in the deadly riots and were suspected of stealing from the factories . "
police,arrest.01,another seven people,,Affirmative,"In Binh Duong Province , where a factory of Taiwan - based Formosa Plastics Group was stormed by rioters on May 13 , police arrested another seven people who participated in the deadly riots and were suspected of stealing from the factories . "
another seven people,participate.01,in,,Affirmative,"In Binh Duong Province , where a factory of Taiwan - based Formosa Plastics Group was stormed by rioters on May 13 , police arrested another seven people who participated in the deadly riots and were suspected of stealing from the factories . "
The suspects,say.01,they were regretful for,,Affirmative,"The suspects said they were regretful for their behavior and wanted to return the stolen products to the factories , hoping that they could be forgiven . "
The suspects,want.01,to return,,Affirmative,"The suspects said they were regretful for their behavior and wanted to return the stolen products to the factories , hoping that they could be forgiven . "
the stolen products,hope.01,that they could be forgiven,,Affirmative,"The suspects said they were regretful for their behavior and wanted to return the stolen products to the factories , hoping that they could be forgiven . "
Beijing,condemn.01,the violence in Vietnam,,Affirmative,"Beijing has condemned the violence in Vietnam against foreign investors and companies , and stressed that Vietnam bears unshirkable responsibility for the violent attacks against Chinese companies and nationals . "
Beijing,stress.01,that Vietnam bears,,Affirmative,"Beijing has condemned the violence in Vietnam against foreign investors and companies , and stressed that Vietnam bears unshirkable responsibility for the violent attacks against Chinese companies and nationals . "
Vietnam,bear.01,unshirkable responsibility for,,Affirmative,"Beijing has condemned the violence in Vietnam against foreign investors and companies , and stressed that Vietnam bears unshirkable responsibility for the violent attacks against Chinese companies and nationals . "
Minister Wang Yi,demand.01,that Vietnam take,,Affirmative,"Chinese Foreign Minister Wang Yi has demanded that Vietnam take resolute and effective measures to stop all violence , ensure the safety of all Chinese nationals and companies , punish all perpetrators and compensate affected Chinese companies and nationals . "
Vietnam,take.01,measures,,Affirmative,"Chinese Foreign Minister Wang Yi has demanded that Vietnam take resolute and effective measures to stop all violence , ensure the safety of all Chinese nationals and companies , punish all perpetrators and compensate affected Chinese companies and nationals . "
Vietnam,ensure.01,the safety of,,Affirmative,"Chinese Foreign Minister Wang Yi has demanded that Vietnam take resolute and effective measures to stop all violence , ensure the safety of all Chinese nationals and companies , punish all perpetrators and compensate affected Chinese companies and nationals . "
Vietnam,punish.01,all perpetrators,,Affirmative,"Chinese Foreign Minister Wang Yi has demanded that Vietnam take resolute and effective measures to stop all violence , ensure the safety of all Chinese nationals and companies , punish all perpetrators and compensate affected Chinese companies and nationals . "
CRIENGLISH.com,claim.01,the copyright of,,Affirmative,CRIENGLISH.com claims the copyright of all material and information produced originally by our staff . 
by,produce.01,all material and information produced originally by,,Affirmative,CRIENGLISH.com claims the copyright of all material and information produced originally by our staff . 
