A0,A0.35_Verb,A1,A2,Polarity,RelatedSentence
U.N. rights experts and Britain on Monday,speak.03,against,,Affirmative,U.N. rights experts and Britain on Monday spoke out against a Sudanese court order to hang a pregnant Christian woman for marrying a Christian man and refusing to renounce her faith . 
"Meriam Yahia Ibrahim Ishag ,",make.05,conversions of faith punishable by death,,Affirmative,"Meriam Yahia Ibrahim Ishag , a 27 - year - old who is eight months pregnant with her second child , was convicted last week under the Islamic sharia law that has been in force in Sudan since 1983 and makes conversions of faith punishable by death . "
the U.N. experts on,insist.01,conviction must be overturned and,,Affirmative,"This outrageous conviction must be overturned and Ms. Ibrahim must be immediately released , insisted the U.N. experts on a range of issues , including the human rights situation in Sudan , violence against women , minorities and the freedom of religion or belief . "
U.N. rights experts and Britain on Monday,stress.01,penalty may only be imposed for,,Affirmative,"They stressed in a statement that under international law , the death penalty may only be imposed for the most serious crimes , if at all , AFP reported . "
U.N. rights experts and Britain on Monday,say.01,", it is",,Affirmative,"On the contrary , it is a basic human right , the experts said . "
Britain 's,summon.01,the Sudanese charge d'affaires,,Affirmative,Britain summoned the Sudanese charge d'affaires on Monday to protest the death sentence . 
Britain 's,protest.01,the death sentence,,Affirmative,Britain summoned the Sudanese charge d'affaires on Monday to protest the death sentence . 
foreign office,say.01,sentence was barbaric and asked,,Affirmative,Britain 's foreign office said the sentence was barbaric and asked Sudanese Charge d'Affaires Bukhari Afandi to urge his government to uphold its international obligations on freedom of religion or belief and do all it can to overturn this decision . 
the death sentence,ask.02,to urge,d'Affaires Bukhari Afandi,Affirmative,Britain 's foreign office said the sentence was barbaric and asked Sudanese Charge d'Affaires Bukhari Afandi to urge his government to uphold its international obligations on freedom of religion or belief and do all it can to overturn this decision . 
d'Affaires Bukhari Afandi,urge.01,his government,to uphold,Affirmative,Britain 's foreign office said the sentence was barbaric and asked Sudanese Charge d'Affaires Bukhari Afandi to urge his government to uphold its international obligations on freedom of religion or belief and do all it can to overturn this decision . 
his government,uphold.01,its international obligations,,Affirmative,Britain 's foreign office said the sentence was barbaric and asked Sudanese Charge d'Affaires Bukhari Afandi to urge his government to uphold its international obligations on freedom of religion or belief and do all it can to overturn this decision . 
his government,do.02,all,,Affirmative,Britain 's foreign office said the sentence was barbaric and asked Sudanese Charge d'Affaires Bukhari Afandi to urge his government to uphold its international obligations on freedom of religion or belief and do all it can to overturn this decision . 
The young mother,renounce.01,Islam --,,Affirmative,"The young mother was found guilty of apostasy , or publicly renouncing Islam -- a faith she never professed -- and sentenced to hang after she refused to return to the Muslim religion . "
The young mother,profess.01,a faith,,Affirmative,"The young mother was found guilty of apostasy , or publicly renouncing Islam -- a faith she never professed -- and sentenced to hang after she refused to return to the Muslim religion . "
The young mother,refuse.01,to return to,,Affirmative,"The young mother was found guilty of apostasy , or publicly renouncing Islam -- a faith she never professed -- and sentenced to hang after she refused to return to the Muslim religion . "
to,bear.02,"Ishag ,",,Affirmative,"Ishag , who was born to a Christian mother and Muslim father , was also sentenced to 100 lashes for adultery , for living with the Christian man she has been married to since 2012 . "
U.N. rights experts and Britain on Monday,find.01,family was,,Affirmative,"The U.N. experts said that the right to marry and found a family was a fundamental human right , and voiced particular concern that Ishag was being held with her 20 - month - old son in harsh conditions at the Omdurman 's Women Prison near Khartoum . "
a family,voice.01,particular concern,,Affirmative,"The U.N. experts said that the right to marry and found a family was a fundamental human right , and voiced particular concern that Ishag was being held with her 20 - month - old son in harsh conditions at the Omdurman 's Women Prison near Khartoum . "
U.N. rights experts and Britain on Monday,warn.01,is,,Affirmative,"The imposition and enforcement of the death penalty on pregnant women or recent mothers is inherently cruel and leads to a violation of the absolute prohibition of torture and other cruel , inhuman or degrading treatment or punishment , they warned . "
The U.N. experts,call.05,to repeal,,Affirmative,"The U.N. experts called on Sudan to repeal all discriminatory laws , adding there was a pressing need to address the pattern of discrimination , abuse and torture as well as the subjugation and denigration of women in the country . "
The U.N. experts,repeal.01,all discriminatory laws,,Affirmative,"The U.N. experts called on Sudan to repeal all discriminatory laws , adding there was a pressing need to address the pattern of discrimination , abuse and torture as well as the subjugation and denigration of women in the country . "
The U.N. experts,add.01,there was,,Affirmative,"The U.N. experts called on Sudan to repeal all discriminatory laws , adding there was a pressing need to address the pattern of discrimination , abuse and torture as well as the subjugation and denigration of women in the country . "
Daniel Wani,say.01,that police prevented him from attending,,Affirmative,He said in an interview with VOA last week that police prevented him from attending his wife 's final appeal but that he will continue to fight for her life . 
Daniel Wani,attend.01,final appeal,,Affirmative,He said in an interview with VOA last week that police prevented him from attending his wife 's final appeal but that he will continue to fight for her life . 
Daniel Wani,continue.01,to fight for,,Affirmative,He said in an interview with VOA last week that police prevented him from attending his wife 's final appeal but that he will continue to fight for her life . 
"information minister ,",say.01,was not final,,Affirmative,"Sudan 's information minister , Ahmed Bilal , said last week that the the death sentence against Mariam was not final . "
Ahmed Bilal,say.01,", was opposed to",,Affirmative,"Even Sudan 's Grand Mufti , the highest religious authority in the country , was opposed to the harsh sentence against the young woman , Bilal said . "
Mufti Isam Ahmed Elbashir,say.01,Mariam should have been given,,Affirmative,"According to Bilal , Grand Mufti Isam Ahmed Elbashir said Mariam should have been given more time to decide whether or not she wanted to convert to Islam . "
Mariam,decide.01,whether or not she wanted,,Affirmative,"According to Bilal , Grand Mufti Isam Ahmed Elbashir said Mariam should have been given more time to decide whether or not she wanted to convert to Islam . "
Mariam,want.01,to convert to Islam,,Affirmative,"According to Bilal , Grand Mufti Isam Ahmed Elbashir said Mariam should have been given more time to decide whether or not she wanted to convert to Islam . "
The U.S. State Department,say.01,it was,,Affirmative,The U.S. State Department said it was deeply disturbed by the sentence of death by hanging imposed on Mariam but understood that the sentence was open to appeal . 
by,disturb.01,The U.S. State Department,,Affirmative,The U.S. State Department said it was deeply disturbed by the sentence of death by hanging imposed on Mariam but understood that the sentence was open to appeal . 
Sudan 's,have.03,an Islamist government,,Affirmative,"Sudan has an Islamist government but , other than floggings , extreme sharia law punishments have been rare . "
"Christian Solidarity Worldwide ,",say.01,", Ishag will be",,Affirmative,"If the death sentence is carried out , Ishag will be the first person executed for apostasy under the 1991 penal code , Christian Solidarity Worldwide , a British - based campaign group , said last week . "
by AFP and Reuters,provided.01,Some information provided by AFP and Reuters,,Affirmative,Some information provided by AFP and Reuters . 
denigration of women,include.01,service in Vietnam,,Affirmative,"I am a retired USAF Major , including service in Vietnam . "
Meriam Yahia Ibrahim Ishag,renounce.01,her Christian Faith,,Affirmative,Mrs. Ibrahim will not renounce her Christian Faith and neither will I. She would be returned intact to her family who could flee Africa and be granted permanent asylum in another country . 
her family,flee.01,Africa,,Affirmative,Mrs. Ibrahim will not renounce her Christian Faith and neither will I. She would be returned intact to her family who could flee Africa and be granted permanent asylum in another country . 
I,have.03,many failings,,Affirmative,"I have many failings ; however , lying is NOT one of them . "
by,sign.01,a document signed by,,Affirmative,There is a document signed by prophet Muhammad that proves that this women is Innocent . 
prophet Muhammad,prove.01,women is Innocent,,Affirmative,There is a document signed by prophet Muhammad that proves that this women is Innocent . 
those,adopt.01,Christianity,,Affirmative,"This is a message from Muhammad ibn Abdullah , as a covenant to those who adopt Christianity , near and far , we are with them . "
my followers,defend.01,"those who adopt Christianity , near and far",,Affirmative,"Verily I , the servants , the helpers , and my followers defend them , because Christians are my citizens ; and by Allah ! "
denigration of women,hold.06,against anything,,Affirmative,I hold out against anything that displeases them . 
anything,displease.01,the servants,,Affirmative,I hold out against anything that displeases them . 
No one,destroy.01,a house of,,Affirmative,"No one is to destroy a house of their religion , to damage it , or to carry anything from it to the Muslims ' houses . "
anyone,take.01,any of these,,Affirmative,"Should anyone take any of these , he would spoil God 's covenant and disobey His Prophet . "
he,spoil.01,covenant,,Affirmative,"Should anyone take any of these , he would spoil God 's covenant and disobey His Prophet . "
he,disobey.01,His Prophet,,Affirmative,"Should anyone take any of these , he would spoil God 's covenant and disobey His Prophet . "
they,have.03,my secure charter against all,,Affirmative,"Verily , they are my allies and have my secure charter against all that they hate . "
they,hate.01,all,,Affirmative,"Verily , they are my allies and have my secure charter against all that they hate . "
No one,force.01,them,to travel or,Affirmative,No one is to force them to travel or to oblige them to fight . 
them,oblige.02,them,to fight,Affirmative,No one is to force them to travel or to oblige them to fight . 
you,have.03,an old version of,,Affirmative,Your JavaScript is turned off or you have an old version of Adobe 's Flash Player . 
Jewish people from across Europe and Russia,immigrate.01,to Argentina,,Affirmative,Jewish people from across Europe and Russia have been immigrating to Argentina for hundreds of years . 
They,bring.01,dance music,,Affirmative,They brought with them dance music that was eventually mixed with Argentine tango . 
Elizabeth Lee,report.01,on,,Affirmative,Elizabeth Lee reports on how one band is bringing Yiddish tango to Los Angeles . 
one band,bring.01,Yiddish tango,to,Affirmative,Elizabeth Lee reports on how one band is bringing Yiddish tango to Los Angeles . 
