A0,A0.35_Verb,A1,A2,Polarity,RelatedSentencethe broadband carriers,use.01,access monopoly,to hold,Affirmative,"Any other solution means that the broadband carriers are using terminal access monopoly to hold the internet hostage , or more specifically to demand random from the edge providers , think Google and Netflix , from having access to Comcast 's customers . "
the broadband carriers,hold.01,the internet hostage,,Affirmative,"Any other solution means that the broadband carriers are using terminal access monopoly to hold the internet hostage , or more specifically to demand random from the edge providers , think Google and Netflix , from having access to Comcast 's customers . "
Google and Netflix,have.03,access to,,Affirmative,"Any other solution means that the broadband carriers are using terminal access monopoly to hold the internet hostage , or more specifically to demand random from the edge providers , think Google and Netflix , from having access to Comcast 's customers . "
the broadband carriers,conduct.01,A public utility,,Affirmative,"The fact that broadband carriers have conducted their business according to this principle , until now , is the only reason that this amazing cacophony we call the internet exists in it 's present form . "
we,call.01,internet exists in it,,Affirmative,"The fact that broadband carriers have conducted their business according to this principle , until now , is the only reason that this amazing cacophony we call the internet exists in it 's present form . "
"Comcast , of course",argue.01,providers will pay,,Affirmative,"Comcast , of course argues that the long haul internet providers will pay each other fees for when they receive more data than they receive . "
haul internet providers,pay.01,each other fees for,,Affirmative,"Comcast , of course argues that the long haul internet providers will pay each other fees for when they receive more data than they receive . "
the long haul internet providers,receive.01,more data,,Affirmative,"Comcast , of course argues that the long haul internet providers will pay each other fees for when they receive more data than they receive . "
the long haul internet providers,have.03,the consumer,,Affirmative,The long haul providers do n't have the consumer as their client and do n't have the power to cut off businesses who want to send data to consumers like the broadband carriers . 
the long haul internet providers,have.03,the power,,Affirmative,The long haul providers do n't have the consumer as their client and do n't have the power to cut off businesses who want to send data to consumers like the broadband carriers . 
businesses,want.01,to send data to consumers like,,Affirmative,The long haul providers do n't have the consumer as their client and do n't have the power to cut off businesses who want to send data to consumers like the broadband carriers . 
businesses,send.01,data,to consumers like,Affirmative,The long haul providers do n't have the consumer as their client and do n't have the power to cut off businesses who want to send data to consumers like the broadband carriers . 
the United States,mean.01,toe,,Affirmative,"What I meant toe says was It 's the principle that the broadband carriers charge only THE CONSUMER , who is their client , for the cost of delivering a specific level of service . "
the broadband carriers,charge.01,"only THE CONSUMER ,",,Affirmative,"What I meant toe says was It 's the principle that the broadband carriers charge only THE CONSUMER , who is their client , for the cost of delivering a specific level of service . "
"Australia , where the ACCC finally declared wholesale ADSL services in 2012",have.03,lower population density than,,Affirmative,Australia has a vastly lower population density than the US . 
the taxpayer,subsidise.01,broadband of,,Affirmative,b ) Why should the taxpayer subsidise broadband of any form to regional or high cost areas . 
the United States,say.01,take it away,,Affirmative,"As I said take it away , including the private network of any variety . "
Turnbull et al,argue.01,"Government owned , maintained and regulated",,Affirmative,"how Turnbull et al can argue that a Government owned , maintained and regulated internet infrastructure layer can negatively impact business . "
It,provide.01,everyone in,,Affirmative,"It will provide everyone in the country with access to the internet to build , create and participate in old and new business and allow the country as a whole to develop . "
Customers in cities,subsidise.01,their rural countrymen,,Affirmative,Customers in cities effectively subsidise their rural countrymen because they do n't get a discount through economy of scale and ISP type businesses do n't get the opportunity to create their own mini-monopolies through cherry - picking and the construction of their own infrastructure . 
they,get.01,a discount,through economy of scale,Affirmative,Customers in cities effectively subsidise their rural countrymen because they do n't get a discount through economy of scale and ISP type businesses do n't get the opportunity to create their own mini-monopolies through cherry - picking and the construction of their own infrastructure . 
ISP type businesses,get.01,the opportunity,,Affirmative,Customers in cities effectively subsidise their rural countrymen because they do n't get a discount through economy of scale and ISP type businesses do n't get the opportunity to create their own mini-monopolies through cherry - picking and the construction of their own infrastructure . 
I,see.01,is,,Affirmative,I do n't see how the interests of a few companies and the minor financial burden incurred by some customers is more important than lifting the collective country out of what is effectively our digital dark ages . 
by,incur.01,the minor financial burden incurred by,,Affirmative,I do n't see how the interests of a few companies and the minor financial burden incurred by some customers is more important than lifting the collective country out of what is effectively our digital dark ages . 
I,see.01,is,,Affirmative,I do n't see how the interests of a few companies and the minor financial burden incurred by some customers is more important than lifting the collective country out of what is effectively our digital dark ages . 
by,incur.01,the minor financial burden incurred by,,Affirmative,I do n't see how the interests of a few companies and the minor financial burden incurred by some customers is more important than lifting the collective country out of what is effectively our digital dark ages . 
ZDNet,read.01,News Alerts - US,,Affirmative,ZDNet Must Read News Alerts - US : Major news is breaking . 
This newsletter,have.03,news nothing else,,Affirmative,This newsletter has only the most important tech news nothing else . 
you,deploy.01,management solutions,,Affirmative,"Learn how you can deploy best - of - breed revenue management solutions that drive scalable , proactive processes . "
management solutions,drive.01,"scalable , proactive processes",,Affirmative,"Learn how you can deploy best - of - breed revenue management solutions that drive scalable , proactive processes . "
"this live , interactive webcast featuring",feature.01,Featured Contributor Bill Kleyman and,,Affirmative,"Join us for this live , interactive webcast featuring CBS Interactive 's Featured Contributor Bill Kleyman and Intacct 's Cloud Financials Strategist Mark Gervase . "
you,deploy.01,management solutions,,Affirmative,"Learn how you can deploy best - of - breed revenue management solutions that drive scalable , proactive processes . "
management solutions,drive.01,"scalable , proactive processes",,Affirmative,"Learn how you can deploy best - of - breed revenue management solutions that drive scalable , proactive processes . "
"this live , interactive webcast featuring",feature.01,Featured Contributor Bill Kleyman and,,Affirmative,"Join us for this live , interactive webcast featuring CBS Interactive 's Featured Contributor Bill Kleyman and Intacct 's Cloud Financials Strategist Mark Gervase . "
