A0,A0.35_Verb,A1,A2,Polarity,RelatedSentence
a top official from,tell.01,firm was not aware of,Congress,Affirmative,"Last year , a top official from big - three credit bureau Experian told Congress that the firm was not aware of any consumers that had been harmed by an incident in which a business unit of Experian sold consumer records directly to an online identity theft service for nearly 10 months . "
by,harm.01,any consumers,,Affirmative,"Last year , a top official from big - three credit bureau Experian told Congress that the firm was not aware of any consumers that had been harmed by an incident in which a business unit of Experian sold consumer records directly to an online identity theft service for nearly 10 months . "
a business unit of Experian,sell.01,consumer records,to,Affirmative,"Last year , a top official from big - three credit bureau Experian told Congress that the firm was not aware of any consumers that had been harmed by an incident in which a business unit of Experian sold consumer records directly to an online identity theft service for nearly 10 months . "
post,present.01,evidence,,Affirmative,"Today 's post presents evidence that among the ID theft service 's clients was an identity theft and credit card fraud ring of at least 32 people who were arrested last year for allegedly using the information to steal millions from more  than 1,000 victims across the country . "
New York,plead.02,guilty,to,Affirmative,"On March 31 , 2014 , 26 - year - old Idris Soyemi of Brooklyn , New York pleaded guilty in a New Hampshire court to one count of wire fraud . "
Soyemi on,buy.01,"Security numbers , dates of birth and",,Affirmative,"In Soyemi 's guilty plea hearing , the prosecutor laid out how Soyemi on several occasions bought Social Security numbers , dates of birth and other personal information from an online identity theft service run by guy named Hieu Minh Ngo . "
by guy named,run.01,theft service run by guy named,,Affirmative,"In Soyemi 's guilty plea hearing , the prosecutor laid out how Soyemi on several occasions bought Social Security numbers , dates of birth and other personal information from an online identity theft service run by guy named Hieu Minh Ngo . "
a Vietnamese national,run.01,theft service called superget.info,,Affirmative,Ngo is a Vietnamese national who for several years ran an online identity theft service called superget.info . 
Hieu Minh Ngo,rename.01,his site,to findget.me,Affirmative,"Shortly after my 2011 initial story about his service , Ngo tauntingly renamed his site to findget.me . "
The Secret Service,take.01,Hieu Minh Ngo,,Affirmative,"The Secret Service took him up on that challenge , and succeeded in luring him out of Vietnam into Guam , where he was arrested and brought to New Hampshire for trial . "
The Secret Service,succeed.01,in luring him out of Vietnam,,Affirmative,"The Secret Service took him up on that challenge , and succeeded in luring him out of Vietnam into Guam , where he was arrested and brought to New Hampshire for trial . "
Hieu Minh Ngo,plead.02,guilty,to running,Affirmative,"He pleaded guilty earlier this year to running the ID theft service , and the government has been working on rounding up his customers ever since . "
Hieu Minh Ngo,run.02,the ID theft service 's,,Affirmative,"He pleaded guilty earlier this year to running the ID theft service , and the government has been working on rounding up his customers ever since . "
the government,work.01,on rounding up,,Affirmative,"He pleaded guilty earlier this year to running the ID theft service , and the government has been working on rounding up his customers ever since . "
the government,round.02,his customers,,Affirmative,"He pleaded guilty earlier this year to running the ID theft service , and the government has been working on rounding up his customers ever since . "
Service agents,seize.01,control over,,Affirmative,"According to Soyemi 's guilty plea transcript   ( PDF ) , U.S. Secret Service agents seized control over Ngo 's email account in February 2013 and used it to interact with his customers . "
Service agents,use.01,Soyemi 's guilty plea transcript -LRB- PDF -RRB-,to interact with,Affirmative,"According to Soyemi 's guilty plea transcript   ( PDF ) , U.S. Secret Service agents seized control over Ngo 's email account in February 2013 and used it to interact with his customers . "
Service agents,interact.01,with,,Affirmative,"According to Soyemi 's guilty plea transcript   ( PDF ) , U.S. Secret Service agents seized control over Ngo 's email account in February 2013 and used it to interact with his customers . "
the undercover agent,pose.01,as Ngo,,Affirmative,"Posing as Ngo , the undercover agent reached out to Soyemi and wrote , I 'm back . "
the undercover agent,write.01,I 'm back,,Affirmative,"Posing as Ngo , the undercover agent reached out to Soyemi and wrote , I 'm back . "
You,do.02,tax refund or,,Affirmative,You doing tax refund or credit card ? 
26-year-old Idris Soyemi of Brooklyn,buy.01,personal data on consumers,,Affirmative,", asking Soyemi whether he was buying personal data on consumers to set up new lines of credit in their names or to file fraudulent tax refund requests with the IRS - a rapidly growing form of cybercrime . "
26-year-old Idris Soyemi of Brooklyn,do.02,credit cards,,Affirmative,"Soyemi responded , I do credit cards but can you tell me about tax refund ? "
you,tell.01,about,me,Affirmative,"Soyemi responded , I do credit cards but can you tell me about tax refund ? "
you,miss.02,story about,,Affirmative,"( if you missed last month 's story about an Ohio man who 's accused of using Ngo 's service to file at least 150 fraudulent tax refund requests with the IRS , check that out here ) . "
an Ohio man,use.01,service,to file,Affirmative,"( if you missed last month 's story about an Ohio man who 's accused of using Ngo 's service to file at least 150 fraudulent tax refund requests with the IRS , check that out here ) . "
by,name.01,another man named in,,Affirmative,"Further tying this group to Ngo 's service is a four - count indictment   ( PDF ) lodged against another man named in that identity theft ring roundup by the New Jersey prosecutor 's office : Oluwaseun Adekoya , 25 , of Sewaren , NJ . "
by,take.12,theft service,,Affirmative,Adekoya 's indictment makes numerous references to his alleged purchase of hundreds of consumer records from an online identity theft service that was taken over by U.S. Secret Service agents in February 2013 ( recall that in Soyemi 's guilty plea hearing government prosecutors said that in that same month undercover Secret Service agents assumed control of the email account tied to Ngo 's identity theft service ) . 
government prosecutors,say.01,agents assumed control of,,Affirmative,Adekoya 's indictment makes numerous references to his alleged purchase of hundreds of consumer records from an online identity theft service that was taken over by U.S. Secret Service agents in February 2013 ( recall that in Soyemi 's guilty plea hearing government prosecutors said that in that same month undercover Secret Service agents assumed control of the email account tied to Ngo 's identity theft service ) . 
Service agents,assume.02,control of,,Affirmative,Adekoya 's indictment makes numerous references to his alleged purchase of hundreds of consumer records from an online identity theft service that was taken over by U.S. Secret Service agents in February 2013 ( recall that in Soyemi 's guilty plea hearing government prosecutors said that in that same month undercover Secret Service agents assumed control of the email account tied to Ngo 's identity theft service ) . 
the group,direct.01,the activities of,,Affirmative,"According to the government , Adekoya was a ringleader among the group who directed the activities of several men , including Atlanta , Ga . "
theft ring,plead.02,guilty,,Affirmative,"resident Adebayo Adegbesan , another defendant in the identity theft ring who pleaded guilty in New Hampshire recently . "
A transcript of,mention.01,Ngo,,Affirmative,"A transcript of Adegbesan 's guilty plea hearing does n't mention Ngo , but it does reveal that the New Hampshire district court and the U.S. Attorney who is prosecuting the case - Arnold Huftalen - have their hands full processing a large number of defendants tied to the same case . "
it,reveal.01,- have,,Affirmative,"A transcript of Adegbesan 's guilty plea hearing does n't mention Ngo , but it does reveal that the New Hampshire district court and the U.S. Attorney who is prosecuting the case - Arnold Huftalen - have their hands full processing a large number of defendants tied to the same case . "
the U.S. Attorney,prosecute.01,Arnold Huftalen,,Affirmative,"A transcript of Adegbesan 's guilty plea hearing does n't mention Ngo , but it does reveal that the New Hampshire district court and the U.S. Attorney who is prosecuting the case - Arnold Huftalen - have their hands full processing a large number of defendants tied to the same case . "
Hampshire district court and,have.03,their hands,,Affirmative,"A transcript of Adegbesan 's guilty plea hearing does n't mention Ngo , but it does reveal that the New Hampshire district court and the U.S. Attorney who is prosecuting the case - Arnold Huftalen - have their hands full processing a large number of defendants tied to the same case . "
Prosecutors,tell.01,that they 'd hoped,the court,Affirmative,"Prosecutors told the court that they 'd hoped to lure Adekoya to New Hampshire after he 'd arranged to collect what he believed was more than $ 100,000 worth of bank account information encoded onto white plastic cards that could be used to pull cash out of ATMs . "
they,hope.01,to lure Adekoya to,,Affirmative,"Prosecutors told the court that they 'd hoped to lure Adekoya to New Hampshire after he 'd arranged to collect what he believed was more than $ 100,000 worth of bank account information encoded onto white plastic cards that could be used to pull cash out of ATMs . "
they,lure.01,Oluwaseun Adekoya,to,Affirmative,"Prosecutors told the court that they 'd hoped to lure Adekoya to New Hampshire after he 'd arranged to collect what he believed was more than $ 100,000 worth of bank account information encoded onto white plastic cards that could be used to pull cash out of ATMs . "
he,arrange.01,to collect,,Affirmative,"Prosecutors told the court that they 'd hoped to lure Adekoya to New Hampshire after he 'd arranged to collect what he believed was more than $ 100,000 worth of bank account information encoded onto white plastic cards that could be used to pull cash out of ATMs . "
he,collect.01,he believed was,,Affirmative,"Prosecutors told the court that they 'd hoped to lure Adekoya to New Hampshire after he 'd arranged to collect what he believed was more than $ 100,000 worth of bank account information encoded onto white plastic cards that could be used to pull cash out of ATMs . "
he,believe.01,was,,Affirmative,"Prosecutors told the court that they 'd hoped to lure Adekoya to New Hampshire after he 'd arranged to collect what he believed was more than $ 100,000 worth of bank account information encoded onto white plastic cards that could be used to pull cash out of ATMs . "
white plastic cards,pull.01,cash,out of ATMs,Affirmative,"Prosecutors told the court that they 'd hoped to lure Adekoya to New Hampshire after he 'd arranged to collect what he believed was more than $ 100,000 worth of bank account information encoded onto white plastic cards that could be used to pull cash out of ATMs . "
Adekoya,send.02,Adegbesan and,to pick up,Affirmative,"Instead , Adekoya allegedly sent Adegbesan and three others to pick up the cards . "
Adekoya,pick.04,the cards,,Affirmative,"Instead , Adekoya allegedly sent Adegbesan and three others to pick up the cards . "
I,enjoy.01,reading,,Affirmative,"I enjoyed reading the discussion between the court and Huftalen , particularly the part about the SODDI defense . "
I,read.01,the discussion between,,Affirmative,"I enjoyed reading the discussion between the court and Huftalen , particularly the part about the SODDI defense . "
the two,discuss.01,the large number of defendants related to,,Affirmative,"Here , the two are discussing the large number of defendants related to this case . "
I,see.01,come through now,,Affirmative,Just curious because I 've seen a few of them come through now . 
a Jr.,have.03,a number of these,,Affirmative,I seem to have a number of these with you right now . 
I,have.03,more,,Affirmative,"MR. HUFTALEN : I have more than I 'd like , and I 'm sure you do , too . "
People,do.02,this stuff,,Affirmative,THE COURT : People are told to come up to New Hampshire and do this stuff . 
You end,catch.01,a lot of people,,Affirmative,You end up catching a lot of people . 
some other dude,do.02,it,,Affirmative,"MR. HUFTALEN : The whole lure , I mean , is to eliminate this SODDI defense , S - O - D - D - I , some other dude did it . "
you,have.03,eyes,,Affirmative,"When you 're talking with somebody on the computer , as you know , unless you have eyes on him on the keyboard , there 's always that reasonable doubt . "
a Jr.,want.01,to see that,,Affirmative,"I 'm curious about it and I of course want to see that , to the extent I have responsibilities with respect to it , that I fulfill those responsibilities , and I 'm just learning about it , trying to understand it . "
a Jr.,see.01,that,,Affirmative,"I 'm curious about it and I of course want to see that , to the extent I have responsibilities with respect to it , that I fulfill those responsibilities , and I 'm just learning about it , trying to understand it . "
a Jr.,have.03,responsibilities,,Affirmative,"I 'm curious about it and I of course want to see that , to the extent I have responsibilities with respect to it , that I fulfill those responsibilities , and I 'm just learning about it , trying to understand it . "
a Jr.,fulfill.01,those responsibilities,,Affirmative,"I 'm curious about it and I of course want to see that , to the extent I have responsibilities with respect to it , that I fulfill those responsibilities , and I 'm just learning about it , trying to understand it . "
a Jr.,learn.01,about it,,Affirmative,"I 'm curious about it and I of course want to see that , to the extent I have responsibilities with respect to it , that I fulfill those responsibilities , and I 'm just learning about it , trying to understand it . "
a Jr.,try.01,to understand it,,Affirmative,"I 'm curious about it and I of course want to see that , to the extent I have responsibilities with respect to it , that I fulfill those responsibilities , and I 'm just learning about it , trying to understand it . "
a Jr.,think.01,you will see,,Affirmative,MR. HUFTALEN : I do n't think you will see a whole lot more of these . 
you,see.01,lot more of these,,Affirmative,MR. HUFTALEN : I do n't think you will see a whole lot more of these . 
you,have.03,creative active agent,,Affirmative,THE COURT : It seems like you have a very creative active agent who 's working with you on at least some of these cases and I just was wondering . 
creative active agent,work.01,on,,Affirmative,THE COURT : It seems like you have a very creative active agent who 's working with you on at least some of these cases and I just was wondering . 
he and I,target.01,the targets,,Affirmative,MR. HUFTALEN : And the targets that he and I are targeting are not like the person who 's sitting here in court today . 
Several state attorneys general,investigate.01,the apparent breach at,,Affirmative,Several state attorneys general are now investigating the apparent breach at Experian 's subsidiary . 
US Info Search,have.03,a contractual agreement with,,Affirmative,"US Info Search had a contractual agreement with a California company named Court Ventures , whereby customers of Court Ventures had access to the US Info Search data as well as Court Ventures ' data , and vice versa . "
customers of,have.03,access to,,Affirmative,"US Info Search had a contractual agreement with a California company named Court Ventures , whereby customers of Court Ventures had access to the US Info Search data as well as Court Ventures ' data , and vice versa . "
it,purchase.01,Court Ventures,,Affirmative,"Experian came into the picture in March 2012 , when it purchased Court Ventures ( along with all of its customers - including Mr. Ngo ) . "
Experian,complete.01,that acquisition,,Affirmative,"For almost ten months after Experian completed that acquisition , Ngo continued siphoning consumer data and making his wire transfers . "
Ngo,continue.01,siphoning,,Affirmative,"For almost ten months after Experian completed that acquisition , Ngo continued siphoning consumer data and making his wire transfers . "
Ngo,siphon.02,consumer data,,Affirmative,"For almost ten months after Experian completed that acquisition , Ngo continued siphoning consumer data and making his wire transfers . "
A transcript ( PDF ) of,show.01,business attracted,,Affirmative,"A transcript ( PDF ) of Ngo 's guilty plea proceedings shows that his ID theft business attracted more than 1,300 customers who paid at least $ 1.9 million between 2007 and Feb . "
theft business,attract.01,"1,300 customers",,Affirmative,"A transcript ( PDF ) of Ngo 's guilty plea proceedings shows that his ID theft business attracted more than 1,300 customers who paid at least $ 1.9 million between 2007 and Feb . "
"1,300 customers",pay.01,least $ 1.9 million,,Affirmative,"A transcript ( PDF ) of Ngo 's guilty plea proceedings shows that his ID theft business attracted more than 1,300 customers who paid at least $ 1.9 million between 2007 and Feb . "
big-three credit bureau Experian,maintain.01,database was accessed in,,Affirmative,"Meanwhile , Experian has maintained that no Experian database was accessed in the fraud stemming from Ngo 's identity theft service . "
Experian,assert.03,a little SOFDI smokescreen of,,Affirmative,Seems to me Experian is asserting a little SOFDI smokescreen of its own . 
I,think.01,we should be told,,Affirmative,I think we should be told . 
they,keep.02,stealing it,,Affirmative,We 'll never know because they keep stealing it . 
they,steal.01,it,,Affirmative,We 'll never know because they keep stealing it . 
the defendant,defraud.01,banks located in,,Affirmative,"According to the indictment , the defendant was charged with attempting to defraud banks located in New Hampshire . "
Brian,link.01,the indictment,,Affirmative,It 's all in the indictment that Brian links to . 
the criminals,flock.02,to,,Affirmative,It seems to me the criminals are flocking to the more sophisticated places where people are sophisticated enough to think that criminals are the real victims . 
people,think.01,that criminals are,,Affirmative,It seems to me the criminals are flocking to the more sophisticated places where people are sophisticated enough to think that criminals are the real victims . 
big-three credit bureau Experian,do.02,a poor job of vetting /,,Affirmative,"To me , it is obvious that Experian did a poor job of vetting / due diligence on Ngo ( and possibly others ) . "
This,misfeasance.01,on,,Affirmative,This may be criminal or merely misfeasance on Experian 's part . 
Experian,have.03,access to,,Affirmative,"Experian has access to extremely private data , which it sells to credible creditors ( ?? ) "
it,sell.01,"private data ,",to,Affirmative,"Experian has access to extremely private data , which it sells to credible creditors ( ?? ) "
misfeasant actors,sell.01,the data,to,Affirmative,It seems to me that the Experian 's bad / misfeasant actors sold the data to the wrong person / people . 
one of,notify.01,the press,likely,Affirmative,"Its seems there may be no *clear* agreement at all , else one of the two would have notified the press likely . "
Court Ventures / Experian,log.01,my attempt or,,Affirmative,"Does Court Ventures / Experian log my attempt or Info Search , or both . "
they,see.01,me,"as me , of",Affirmative,"And for the latter do they see me as me , of just as someone though Court Ventures / Experian . "
the original press on,suggest.01,logging was poor on,,Affirmative,"I ask , as the original press on this topic seems to suggest the logging was poor on both sides . "
Court Ventures / Experian,have.03,partial,,Affirmative,"Court Ventures / Experian only had partial , and Info Search none . "
companies like this,keep.02,proper logs,,Affirmative,"But in this case I would be delighted if my bias is indeed that , and companies like this , do in fact keep proper logs most of the time , and this was the exception . "
the credit agencies,wield.01,the power,,Affirmative,"Considering the power the credit agencies wield in peoples lives you 'd think they would be a bit more careful about who they deal with , after all it 's not like ID theft is something new last week . "
you,think.01,they would be,,Affirmative,"Considering the power the credit agencies wield in peoples lives you 'd think they would be a bit more careful about who they deal with , after all it 's not like ID theft is something new last week . "
a Jr.,remember.01,who had,,Affirmative,Checking mine several years ago with all 3 agencies so I do not remember who had the obvious error . 
1 of,have.03,me crossed up with,,Affirmative,1 of my reports had me crossed up with my father so according to the file I was working for the New Haven Railroad 12 years before I was born . 
