A0,A0.35_Verb,A1,A2,Polarity,RelatedSentencethe D.C. Circuit,keep.02,interfering with,,Affirmative,"And because the D.C. Circuit keeps interfering with Harry 's obsession , Mr. Reid is now helping Mr. Obama pack the court with liberals by blowing up the Senate filibuster . "
the D.C. Circuit,interfere.01,with,,Affirmative,"And because the D.C. Circuit keeps interfering with Harry 's obsession , Mr. Reid is now helping Mr. Obama pack the court with liberals by blowing up the Senate filibuster . "
Mr. Reid,help.01,Obama pack,,Affirmative,"And because the D.C. Circuit keeps interfering with Harry 's obsession , Mr. Reid is now helping Mr. Obama pack the court with liberals by blowing up the Senate filibuster . "
Mr. Obama,pack.01,the court,with liberals,Affirmative,"And because the D.C. Circuit keeps interfering with Harry 's obsession , Mr. Reid is now helping Mr. Obama pack the court with liberals by blowing up the Senate filibuster . "
's,see.01,if I understand Kathy,,Affirmative,"So , let 's see if I understand Kathy . "
I,understand.01,Kathy,,Affirmative,"So , let 's see if I understand Kathy . "
you,have.03,something,,Affirmative,"Richard , do you have something to say to the issue or are you here to offer insults ? "
you,offer.01,insults,,Affirmative,"Richard , do you have something to say to the issue or are you here to offer insults ? "
The Feds,collect.01,$ 40 Billion for,,Affirmative,The Feds have collected $ 40 Billion for nuclear storage so why is n't it being done ? 
you,care.01,about,,Affirmative,It would seem you care more about divisive spats and less about the issue at hand . 
I,suspect.01,it 's,,Affirmative,"I 'm not absolutely sure why it is n't being done , but if I had to guess , I suspect it 's because the number of citizens in Nevada who oppose the prospect of the federal government forcing them to host the repository of US nuclear waste far exceeds the vocal minority of those who abhor Vermont 's PSB allowing the development of wind turbines on ridge lines . "
citizens in Nevada,oppose.01,the prospect of,,Affirmative,"I 'm not absolutely sure why it is n't being done , but if I had to guess , I suspect it 's because the number of citizens in Nevada who oppose the prospect of the federal government forcing them to host the repository of US nuclear waste far exceeds the vocal minority of those who abhor Vermont 's PSB allowing the development of wind turbines on ridge lines . "
the federal government,force.01,them,to host,Affirmative,"I 'm not absolutely sure why it is n't being done , but if I had to guess , I suspect it 's because the number of citizens in Nevada who oppose the prospect of the federal government forcing them to host the repository of US nuclear waste far exceeds the vocal minority of those who abhor Vermont 's PSB allowing the development of wind turbines on ridge lines . "
them,host.01,the repository of,,Affirmative,"I 'm not absolutely sure why it is n't being done , but if I had to guess , I suspect it 's because the number of citizens in Nevada who oppose the prospect of the federal government forcing them to host the repository of US nuclear waste far exceeds the vocal minority of those who abhor Vermont 's PSB allowing the development of wind turbines on ridge lines . "
the number of citizens in Nevada,exceed.01,the vocal minority of those,far,Affirmative,"I 'm not absolutely sure why it is n't being done , but if I had to guess , I suspect it 's because the number of citizens in Nevada who oppose the prospect of the federal government forcing them to host the repository of US nuclear waste far exceeds the vocal minority of those who abhor Vermont 's PSB allowing the development of wind turbines on ridge lines . "
those,abhor.01,PSB allowing,,Affirmative,"I 'm not absolutely sure why it is n't being done , but if I had to guess , I suspect it 's because the number of citizens in Nevada who oppose the prospect of the federal government forcing them to host the repository of US nuclear waste far exceeds the vocal minority of those who abhor Vermont 's PSB allowing the development of wind turbines on ridge lines . "
PSB allowing,allow.01,the development of,,Affirmative,"I 'm not absolutely sure why it is n't being done , but if I had to guess , I suspect it 's because the number of citizens in Nevada who oppose the prospect of the federal government forcing them to host the repository of US nuclear waste far exceeds the vocal minority of those who abhor Vermont 's PSB allowing the development of wind turbines on ridge lines . "
you,sing.01,different song,,Affirmative,If you lived in Nevada you would sing a very different song . 
I,answer.01,your question of,,Affirmative,"To answer your question of where the waste should go , I suggest each of you and your pro-nuke posse volunteer a corner of your living rooms for a dry cask storage unit . "
I,suggest.01,a corner of,,Affirmative,"To answer your question of where the waste should go , I suggest each of you and your pro-nuke posse volunteer a corner of your living rooms for a dry cask storage unit . "
you,need.01,a map,,Affirmative,"Glenn , Even you should n't need a map to realize the people in Nevada live a lot closer to it than you do . "
I,suggest.01,we just fall back on,,Affirmative,"Kathy , Since Harry Reid 's such a powerful ogre and spent fuel is such benign stuff , I suggest we just fall back on the DOE 's second solution for a nuclear waste dump ( pre NWPA ) : Vermont granite . "
I,assume.02,you,,Affirmative,"I assume you , John McClaughry and other nuclear power supporters will welcome it with open arms . "
John McClaughry and,welcome.01,it,,Affirmative,"I assume you , John McClaughry and other nuclear power supporters will welcome it with open arms . "
you,think.01,it should be stored,,Affirmative,"Where do you think it should be stored , John ? "
You,offer.01,no relevant comment to,,Affirmative,You offer no relevant comment to the issue at hand . 
The money,construct.01,storage,,Affirmative,The money is available to construct storage for spent nuclear waste . 
I,say.01,depository is safest and offers,,Affirmative,I say a central depository is safest and offers should be made to whichever state wishes to play host . 
a central depository,offer.01,should be made to,,Affirmative,I say a central depository is safest and offers should be made to whichever state wishes to play host . 
whichever state,play.01,host,,Affirmative,I say a central depository is safest and offers should be made to whichever state wishes to play host . 
VT,decline.02,to be,,Affirmative,VT declined to be a host in the past and will not likely be open to it now . 
Some other state,feel.01,the same way,,Affirmative,Some other state may not feel the same way . 
the government,ask.01,of,,Affirmative,It would be a welcome change for the government to ask instead of just shoving it down people 's throat . 
by politics,hold.01,fuel reprocessing,,Affirmative,Spent nuclear fuel reprocessing should not be held up by politics . 
1982,reuse.01,1982,,Affirmative,"The fuel is there , if it can be reused then reuse it . "
You,put.01,a stop,to,Affirmative,"You will not put a stop to the use of nuclear , even if it halts in the private sector the military is not going to give it up . "
the military,give.07,it,,Affirmative,"You will not put a stop to the use of nuclear , even if it halts in the private sector the military is not going to give it up . "
we,consider.02,how to use and store it safely,,Affirmative,So we had better consider how to use and store it safely . 
we,store.01,it,,Affirmative,So we had better consider how to use and store it safely . 
You,write.01,offers should be made to,,Affirmative,"Kathy , 2 ) You write : offers should be made to whichever state wishes to play host . "
whichever state,play.01,host,,Affirmative,"Kathy , 2 ) You write : offers should be made to whichever state wishes to play host . "
Nevada,volunteer.01,Yucca Mountain,,Affirmative,But Nevada did n't volunteer Yucca Mountain . 
a substance,have.03,one of,,Affirmative,"In 1982 , it had one of the weakest congressional delegations ( 3 members , little seniority ) and Congress chose to shave the waste down its throat . "
Congress,choose.01,to shave,,Affirmative,"In 1982 , it had one of the weakest congressional delegations ( 3 members , little seniority ) and Congress chose to shave the waste down its throat . "
Congress,shave.01,the waste,down,Affirmative,"In 1982 , it had one of the weakest congressional delegations ( 3 members , little seniority ) and Congress chose to shave the waste down its throat . "
We,lack.01,sufficient knowledge of,,Affirmative,"We lack sufficient knowledge of our planet - and especially of the flow of water underground - to be confident that we can bury a substance and have it remain in place , untouched for millennia . "
we,bury.01,a substance,,Affirmative,"We lack sufficient knowledge of our planet - and especially of the flow of water underground - to be confident that we can bury a substance and have it remain in place , untouched for millennia . "
we,have.03,it remain in place,,Affirmative,"We lack sufficient knowledge of our planet - and especially of the flow of water underground - to be confident that we can bury a substance and have it remain in place , untouched for millennia . "
it,kill.01,them,,Affirmative,"During that period , if it comes into contact with living organisms , it either kills them , or causes diseases and genetic defects . "
it,cause.01,diseases and,,Affirmative,"During that period , if it comes into contact with living organisms , it either kills them , or causes diseases and genetic defects . "
we,know.01,about,,Affirmative,Virtually everything we know about the earth so far suggests that the kind of isolation we are looking for is either VERY rare or entirely non-existent . 
Virtually everything,suggest.01,is,,Affirmative,Virtually everything we know about the earth so far suggests that the kind of isolation we are looking for is either VERY rare or entirely non-existent . 
we,look.01,for,,Affirmative,Virtually everything we know about the earth so far suggests that the kind of isolation we are looking for is either VERY rare or entirely non-existent . 
Water,make.01,its way,,Affirmative,"Water makes its way almost everywhere , and over millennia , geological transitions assure that even deserts may once have been areas with more normal water patterns , etc. ( Which means , by the way , that merely VOLUNTEERING to host a site is far from sufficient , if the site can not be shown to actually do what an adequate disposal site must : namely , isolate the material for the period required . "
the way,host.01,a site,,Affirmative,"Water makes its way almost everywhere , and over millennia , geological transitions assure that even deserts may once have been areas with more normal water patterns , etc. ( Which means , by the way , that merely VOLUNTEERING to host a site is far from sufficient , if the site can not be shown to actually do what an adequate disposal site must : namely , isolate the material for the period required . "
what an adequate disposal site,isolate.01,the material,,Affirmative,"Water makes its way almost everywhere , and over millennia , geological transitions assure that even deserts may once have been areas with more normal water patterns , etc. ( Which means , by the way , that merely VOLUNTEERING to host a site is far from sufficient , if the site can not be shown to actually do what an adequate disposal site must : namely , isolate the material for the period required . "
governments around,spend.02,billions of dollars,searching for,Affirmative,"In sum , looking for a credible solution to this problem is COMPLEX and DIFFICULT , which is precisely why governments around the globe have spent billions of dollars searching for a solution without finding one . "
spent fuel,produce.01,vast quantities of heat,,Affirmative,"Complicating the situation still further are various other points , such as the fact that spent fuel produces vast quantities of heat , that in early years the radiation levels are intense enough to be lethal in a matter of seconds , and the fact that the waste contains isotopes which could be used by terrorists to create havoc on the spot , or , if they could be harvested , to make nuclear weapons . "
the waste,contain.01,isotopes,,Affirmative,"Complicating the situation still further are various other points , such as the fact that spent fuel produces vast quantities of heat , that in early years the radiation levels are intense enough to be lethal in a matter of seconds , and the fact that the waste contains isotopes which could be used by terrorists to create havoc on the spot , or , if they could be harvested , to make nuclear weapons . "
by terrorists,use.01,isotopes,to create havoc on,Affirmative,"Complicating the situation still further are various other points , such as the fact that spent fuel produces vast quantities of heat , that in early years the radiation levels are intense enough to be lethal in a matter of seconds , and the fact that the waste contains isotopes which could be used by terrorists to create havoc on the spot , or , if they could be harvested , to make nuclear weapons . "
they,make.01,nuclear weapons,,Affirmative,"Complicating the situation still further are various other points , such as the fact that spent fuel produces vast quantities of heat , that in early years the radiation levels are intense enough to be lethal in a matter of seconds , and the fact that the waste contains isotopes which could be used by terrorists to create havoc on the spot , or , if they could be harvested , to make nuclear weapons . "
the US,point.02,that reprocessing represents,,Affirmative,"In answering John McClaughry below , I already pointed out that reprocessing represents both a major nuclear proliferation risk and an inordinate expense for governments ( and there are other problems as well ) . "
reprocessing,represent.01,proliferation risk and,,Affirmative,"In answering John McClaughry below , I already pointed out that reprocessing represents both a major nuclear proliferation risk and an inordinate expense for governments ( and there are other problems as well ) . "
many,give.01,more than,,Affirmative,"The consequence of all this is that for now , along with many who have given more than lip service to solving the problem , I have no solution to offer and no fingers to point at politicians who block the bad ones that other less conscientious politicians tried to shove down our throats . "
I,have.03,no solution,,Affirmative,"The consequence of all this is that for now , along with many who have given more than lip service to solving the problem , I have no solution to offer and no fingers to point at politicians who block the bad ones that other less conscientious politicians tried to shove down our throats . "
politicians,block.01,the bad ones,,Affirmative,"The consequence of all this is that for now , along with many who have given more than lip service to solving the problem , I have no solution to offer and no fingers to point at politicians who block the bad ones that other less conscientious politicians tried to shove down our throats . "
conscientious politicians,try.01,to shove down,,Affirmative,"The consequence of all this is that for now , along with many who have given more than lip service to solving the problem , I have no solution to offer and no fingers to point at politicians who block the bad ones that other less conscientious politicians tried to shove down our throats . "
conscientious politicians,shove.01,our throats,,Affirmative,"The consequence of all this is that for now , along with many who have given more than lip service to solving the problem , I have no solution to offer and no fingers to point at politicians who block the bad ones that other less conscientious politicians tried to shove down our throats . "
I,have.03,no solution,,Affirmative,"And I am not ashamed to have no solution to offer beyond the obvious one : when you 're producing a hazardous substance for which you have no credible disposal solution , STOP . "
you,produce.01,a hazardous substance,,Affirmative,"And I am not ashamed to have no solution to offer beyond the obvious one : when you 're producing a hazardous substance for which you have no credible disposal solution , STOP . "
you,have.03,"no credible disposal solution , STOP",,Affirmative,"And I am not ashamed to have no solution to offer beyond the obvious one : when you 're producing a hazardous substance for which you have no credible disposal solution , STOP . "
the US,want.01,to store,,Affirmative,I do not want to store nuclear waste in anybody 's granite . 
the US,store.01,nuclear waste,,Affirmative,I do not want to store nuclear waste in anybody 's granite . 
the US,want.01,to reprocess it for,,Affirmative,I want to reprocess it for new reactor fuel . 
the US,reprocess.01,it,,Affirmative,I want to reprocess it for new reactor fuel . 
I,see.01,a show on,,Affirmative,I recently saw a show on the history channel that says the new nuclear reactors can consume much of the waste . 
the history channel,say.01,reactors can consume much of,,Affirmative,I recently saw a show on the history channel that says the new nuclear reactors can consume much of the waste . 
the new nuclear reactors,consume.01,much of,,Affirmative,I recently saw a show on the history channel that says the new nuclear reactors can consume much of the waste . 
reactor fuel rods,contain.01,95 % of,,Affirmative,Spent light water reactor fuel rods contain 95 % of their initial nuclear energy . 
The accumulated spent fuel rods,power.01,the American economy,,Affirmative,"The accumulated spent fuel rods could power the American economy for decades , if only the federal government ( think Jimmy Carter ) would encourage reprocessing instead of forbidding it . "
only the federal government,encourage.02,reprocessing,,Affirmative,"The accumulated spent fuel rods could power the American economy for decades , if only the federal government ( think Jimmy Carter ) would encourage reprocessing instead of forbidding it . "
promising version,burn.01,the transuranics,,Affirmative,The most promising version is burning the transuranics and U 238 through a Liquid Fluoride Thorium Reactor . 
"reactor makers ( GE , Westinghouse",block.01,its development,,Affirmative,"Every component of the LFTR has been tested for years , but there is no operating LFTR because the light water reactor makers ( GE , Westinghouse ) have blocked its development for 40 years . "
owners of,use.01,the government,to prevent,Affirmative,"There is a government problem , whereby owners of one now outdated technology use the government to prevent the disruptive technology that would eliminate most nuclear waste and also put them out of the LWR business . "
owners of,prevent.01,the disruptive technology,,Affirmative,"There is a government problem , whereby owners of one now outdated technology use the government to prevent the disruptive technology that would eliminate most nuclear waste and also put them out of the LWR business . "
the disruptive technology,eliminate.01,nuclear waste,,Affirmative,"There is a government problem , whereby owners of one now outdated technology use the government to prevent the disruptive technology that would eliminate most nuclear waste and also put them out of the LWR business . "
John McClaughry,ignore.01,the REASONS Jimmy Carter rejected reprocessing :,,Affirmative,"John McClaughry conveniently ignores the REASONS Jimmy Carter rejected reprocessing : namely , that it represents a major risk of nuclear proliferation in a world which hardly needs more incentives to go nuclear ( think Pakistan & Iran , not to mention the then - recent experience of India 's bomb ) . "
the propagandist drone of nuclear supporters,represent.01,a major risk of,,Affirmative,"John McClaughry conveniently ignores the REASONS Jimmy Carter rejected reprocessing : namely , that it represents a major risk of nuclear proliferation in a world which hardly needs more incentives to go nuclear ( think Pakistan & Iran , not to mention the then - recent experience of India 's bomb ) . "
a world,need.01,more incentives,,Affirmative,"John McClaughry conveniently ignores the REASONS Jimmy Carter rejected reprocessing : namely , that it represents a major risk of nuclear proliferation in a world which hardly needs more incentives to go nuclear ( think Pakistan & Iran , not to mention the then - recent experience of India 's bomb ) . "
Pakistan & Iran,mention.01,recent experience of,,Affirmative,"John McClaughry conveniently ignores the REASONS Jimmy Carter rejected reprocessing : namely , that it represents a major risk of nuclear proliferation in a world which hardly needs more incentives to go nuclear ( think Pakistan & Iran , not to mention the then - recent experience of India 's bomb ) . "
The US government,spend.01,on,,Affirmative,"The US government also spent over $ 1 Billion on the Clinch River Project , one of the many subsidies to nuclear power its supporters would prefer to ignore . "
its supporters,prefer.01,to ignore,,Affirmative,"The US government also spent over $ 1 Billion on the Clinch River Project , one of the many subsidies to nuclear power its supporters would prefer to ignore . "
by Congress,cancel.01,your question of where the waste should go,,Affirmative,"By the time it was finally cancelled by Congress during the Reagan administration , the original $ 400 million estimate for the project had grown to $ 8 billion according to GAO . "
Nuclear proponents,love.02,to focus on,,Affirmative,"Nuclear proponents love to focus on Harry Reid ( e.g. Kathy Nelson ) or the US government more broadly , but the fact is that NO solution exists anywhere in the world despite 60 years of nuclear power generation and concerted efforts by numerous governments , not just ours . "
the US,repeat.01,the question :,,Affirmative,"Kathy , I repeat the question : if thorium is so wonderful , and being blocked in the US , then why are n't OTHER COUNTRIES using it ? "
OTHER COUNTRIES,use.01,it,,Affirmative,"Kathy , I repeat the question : if thorium is so wonderful , and being blocked in the US , then why are n't OTHER COUNTRIES using it ? "
My,study.01,it,,Affirmative,My studying it more closely is n't going to answer the question . 
Kathy Nelson,list.01,3 countries,,Affirmative,"1 ) Kathy Nelson lists 3 countries which are EXPLORING - not building , and certainly not operating - thorium reactors . "
she,have.03,some other examples,,Affirmative,"Unless she has some other examples to present , then , there are NO countries actually using a thorium reactor ( which is what I said above ) . "
NO countries,use.01,a thorium reactor (,,Affirmative,"Unless she has some other examples to present , then , there are NO countries actually using a thorium reactor ( which is what I said above ) . "
MANY countries,explore.01,fusion,,Affirmative,"It is worth noting that MANY countries are exploring fusion too , but no one is actually producing electricity using that process either . "
no one,produce.01,electricity,,Affirmative,"It is worth noting that MANY countries are exploring fusion too , but no one is actually producing electricity using that process either . "
no one,use.01,that process,,Affirmative,"It is worth noting that MANY countries are exploring fusion too , but no one is actually producing electricity using that process either . "
I,know.01,"the likes of Greenberg , Stannard , and Ratico",,Affirmative,"I know the likes of Greenberg , Stannard , and Ratico are n't going to like my prediction , but the energy source of the future will be nuclear not wind and solar . "
It,look.02,like you 're,,Affirmative,"Glenn , It looks like you 're the one who needs to learn a thing or two . "
the one,need.01,to learn,,Affirmative,"Glenn , It looks like you 're the one who needs to learn a thing or two . "
the one,learn.01,a thing,,Affirmative,"Glenn , It looks like you 're the one who needs to learn a thing or two . "
You,try.01,to grasp,,Affirmative,You might begin by trying to grasp the difference between fission and fusion . 
You,get.01,an A+ for enthusiasm,,Affirmative,You get an A+ for enthusiasm though . 
some facts,interest.01,you,,Affirmative,"Glenn , You are certainly welcome to your opinions , but here are some facts that might interest you about recent history . "
by,shrink.01,2013 nuclear production shrank by,,Affirmative,"Put differently , from 2007 to 2013 nuclear production shrank by a bit more than 2 % while renewable production 240 % . "
The government,regulate.01,insurance industry,,Affirmative,"The government regulated the health insurance industry for years , still does . "
They,have.03,the tools,,Affirmative,They had / have the tools to make or break it . 
They,control.01,it,,Affirmative,They control it . 
They,choose.01,not to make use of,,Affirmative,They have chosen not to make use of the new nuclear technologies that would solve many of our energy and environmental problems . 
the new nuclear technologies,solve.01,many of,,Affirmative,They have chosen not to make use of the new nuclear technologies that would solve many of our energy and environmental problems . 
You,get.01,something,,Affirmative,( You do n't get something for nothing ) Instead they force us to continue to use outdated nuclear technologies . 
they,force.01,us,to continue,Affirmative,( You do n't get something for nothing ) Instead they force us to continue to use outdated nuclear technologies . 
