A0,A0.35_Verb,A1,A2,Polarity,RelatedSentence
by,wage.01,a successful rebranding campaign waged by,,Affirmative,"As at other nuclear power plant sites around the country , spent nuclear fuel - or nuclear waste , as it used to be called prior to a successful rebranding campaign waged by the nuclear industry - might remain in Vernon long after all other reminders of Yankee are gone . "
Energy Secretary Ernest Moniz,note.01,", DOE needs",,Affirmative,"However , noted Moniz , DOE needs the go - ahead from Congress . "
the DOE 's,need.01,the go - ahead from Congress,,Affirmative,"However , noted Moniz , DOE needs the go - ahead from Congress . "
"Senate Bill 1240 ,",establish.01,a new organization,,Affirmative,"Senate Bill 1240 , which has been in the Energy and Natural Resources Committee since 2013 , would establish a new organization to manage nuclear waste , provide a consensual process for siting nuclear waste facilities and ensure adequate funding for managing nuclear waste . "
a new organization,manage.01,nuclear waste,,Affirmative,"Senate Bill 1240 , which has been in the Energy and Natural Resources Committee since 2013 , would establish a new organization to manage nuclear waste , provide a consensual process for siting nuclear waste facilities and ensure adequate funding for managing nuclear waste . "
"Senate Bill 1240 ,",provide.01,a consensual process for siting,,Affirmative,"Senate Bill 1240 , which has been in the Energy and Natural Resources Committee since 2013 , would establish a new organization to manage nuclear waste , provide a consensual process for siting nuclear waste facilities and ensure adequate funding for managing nuclear waste . "
"Senate Bill 1240 ,",ensure.01,adequate funding for managing,,Affirmative,"Senate Bill 1240 , which has been in the Energy and Natural Resources Committee since 2013 , would establish a new organization to manage nuclear waste , provide a consensual process for siting nuclear waste facilities and ensure adequate funding for managing nuclear waste . "
The Energy Department,enter.01,into contracts with,,Affirmative,"In 1983 , the Department of Energy entered into contracts with the operators of the nation 's nuclear power plants and agreed to take possession of all nuclear waste produced as a result of their operations . "
The Energy Department,agree.01,to take possession of,,Affirmative,"In 1983 , the Department of Energy entered into contracts with the operators of the nation 's nuclear power plants and agreed to take possession of all nuclear waste produced as a result of their operations . "
The Obama Administration at the behest of Mr. Reid,pull.01,the plug due to,,Affirmative,"But after $ 9 billion was invested in the project , the Obama Administration pulled the plug due to local opposition , environmental concerns and pressure from Harry Reid , the Senate majority leader and democrat from Nevada . "
Energy Secretary Ernest Moniz,say.01,it 's not,,Affirmative,"Despite all the money spent on Yucca Mountain , said Moniz , it 's not a viable project . "
by,produce.01,all the waste produced by,,Affirmative,"Currently , all the waste produced by the power plants is being stored onsite in either spent nuclear fuel pools or dry casks . "
Entergy 's,announce.01,it would be closing Yankee at,,Affirmative,"In late August 2013 , Entergy announced it would be closing Yankee at the end of 2014 because it was no longer financially viable due to the fact that natural gas has driven down the costs of producing electricity . "
late August 2013,close.01,Yankee,,Affirmative,"In late August 2013 , Entergy announced it would be closing Yankee at the end of 2014 because it was no longer financially viable due to the fact that natural gas has driven down the costs of producing electricity . "
natural gas,drive.02,the costs of producing electricity,down,Affirmative,"In late August 2013 , Entergy announced it would be closing Yankee at the end of 2014 because it was no longer financially viable due to the fact that natural gas has driven down the costs of producing electricity . "
Entergy 's,announce.01,that it would soon be asking for permission,,Affirmative,"Late last week , Entergy announced that it would soon be asking for permission to construct an additional dry cask storage facility at Yankee . "
Late last week,ask.02,for permission,,Affirmative,"Late last week , Entergy announced that it would soon be asking for permission to construct an additional dry cask storage facility at Yankee . "
the placement of,contain.01,25 tons of,,Affirmative,"The pad will be used for the placement of 100 - ton dry casks , which will each contain up to 25 tons of spent nuclear fuel once it has cooled down enough to be removed from the fuel pool located inside the plant 's reactor building . "
The first storage pad at,hold.01,13 dry casks,,Affirmative,"The first storage pad at Vermont Yankee was constructed in 2006 and now holds 13 dry casks , with room for 23 more . "
Each cask,contain.01,68 fuel assemblies,,Affirmative,"Each cask contains 68 fuel assemblies , meaning there are now 884 assemblies in dry cask storage . "
Senate Bill,call.03,for,,Affirmative,Senate Bill 1240 calls for the construction of a pilot facility for the storage of priority waste ; one or more additional storage facilities for the storage of nonpriority nuclear waste ; and one or more repositories for the permanent disposal of nuclear waste . 
Congress,approve.01,Senate Bill 1240,,Affirmative,"If Congress approves Senate Bill 1240 , Moniz said it is hoped a pilot facility can be established early in the 2020s . "
Energy Secretary Ernest Moniz,say.01,it is hoped,,Affirmative,"If Congress approves Senate Bill 1240 , Moniz said it is hoped a pilot facility can be established early in the 2020s . "
Energy Secretary Ernest Moniz,say.01,facility should have been part of,,Affirmative,He said a pilot facility should have been part of the nation 's waste storage strategy since 1983 . 
We,pursue.01,consolidated storage facilities,,Affirmative,"We should have been pursuing consolidated storage facilities in parallel with repository development , said Moniz . "
Energy Secretary Ernest Moniz,say.01,We should have been pursuing,,Affirmative,"We should have been pursuing consolidated storage facilities in parallel with repository development , said Moniz . "
Senate Bill 1240,call.03,for,,Affirmative,"The bill also calls for the development of the Nuclear Waste Administration , taking the responsibility for moving and storing the nuclear rods and other high - level waste out of the hands of the Department of Energy . "
Senate Bill 1240,take.01,the responsibility for moving and storing,,Affirmative,"The bill also calls for the development of the Nuclear Waste Administration , taking the responsibility for moving and storing the nuclear rods and other high - level waste out of the hands of the Department of Energy . "
Energy Secretary Ernest Moniz,say.01,"established , it needs",,Affirmative,"Moniz said that wherever a spent fuel repository is established , it needs to be established with the consent of the hosting community . "
a spent fuel repository,need.01,to be established with,,Affirmative,"Moniz said that wherever a spent fuel repository is established , it needs to be established with the consent of the hosting community . "
a siting process,allow.01,communities to decide,,Affirmative,"The process is intended to allow prospective host communities to decide whether , and on what terms they will host a nuclear waste facility ; is open to the public and allows interested persons to be heard in a meaningful way ; is flexible and allows decisions to be reviewed and modified in response to new information or new technical , social , or political developments ; and is based on sound science and meets public health , safety , and environmental standards . "
prospective host communities,decide.01,they will host,,Affirmative,"The process is intended to allow prospective host communities to decide whether , and on what terms they will host a nuclear waste facility ; is open to the public and allows interested persons to be heard in a meaningful way ; is flexible and allows decisions to be reviewed and modified in response to new information or new technical , social , or political developments ; and is based on sound science and meets public health , safety , and environmental standards . "
they,host.01,waste facility,,Affirmative,"The process is intended to allow prospective host communities to decide whether , and on what terms they will host a nuclear waste facility ; is open to the public and allows interested persons to be heard in a meaningful way ; is flexible and allows decisions to be reviewed and modified in response to new information or new technical , social , or political developments ; and is based on sound science and meets public health , safety , and environmental standards . "
prospective host communities,meet.01,"public health , safety , and",,Affirmative,"The process is intended to allow prospective host communities to decide whether , and on what terms they will host a nuclear waste facility ; is open to the public and allows interested persons to be heard in a meaningful way ; is flexible and allows decisions to be reviewed and modified in response to new information or new technical , social , or political developments ; and is based on sound science and meets public health , safety , and environmental standards . "
the only entities,have.03,any real say in,,Affirmative,"Under current rules , public hearings can be held to take input , but in the end , the operator and the Nuclear Regulatory Commission are the only entities that have any real say in how a plant is decommissioned , Sanders said . "
Sanders,say.01,hearings can be held,,Affirmative,"Under current rules , public hearings can be held to take input , but in the end , the operator and the Nuclear Regulatory Commission are the only entities that have any real say in how a plant is decommissioned , Sanders said . "
"Mike Twomey ,",tell.01,expect,the Reformer,Affirmative,"Mike Twomey , Entergy 's vice president for external affairs , told the Reformer he and other industry executives expect that the federal government will eventually fulfill its obligation to remove the spent fuel from Vermont Yankee and sites around the country . "
he and,expect.01,government will eventually fulfill,,Affirmative,"Mike Twomey , Entergy 's vice president for external affairs , told the Reformer he and other industry executives expect that the federal government will eventually fulfill its obligation to remove the spent fuel from Vermont Yankee and sites around the country . "
the federal government,fulfill.01,its obligation,,Affirmative,"Mike Twomey , Entergy 's vice president for external affairs , told the Reformer he and other industry executives expect that the federal government will eventually fulfill its obligation to remove the spent fuel from Vermont Yankee and sites around the country . "
the federal government,remove.01,the spent fuel,from,Affirmative,"Mike Twomey , Entergy 's vice president for external affairs , told the Reformer he and other industry executives expect that the federal government will eventually fulfill its obligation to remove the spent fuel from Vermont Yankee and sites around the country . "
Dirty Harry,have.03,land and,,Affirmative,Dirty Harry had land and solar deals with the Chinese that had to be accommodated and giving the nuclear industry headaches made those deals more secure . 
Help from,seal.01,the deals,,Affirmative,Help from the oval office sealed the deals and industrial wind moved in and all the campaign donors got their cut . 
all the campaign donors,get.01,their cut,,Affirmative,Help from the oval office sealed the deals and industrial wind moved in and all the campaign donors got their cut . 
George W Bush in,establish.01,storage facility,,Affirmative,George W Bush in his campaign and during his administration promised to establish a nuclear waste storage facility . 
by others,attempt.01,idea tha t,,Affirmative,A good idea tha t had been attempted by others for years . 
administration,use.01,government strong arm techniques,to establish,Affirmative,W 's administration used Federal government strong arm techniques to establish Yucca Mtn facility on federal land . 
administration,establish.01,Mtn facility,,Affirmative,W 's administration used Federal government strong arm techniques to establish Yucca Mtn facility on federal land . 
Iwas,read.01,the whole,,Affirmative,the WSJ article ( Iwas blocked from reading the whole ) seems to say that Obama admin wants to stop charging the nuclear plants for this site when they can not use it . 
the WSJ article,say.01,admin wants,,Affirmative,the WSJ article ( Iwas blocked from reading the whole ) seems to say that Obama admin wants to stop charging the nuclear plants for this site when they can not use it . 
Obama admin,want.01,to stop charging,,Affirmative,the WSJ article ( Iwas blocked from reading the whole ) seems to say that Obama admin wants to stop charging the nuclear plants for this site when they can not use it . 
Obama admin,stop.01,charging,,Affirmative,the WSJ article ( Iwas blocked from reading the whole ) seems to say that Obama admin wants to stop charging the nuclear plants for this site when they can not use it . 
Obama admin,charge.01,the nuclear plants,for,Affirmative,the WSJ article ( Iwas blocked from reading the whole ) seems to say that Obama admin wants to stop charging the nuclear plants for this site when they can not use it . 
they,use.01,it,,Affirmative,the WSJ article ( Iwas blocked from reading the whole ) seems to say that Obama admin wants to stop charging the nuclear plants for this site when they can not use it . 
we,generate.01,essentially all the nuclear waste,,Affirmative,This is a shame as were are storing essentially all the nuclear waste we have generate in the last 50 years in very dangerous open pools in the power plants and now some is being put is somewhat safer casks . 
the owners like Entergy,want.01,to abandon them ASAP due to,,Affirmative,all the while the owners like Entergy want to abandon them ASAP due to the cost . 
the owners like Entergy,abandon.01,them,,Affirmative,all the while the owners like Entergy want to abandon them ASAP due to the cost . 
They,pack.01,the appeals court,,Affirmative,They pack the appeals court that just called out their lawlessness . 
the appeals court,call.02,their lawlessness,,Affirmative,They pack the appeals court that just called out their lawlessness . 
Senate Democrats,kill.01,the filibuster for,,Affirmative,"To better understand why Senate Democrats killed the filibuster for presidential appointees , consider their latest legal rebuke . "
Leader Harry Reid,want.01,to remake,,Affirmative,Majority Leader Harry Reid wants to remake the court that is a check on his lawlessness . 
Leader Harry Reid,remake.01,the court,,Affirmative,Majority Leader Harry Reid wants to remake the court that is a check on his lawlessness . 
judge panel of,rule.01,longer require utilities,,Affirmative,A three - judge panel of the D.C. Circuit Court of Appeals this week ruled that the Department of Energy can no longer require utilities to pay annual fees for a nuclear waste repository in Nevada . 
the Department of Energy,require.01,to pay,,Affirmative,A three - judge panel of the D.C. Circuit Court of Appeals this week ruled that the Department of Energy can no longer require utilities to pay annual fees for a nuclear waste repository in Nevada . 
the Department of Energy,pay.01,annual fees,,Affirmative,A three - judge panel of the D.C. Circuit Court of Appeals this week ruled that the Department of Energy can no longer require utilities to pay annual fees for a nuclear waste repository in Nevada . 
The Obama Administration at,abandon.01,work on,,Affirmative,"The Obama Administration at the behest of Mr. Reid has abandoned work on the Yucca Mountain facility , so the court ruled that it is quite unfair to force [ operators ] to pay fees for a hypothetical option . "
the court,rule.01,that it is,,Affirmative,"The Obama Administration at the behest of Mr. Reid has abandoned work on the Yucca Mountain facility , so the court ruled that it is quite unfair to force [ operators ] to pay fees for a hypothetical option . "
[ operators ],pay.01,fees,,Affirmative,"The Obama Administration at the behest of Mr. Reid has abandoned work on the Yucca Mountain facility , so the court ruled that it is quite unfair to force [ operators ] to pay fees for a hypothetical option . "
Policy Act of 1982,create.01,a timetable,,Affirmative,"The Nuclear Waste Policy Act of 1982 created a timetable to build an underground repository for radioactive waste , and in 1987 Congress made Yucca the site . "
Congress,make.02,Yucca the site,,Affirmative,"The Nuclear Waste Policy Act of 1982 created a timetable to build an underground repository for radioactive waste , and in 1987 Congress made Yucca the site . "
Mr. Reid,block.01,all progress,,Affirmative,Yet Mr. Reid has blocked all progress . 
He,instal.01,aide Gregory Jaczko,on,Affirmative,"He installed aide Gregory Jaczko on the Nuclear Regulatory Commission in 2005 , and President Obama made him chairman in 2009 . "
President Obama,make.02,him chairman in 2009,,Affirmative,"He installed aide Gregory Jaczko on the Nuclear Regulatory Commission in 2005 , and President Obama made him chairman in 2009 . "
Mr. Jaczko,shut.05,the Yucca project,,Affirmative,A year later Mr. Jaczko shut down the Yucca project . 
Mr. Jaczko,abuse.01,his authority,,Affirmative,Mr. Jaczko so abused his authority that in August a separate D.C. Circuit panel slammed the NRC 503780.BY +3.64 % for flouting the law and ordered the agency to restart work on Yucca licensing . 
Circuit panel,slam.01,503780.BY +3.64 %,for flouting,Affirmative,Mr. Jaczko so abused his authority that in August a separate D.C. Circuit panel slammed the NRC 503780.BY +3.64 % for flouting the law and ordered the agency to restart work on Yucca licensing . 
Circuit panel,order.01,the agency,to restart work on,Affirmative,Mr. Jaczko so abused his authority that in August a separate D.C. Circuit panel slammed the NRC 503780.BY +3.64 % for flouting the law and ordered the agency to restart work on Yucca licensing . 
the agency,restart.01,work on,,Affirmative,Mr. Jaczko so abused his authority that in August a separate D.C. Circuit panel slammed the NRC 503780.BY +3.64 % for flouting the law and ordered the agency to restart work on Yucca licensing . 
the Administration,continue.01,to soak,,Affirmative,"Meanwhile , the Administration has continued to soak the nuclear industry for fees to build the site it wo n't allow to be built . "
the Administration,soak.02,the nuclear industry,,Affirmative,"Meanwhile , the Administration has continued to soak the nuclear industry for fees to build the site it wo n't allow to be built . "
fees,build.01,the site,,Affirmative,"Meanwhile , the Administration has continued to soak the nuclear industry for fees to build the site it wo n't allow to be built . "
it,allow.01,to be built,,Affirmative,"Meanwhile , the Administration has continued to soak the nuclear industry for fees to build the site it wo n't allow to be built . "
The 1982 Act,require.01,to pay,operators,Affirmative,The 1982 Act requires operators to pay 0.1 cents on every electric kilowatt hour generated by nuclear power . 
operators,pay.01,0.1 cents,,Affirmative,The 1982 Act requires operators to pay 0.1 cents on every electric kilowatt hour generated by nuclear power . 
by,generate.01,kilowatt hour generated by,,Affirmative,The 1982 Act requires operators to pay 0.1 cents on every electric kilowatt hour generated by nuclear power . 
Mr. Reid,block.01,Congress,from spending,Affirmative,"Yet Mr. Reid has also blocked Congress from spending any money for Yucca , so the nuclear fees go to Treasury to spend in return for IOUs . "
Mr. Reid,spend.02,any money,for Yucca,Affirmative,"Yet Mr. Reid has also blocked Congress from spending any money for Yucca , so the nuclear fees go to Treasury to spend in return for IOUs . "
the nuclear fees,spend.01,in return for IOUs,,Affirmative,"Yet Mr. Reid has also blocked Congress from spending any money for Yucca , so the nuclear fees go to Treasury to spend in return for IOUs . "
The Energy Department,analyze.01,repository costs,,Affirmative,The Energy Department is supposed to analyze repository costs each year to determine if the fees need adjustment . 
The Energy Department,determine.01,fees need adjustment,,Affirmative,The Energy Department is supposed to analyze repository costs each year to determine if the fees need adjustment . 
the fees,need.01,adjustment,,Affirmative,The Energy Department is supposed to analyze repository costs each year to determine if the fees need adjustment . 
Energy,quit.01,doing,,Affirmative,"Instead , Energy quit doing the analysis . "
Energy,do.02,the analysis,,Affirmative,"Instead , Energy quit doing the analysis . "
the D.C. Circuit,order.01,the Energy Department,to do,Affirmative,"Utilities sued , and the D.C. Circuit last year ordered the Energy Department to do its job . "
the Energy Department,do.02,its job,,Affirmative,"Utilities sued , and the D.C. Circuit last year ordered the Energy Department to do its job . "
he,determine.01,fees are right,,Affirmative,Energy Secretary Ernest Moniz then came back with the convenient argument that he ca n't determine if the fees are right because the issue is now hypothetical . 
Judge Silberman,want.01,to keep,,Affirmative,But he still wants to keep the fees . 
Judge Silberman,keep.01,the fees,,Affirmative,But he still wants to keep the fees . 
Judge Silberman,note.01,Administration had itself,,Affirmative,Judge Silberman noted that the Obama Administration had itself to blame for having only hypotheticals . 
the Obama Administration,have.03,itself,,Affirmative,Judge Silberman noted that the Obama Administration had itself to blame for having only hypotheticals . 
the Obama Administration,have.03,only hypotheticals,,Affirmative,Judge Silberman noted that the Obama Administration had itself to blame for having only hypotheticals . 
It,use.01,costs,,Affirmative,"It certainly could have used Yucca Mountain 's costs if it were still pursuing that site , he wrote , adding that the Secretary may not comply with his statutory obligation by ' concluding ' that a conclusion is impossible . "
it,pursue.01,that site,,Affirmative,"It certainly could have used Yucca Mountain 's costs if it were still pursuing that site , he wrote , adding that the Secretary may not comply with his statutory obligation by ' concluding ' that a conclusion is impossible . "
he,write.01,It certainly could have used,,Affirmative,"It certainly could have used Yucca Mountain 's costs if it were still pursuing that site , he wrote , adding that the Secretary may not comply with his statutory obligation by ' concluding ' that a conclusion is impossible . "
he,add.01,Secretary may not comply with,,Affirmative,"It certainly could have used Yucca Mountain 's costs if it were still pursuing that site , he wrote , adding that the Secretary may not comply with his statutory obligation by ' concluding ' that a conclusion is impossible . "
the Secretary,comply.01,with,,Affirmative,"It certainly could have used Yucca Mountain 's costs if it were still pursuing that site , he wrote , adding that the Secretary may not comply with his statutory obligation by ' concluding ' that a conclusion is impossible . "
The court,suspend.01,the fees,,Affirmative,"The court also suspended the fees , which is good news for the industry , if not for the future of a permanent storage facility . "
Many people,wonder.01,Reid is,,Affirmative,Many people have wondered why Mr. Reid is so determined to do White House bidding even when it might hurt the political prospects of Senate Democrats . 
Majority Leader Harry Reid,do.02,House bidding,,Affirmative,Many people have wondered why Mr. Reid is so determined to do White House bidding even when it might hurt the political prospects of Senate Democrats . 
it,hurt.01,the political prospects of,,Affirmative,Many people have wondered why Mr. Reid is so determined to do White House bidding even when it might hurt the political prospects of Senate Democrats . 
his political survival,depend.01,on it,,Affirmative,Blocking Yucca is Harry 's top priority and his political survival depends on it . 
This,mean.01,he needs,,Affirmative,This means he needs Mr. Obama to help him control the Nuclear Regulatory Commission and back him on spending for Yucca . 
he,need.01,Obama to help him control,,Affirmative,This means he needs Mr. Obama to help him control the Nuclear Regulatory Commission and back him on spending for Yucca . 
Mr. Obama,help.01,control,,Affirmative,This means he needs Mr. Obama to help him control the Nuclear Regulatory Commission and back him on spending for Yucca . 
Mr. Obama,control.01,the Nuclear Regulatory Commission,,Affirmative,This means he needs Mr. Obama to help him control the Nuclear Regulatory Commission and back him on spending for Yucca . 
Mr. Obama,back.04,him,,Affirmative,This means he needs Mr. Obama to help him control the Nuclear Regulatory Commission and back him on spending for Yucca . 
that,give.01,enormous political leverage on,Mr. Obama,Affirmative,But that in turn gives Mr. Obama enormous political leverage on Mr. Reid to carry the President 's water . 
Mr. Obama,carry.01,water,,Affirmative,But that in turn gives Mr. Obama enormous political leverage on Mr. Reid to carry the President 's water . 
