United Arab Emirates, sign.02, India, A few months ago , the United Arab Emirates signed agreements with India during a visit to the country . , newsText2200, 2014\05\19
United Kingdom, join.01, Iraq, This was well maintained until Britain joined the invasion of Iraq in 2003 , when it became too dangerous to water the grass between the tombstones that became burned brown by the scorching sun . , newsText2224, 2014\05\19
United States, want.01, Iran, The six powers want Iran to scale back uranium enrichment and other sensitive nuclear activity and accept more rigorous U.N. inspections to deny it any capability of quickly producing atomic bombs , in exchange for an end to sanctions . , newsText2380, 2014\05\19
United States, give.01, Vietnam, Speaking from the same stage where he gave a fiery anti-Vietnam , anti-intervention speech upon graduating from Yale in 1966 , Kerry told graduates yesterday that America has swung too far toward isolationism . , newsText2054, 2014\05\19
United States, take.12, Iraq, And yet , because of their own obtuse and myopic world views , Obama , Hillary Clinton , and now John Kerry have been caught by surprise as the Al Qaeda that Obama assured us had been well and truly beaten is poised to take over Iraq , and there are obviously no plans of any kind in place , and no diplomatic initiatives available , to respond to the event . , newsText2054, 2014\05\19
United States, help.01, Iran, That said , people keep forgetting that Iran might be less to no problem at all if Obamarama had helped the Iranians who tried to overthrow the Ayatollas in 2011 . , newsText2054, 2014\05\19
United States, meet.02, United States, Today , Pressman says the project was enormously rewarding -- particularly for the connections he made with some of the children , who , by the time he met them , were elderly adults , nearly 70 years after the fact . , newsText2381, 2014\05\19
United States, want.01, Iran, The six powers want Iran to scale back uranium enrichment and other sensitive nuclear activity and accept more rigorous U.N. inspections to deny it any capability of quickly producing atomic bombs , in exchange for an end to sanctions . , newsText2379, 2014\05\19
United States, forget.01, Iran, That said , people keep forgetting that Iran might be less to no problem at all if Obamarama had helped the Iranians who tried to overthrow the Ayatollas in 2011 . , newsText2054, 2014\05\19
United States, agree.01, Nigeria, The U.S. has agreed on terms with Nigeria for sharing images and other intelligence gathered in the course of its assistance to the West African country in searching for the kidnapped girls , Pentagon spokesman Colonel Steve Warren said today . , newsText1834, 2014\05\19
United States, charge.01, China, The U.S. charged five Chinese military officials with economic espionage linked to computer hacking of American nuclear power , metals and solar companies , in its first public accusation that an overseas government 's employees committed cybercrimes . , newsText2052, 2014\05\19
United States, conduct.01, Nigeria, The U.S. is now conducting round - the - clock surveillance of Nigeria in search of the girls , according to Warren . , newsText1834, 2014\05\19
United States, watch.01, Libya, The United States has been closely watching events in Libya ever since the late ambassador , Chris Stevens , and three other Americans were killed in a 2012 militant attack on a US diplomatic mission in Benghazi . , newsText1961, 2014\05\19
United States, oppose.01, United States, YPF opposed a Houston roadshow conducted by Neuquen province organized to auction shale areas . , newsText2213, 2014\05\19
United States, replace.01, Russia, U.S. exports of liquefied natural gas wo n't be able to replace Russian exports to Europe as the Ukrainian crisis threatens to disrupt flows to the region . , newsText2025, 2014\05\19
United States, enter.01, Afghanistan, In the more than 12 years that have passed since U.S. troops first entered Afghanistan , 2,195 service personnel have given their lives in and around Afghanistan in support of U.S. military activities in that country . , newsText2067, 2014\05\19
United States, think.01, Australia, He comes with a strong record and I think that Australia is uniquely positioned to make use of these opportunities . , newsText2277, 2014\05\19
United States, leave.01, Afghanistan, Indeed , even after the last U.S. combat troops leave Afghanistan this year , the shadow war against jihadi terrorists that began on Sept . , newsText2070, 2014\05\19
Wales, travel.01, Canada, It is the third time they have travelled to Canada together and marks Charles 's 17th official visit to the country . , newsText2158, 2014\05\19
