A0,A0.35_Verb,A1,A2,Polarity,RelatedSentence
The City of Pittsburgh,reach.01,a contract agreement,,Affirmative,The City of Pittsburgh and Local 1 of the Fraternal Association of Professional Paramedics reached a contract agreement . 
Medics,receive.01,wage increases,,Affirmative,"Medics will receive back wage increases they were allowed under the 2009 Act 47 plan of 2 percent in 2012 and 2013 , and 2.5 percent this year . "
you,comment.01,using,,Affirmative,"If you are commenting using a Facebook account , your profile information may be displayed with your comment depending on your privacy settings . "
you,use.01,a Facebook account,,Affirmative,"If you are commenting using a Facebook account , your profile information may be displayed with your comment depending on your privacy settings . "
your comment depending on,depend.01,on,,Affirmative,"If you are commenting using a Facebook account , your profile information may be displayed with your comment depending on your privacy settings . "
