A0,A0.35_Verb,A1,A2,Polarity,RelatedSentence
Google Translate 's,acquire.01,"Quest Visual ,",,Affirmative,"Google has acquired Quest Visual , the maker of an augmented reality ( AR ) app called Word Lens Translator , which can instantly translate printed words seen through a devices camera . "
app called,translate.01,printed words seen through,,Affirmative,"Google has acquired Quest Visual , the maker of an augmented reality ( AR ) app called Word Lens Translator , which can instantly translate printed words seen through a devices camera . "
"an augmented reality -LRB- AR -RRB- app called Word Lens Translator , which can instantly translate printed words seen through a device 's camera",work.01,"on Android , iOS and",,Affirmative,"The AR app works on Android , iOS and Google Glass and translates the words seen through a camera into a chosen language , such as from Russian to English or vice versa . "
"an augmented reality -LRB- AR -RRB- app called Word Lens Translator , which can instantly translate printed words seen through a device 's camera",translate.01,the words seen through,,Affirmative,"The AR app works on Android , iOS and Google Glass and translates the words seen through a camera into a chosen language , such as from Russian to English or vice versa . "
you,see.01,the beginnings of,,Affirmative,"With Word Lens , we 've seen the beginnings of what 's possible when we harness the power of mobile devices to see the world in your language , Word Lens said . "
you,harness.01,the power of,,Affirmative,"With Word Lens , we 've seen the beginnings of what 's possible when we harness the power of mobile devices to see the world in your language , Word Lens said . "
Word Lens,say.01,", we 've seen",,Affirmative,"With Word Lens , we 've seen the beginnings of what 's possible when we harness the power of mobile devices to see the world in your language , Word Lens said . "
you,join.01,Google Translate 's,,Affirmative,"By joining Google , we can incorporate Quest Visual 's technology into Google Translate 's broad language coverage and translation capabilities in the future . "
you,incorporate.02,technology,into,Affirmative,"By joining Google , we can incorporate Quest Visual 's technology into Google Translate 's broad language coverage and translation capabilities in the future . "
