A0,A0.35_Verb,A1,A2,Polarity,RelatedSentence
Authorities in Milan,order.01,several searches,,Affirmative,"Authorities in Milan recently ordered several searches at the suspects ' homes in relation to the political propaganda , according to the report . "
Police,confiscate.01,racist and,,Affirmative,Police found and confiscated racist and anti-Semitic material at the scene . 
an ADL poll of anti-Semitism,find.01,", said",,Affirmative,"In 2012 an ADL poll of anti-Semitism found that 43 % of Italians , when asked if Jews have too much power in international financial markets , said the statement was probably true . "
Jews,have.03,much power in,,Affirmative,"In 2012 an ADL poll of anti-Semitism found that 43 % of Italians , when asked if Jews have too much power in international financial markets , said the statement was probably true . "
43 % of Italians,say.01,statement was,,Affirmative,"In 2012 an ADL poll of anti-Semitism found that 43 % of Italians , when asked if Jews have too much power in international financial markets , said the statement was probably true . "
35 % of Italians,say.01,were,,Affirmative,"Likewise , 35 % of Italians said at least 3 out of the 4 anti-Semitic stereotypes suggested were probably true . "
