A0,A0.35_Verb,A1,A2,Polarity,RelatedSentence
a security source,say.01,people were killed and,,Affirmative,"At least 10 people were killed and 11 others injured on Monday in separate attacks in the Iraqi capital Baghdad , a security source said . "
a security source,speak.01,on,,Affirmative,"Three people were killed and five others injured when a roadside bomb exploded in the predominantly Sunni Ghazaliya district of Baghdad , said the source , speaking on the condition of anonymity . "
he,add.01,also killed and,,Affirmative,"Two pro-government Sahwa gunmen were also killed and six others injured in an attack by unidentified assailants on their checkpoint in Abu Ghraib in western Baghdad , he added . "
a security source,say.01,were found with,,Affirmative,The source said five bodies of slain civilians were found with gunshot wounds in the Hussainia and Zafraniya districts of the capital . 
Recent months,see.01,an uptick in violence across Iraq,,Affirmative,Recent months have seen an uptick in violence across Iraq . 
Iraqi authorities,point.01,the finger,at,Affirmative,"Although most attacks go unclaimed , Iraqi authorities usually point the finger at Al - Qaeda - linked rebels . "
