A0,A0.35_Verb,A1,A2,Polarity,RelatedSentence
SALT LAKE CITY ( AP ) -,say.01,carriers really are,,Affirmative,SALT LAKE CITY ( AP ) - The U.S. Postal Service says Utah letter carriers really are the target of wayward dogs . 
dogs,bite.01,Service workers,,Affirmative,"Nationwide , dogs bit 5,581 Postal Service workers in 2013 . "
City postal workers,report.01,11 dog bites,,Affirmative,"Salt Lake City postal workers reported 11 dog bites last year , tying the city for 30th place in the U.S. along with six other municipalities . "
City postal workers,tie.01,the city,,Affirmative,"Salt Lake City postal workers reported 11 dog bites last year , tying the city for 30th place in the U.S. along with six other municipalities . "
Manager Jimmy Wolf,say.01,bites were reported in Utah,,Affirmative,Postal Service District Manager Jimmy Wolf says 26 bites were reported in Utah in 2012 . 
