A0,A0.35_Verb,A1,A2,Polarity,RelatedSentence
A little boy,lose.03,his fight,,Affirmative,A little boy who had been battling against a rare virus as he waited for a heart transplant has lost his fight . 
Kaylee Hickman,hold.01,her son,,Affirmative,"Kaylee Hickman holding her son Ryan Brookhouse with her partner Gary Brookhouse and their eldest son , three - year - old Harley . "
his devastated family,say.01,Brookhouse died on Saturday,,Affirmative,"Seven - month - old Ryan Brookhouse died on Saturday after his condition deteriorated , his devastated family said . "
"baby Ryan Brookhouse , who sadly passed away yesterday",contract.02,"Enterovirus ,",,Affirmative,"He had contracted Enterovirus , which left the left side of his heart unable to pump and the right side pumping fiercely to compensate , when he was four - months - old . "
"Enterovirus ,",leave.01,the left side of,unable,Affirmative,"He had contracted Enterovirus , which left the left side of his heart unable to pump and the right side pumping fiercely to compensate , when he was four - months - old . "
Doctors,try.01,different medicines,,Affirmative,Doctors had been trying different medicines in an attempt to get his heart to function but to no avail . 
"baby Ryan Brookhouse , who sadly passed away yesterday",receive.01,treatment,,Affirmative,"In recent months , he had also been receiving treatment at Freeman Hospital , in Newcastle . "
"His family ,",hope.01,he could have,,Affirmative,"His family , who come from Wolverhampton , had hoped he could have a heart transplant . "
his devastated family,have.03,a heart transplant,,Affirmative,"His family , who come from Wolverhampton , had hoped he could have a heart transplant . "
Doctors,update.01,"a Facebook page ,",,Affirmative,"They updated a Facebook page , where well - wishers had left messages of support while he had been receiving treatment , with the news he had died on Saturday after doctors were unable to do anything else to help him . "
well - wishers,leave.01,messages of support,,Affirmative,"They updated a Facebook page , where well - wishers had left messages of support while he had been receiving treatment , with the news he had died on Saturday after doctors were unable to do anything else to help him . "
his devastated family,receive.01,treatment,,Affirmative,"They updated a Facebook page , where well - wishers had left messages of support while he had been receiving treatment , with the news he had died on Saturday after doctors were unable to do anything else to help him . "
Doctors,do.02,anything else,,Affirmative,"They updated a Facebook page , where well - wishers had left messages of support while he had been receiving treatment , with the news he had died on Saturday after doctors were unable to do anything else to help him . "
Doctors,help.01,his devastated family,,Affirmative,"They updated a Facebook page , where well - wishers had left messages of support while he had been receiving treatment , with the news he had died on Saturday after doctors were unable to do anything else to help him . "
His mother,write.01,We are devastated and heartbroken,,Affirmative,His mother Kaylee Hickman wrote : We are devastated and heartbroken but have been told the only option now is to let him go . 
His mother Kaylee Hickman wrote : `` We are devastated and heartbroken but have been told the only option now,say.01,ryan passed peacefully in,,Affirmative,She later said : Our beautiful baby ryan passed peacefully in mommy 's arms at 2 pm . 
my nan,take.01,Ryan 's,,Affirmative,"Felt my nan around , she came to take him . "
Heartbroken,miss.01,baby,,Affirmative,Heartbroken going to miss you baby . 
Mommy,love.01,"Kaylee Hickman holding her son Ryan Brookhouse with her partner Gary Brookhouse and their eldest son , three-year-old Harley .",,Affirmative,Mommy loves you so much and always will . 
His father,say.01,Today I am,,Affirmative,"His father Gary Brookhouse , of Leasowes Drive , said : Today I am a proud daddy to hold my baby for the last time , but this is n't goodbye because I will see you again darlin ! "
"Gary Brookhouse , of Leasowes Drive",see.01,you again darlin,,Affirmative,"His father Gary Brookhouse , of Leasowes Drive , said : Today I am a proud daddy to hold my baby for the last time , but this is n't goodbye because I will see you again darlin ! "
those,give.01,their support,to,Affirmative,"Among those who had given their support to little Ryan , who was born at New Cross Hospital in Wolverhampton on September 30 last year , was Wolves . "
family,raise.01,money,,Affirmative,"Ryan 's family had been raising money for a charity called Children Heart Unit Fund which supports the clinical and emotional well - being of the child patients and their loved ones as well as the new Home from Home house , being built at the Freeman hospital so families can stay close to their sick children . "
a charity called,support.01,well - being of,,Affirmative,"Ryan 's family had been raising money for a charity called Children Heart Unit Fund which supports the clinical and emotional well - being of the child patients and their loved ones as well as the new Home from Home house , being built at the Freeman hospital so families can stay close to their sick children . "
Sincerest Condolences,baby.01,family,,Affirmative,So So Sorry - Sincerest Condolences to baby Ryans ' family . 
