A0,A0.35_Verb,A1,A2,Polarity,RelatedSentence
California Chrome,cross.02,the finish line victorious,,Affirmative,California Chrome crosses the finish line victorious at Saturday 's 139th running of the Preakness Stakes . 
by,host.01,a corporate tent hosted by,,Affirmative,An Amazon executive and officials from some of the state’s largest biotech firms were among the attendees at a corporate tent hosted by the Maryland Department of Business and Economic Development at Saturday’s Preakness . 
The state agency,spend.01,on,,Affirmative,"The state agency spent $ 50,000 this year on its annual hobnobbing event inside the Corporate Village area of the infield , said Karen Glenn Hood , a spokeswoman for DBED . "
"Karen Glenn Hood ,",say.01,agency spent,,Affirmative,"The state agency spent $ 50,000 this year on its annual hobnobbing event inside the Corporate Village area of the infield , said Karen Glenn Hood , a spokeswoman for DBED . "
The online retail giant,build.01,a massive fulfillment center in,,Affirmative,"The online retail giant is building a massive fulfillment center in Southeast Baltimore that is expected to create more than 1,000 jobs . "
a massive fulfillment center in,create.01,"1,000 jobs",,Affirmative,"The online retail giant is building a massive fulfillment center in Southeast Baltimore that is expected to create more than 1,000 jobs . "
you,comment.01,using,,Affirmative,"If you are commenting using a Facebook account , your profile information may be displayed with your comment depending on your privacy settings . "
you,use.01,a Facebook account,,Affirmative,"If you are commenting using a Facebook account , your profile information may be displayed with your comment depending on your privacy settings . "
your comment depending on,depend.01,on,,Affirmative,"If you are commenting using a Facebook account , your profile information may be displayed with your comment depending on your privacy settings . "
