A0,A0.35_Verb,A1,A2,Polarity,RelatedSentence
National Employment Agency,provide.01,employment,to,Affirmative,"Bulgaria 's National Employment Agency will provide employment to 7,500 young people under the Youth Employment scheme of the new OP Human Resources Development . "
candidates,have.03,a university or,,Affirmative,"In order for their applications to be considered , candidates must have a university or vocational school education , Rositsa Yankova , Deputy Minister of Labor and Social Policy informed . "
"Rositsa Yankova ,",inform.01,", candidates must have",,Affirmative,"In order for their applications to be considered , candidates must have a university or vocational school education , Rositsa Yankova , Deputy Minister of Labor and Social Policy informed . "
the Youth Employment scheme of the new OP Human Resources Development,allocate.01,funding for wages,,Affirmative,The new scheme will allocate funding for wages and will cover insurance costs for six months in case the employee is offered permanent contract . 
Employers,receive.01,funds for,,Affirmative,"Employers will be entitled to receive funds for mentor amounting to 50 % of the minimum wage , Investor.bg informs . "
by,allocate.01,M state funding,,Affirmative,"The scheme is for BGN 35 M , and some BGN 20 M state funding will be allocated by the end of 2014 and then refunded by the European Commission . "
