A0,A0.35_Verb,A1,A2,Polarity,RelatedSentence
Union,reconstitute.01,AMSU Kakching Khunou Branch,,Affirmative,"Imphal , May 19 2014 : As part of its measures to reform units and branches , All Manipur Students ' Union ( AMSU ) reconstituted AMSU Kakching Khunou Branch during a meeting held at the union 's head office on May 16 . "
a meeting held at the union 's head office on May 16,elect.01,Thingam Ramesh Singh,"as president ,",Affirmative,"The meeting also elected Thingam Ramesh Singh as president , Angom Angousana Meitei as vice-president and Angom Jotin Singh as general secretary of the newly constituted branch . "
by users in,post.01,Comments posted by users in,,Affirmative,* Comments posted by users in this discussion thread and other parts of this site are opinions of the individuals posting them ( whose user ID is displayed alongside ) and not the views of e - pao.net . 
Comments posted by users in,post.01,them (,,Affirmative,* Comments posted by users in this discussion thread and other parts of this site are opinions of the individuals posting them ( whose user ID is displayed alongside ) and not the views of e - pao.net . 
We,recommend.01,"that users exercise responsibility , sensitivity and caution",,Affirmative,"We strongly recommend that users exercise responsibility , sensitivity and caution over language while writing your opinions which will be seen and read by other users . "
users,exercise.01,"responsibility , sensitivity and caution",,Affirmative,"We strongly recommend that users exercise responsibility , sensitivity and caution over language while writing your opinions which will be seen and read by other users . "
users,write.01,your opinions,,Affirmative,"We strongly recommend that users exercise responsibility , sensitivity and caution over language while writing your opinions which will be seen and read by other users . "
by,read.01,your opinions,,Affirmative,"We strongly recommend that users exercise responsibility , sensitivity and caution over language while writing your opinions which will be seen and read by other users . "
