A0,A0.35_Verb,A1,A2,Polarity,RelatedSentence
- President of,receive.01,famous writer and,,Affirmative,- President of the Nagorno - Karabakh Republic Bako Sahakyan received famous writer and scenarist Kim Bakshi . 
President Sahakyan,express.01,gratitude,to,Affirmative,"President Sahakyan expressed gratitude to Kim Bakshi for creating valuable works about Artsakh and Armenia , our nation 's history and culture underlining its importance both for the Armenian people and the outer world . "
history and culture,underline.01,its importance,,Affirmative,"President Sahakyan expressed gratitude to Kim Bakshi for creating valuable works about Artsakh and Armenia , our nation 's history and culture underlining its importance both for the Armenian people and the outer world . "
minister Narine Aghabalyan,participate.01,in,,Affirmative,NKR culture and youth affairs minister Narine Aghabalyan participated in the meeting . 
by,own.01,The copyright for information published on,,Affirmative,The copyright for information published on this web site is owned exclusively by Armenian News - NEWS.am information - analytical agency . 
it,acquire.01,written permission,from,Affirmative,For full or partial reproduction of any material in other media it is required to acquire written permission from Armenian News - NEWS.am information - analytical agency . 
"Those ,",commit.02,copyright violations,,Affirmative,"Those , who have committed copyright violations , will be prosecuted accordingly . "
