A0,A0.35_Verb,A1,A2,Polarity,RelatedSentence
governor Robert F. McDonnell and,accept.01,"gifts ,",,Affirmative,"Former Virginia governor Robert F. McDonnell and his wife , Maureen , were charged with illegally accepting gifts , luxury vacations and large loans from a wealthy Richmond - area businessman . "
A federal judge,say.01,he expected,,Affirmative,RICHMOND - A federal judge said he expected to rule Tuesday whether to toss out federal corruption charges against former Virginia governor Robert F. McDonnell ( R ) and his wife . 
A federal judge,expect.01,to rule Tuesday,,Affirmative,RICHMOND - A federal judge said he expected to rule Tuesday whether to toss out federal corruption charges against former Virginia governor Robert F. McDonnell ( R ) and his wife . 
A federal judge,rule.01,whether to toss out,,Affirmative,RICHMOND - A federal judge said he expected to rule Tuesday whether to toss out federal corruption charges against former Virginia governor Robert F. McDonnell ( R ) and his wife . 
defense teams,argue.01,McDonnells neither promised nor performed,,Affirmative,"During a Monday hearing , defense teams argued that the McDonnells neither promised nor performed any official acts for Jonnie R. Williams Sr . "
The McDonnells ',performed.01,any official acts for,,Affirmative,"During a Monday hearing , defense teams argued that the McDonnells neither promised nor performed any official acts for Jonnie R. Williams Sr . "
area businessman,lavish.01,gifts and loans,,Affirmative,", the Richmond area businessman who is said to have lavished gifts and loans on the couple in exchange for their help . "
the defense,say.01,couple should be tried separately,,Affirmative,"If the case does go forward , the defense said , the couple should be tried separately so that Maureen McDonnell could freely testify that she kept her husband in the dark about some things Williams gave her . "
Maureen McDonnell,testify.01,that she kept,,Affirmative,"If the case does go forward , the defense said , the couple should be tried separately so that Maureen McDonnell could freely testify that she kept her husband in the dark about some things Williams gave her . "
she,keep.02,her husband,in,Affirmative,"If the case does go forward , the defense said , the couple should be tried separately so that Maureen McDonnell could freely testify that she kept her husband in the dark about some things Williams gave her . "
the dark about some things Williams,give.01,some things,her,Affirmative,"If the case does go forward , the defense said , the couple should be tried separately so that Maureen McDonnell could freely testify that she kept her husband in the dark about some things Williams gave her . "
they,lend.01,the prestige of,to Williams,Affirmative,"The McDonnells were indicted in January on charges they lent the prestige of the governor 's office to Williams and a company he used to run , Star Scientific , in exchange for money , clothes , trips and private plane rides . "
he,run.01,Star Scientific,,Affirmative,"The McDonnells were indicted in January on charges they lent the prestige of the governor 's office to Williams and a company he used to run , Star Scientific , in exchange for money , clothes , trips and private plane rides . "
They,plead.02,not guilty,,Affirmative,"They have pleaded not guilty , and a jury trial is scheduled for July 28 . "
she,have.03,communications with Williams,,Affirmative,"If the former first lady is tried on her own , she could testify - without fear of self - incrimination - that she had communications with Williams that she did not tell her husband about or misled her husband about , said Henry W. Asbill , an attorney for the former governor . "
she,mislead.01,her husband about,,Affirmative,"If the former first lady is tried on her own , she could testify - without fear of self - incrimination - that she had communications with Williams that she did not tell her husband about or misled her husband about , said Henry W. Asbill , an attorney for the former governor . "
"Henry W. Asbill ,",say.01,- that she had communications with Williams,,Affirmative,"If the former first lady is tried on her own , she could testify - without fear of self - incrimination - that she had communications with Williams that she did not tell her husband about or misled her husband about , said Henry W. Asbill , an attorney for the former governor . "
Attorney Michael S. Dry,argue.01,against,,Affirmative,Assistant U.S. Attorney Michael S. Dry argued against both motions . 
He,contend.01,that prosecutors have evidence,,Affirmative,"He contended that prosecutors have evidence that Robert McDonnell was aware of at least some of the gifts that the defense argued he knew nothing about , and Dry cited an e-mail from McDonnell thanking Williams for picking up the catering tab at his daughter 's wedding . "
prosecutors,have.03,evidence,,Affirmative,"He contended that prosecutors have evidence that Robert McDonnell was aware of at least some of the gifts that the defense argued he knew nothing about , and Dry cited an e-mail from McDonnell thanking Williams for picking up the catering tab at his daughter 's wedding . "
the defense,argue.01,he knew nothing about,,Affirmative,"He contended that prosecutors have evidence that Robert McDonnell was aware of at least some of the gifts that the defense argued he knew nothing about , and Dry cited an e-mail from McDonnell thanking Williams for picking up the catering tab at his daughter 's wedding . "
he,know.01,nothing about,,Affirmative,"He contended that prosecutors have evidence that Robert McDonnell was aware of at least some of the gifts that the defense argued he knew nothing about , and Dry cited an e-mail from McDonnell thanking Williams for picking up the catering tab at his daughter 's wedding . "
Assistant U.S. Attorney Michael S. Dry,cite.01,an e-mail from McDonnell,,Affirmative,"He contended that prosecutors have evidence that Robert McDonnell was aware of at least some of the gifts that the defense argued he knew nothing about , and Dry cited an e-mail from McDonnell thanking Williams for picking up the catering tab at his daughter 's wedding . "
an e-mail from McDonnell,thank.01,Williams,for picking up,Affirmative,"He contended that prosecutors have evidence that Robert McDonnell was aware of at least some of the gifts that the defense argued he knew nothing about , and Dry cited an e-mail from McDonnell thanking Williams for picking up the catering tab at his daughter 's wedding . "
Williams,pick.04,the catering tab,,Affirmative,"He contended that prosecutors have evidence that Robert McDonnell was aware of at least some of the gifts that the defense argued he knew nothing about , and Dry cited an e-mail from McDonnell thanking Williams for picking up the catering tab at his daughter 's wedding . "
Dry,say.01,defense had made,,Affirmative,"Dry said the defense had made only vague assertions about Maureen McDonnell 's planned testimony , failing to lay out specific exculpatory evidence that she might provide on her husband 's behalf . "
the defense,make.02,only vague assertions about,,Affirmative,"Dry said the defense had made only vague assertions about Maureen McDonnell 's planned testimony , failing to lay out specific exculpatory evidence that she might provide on her husband 's behalf . "
she,provide.01,specific exculpatory evidence,on,Affirmative,"Dry said the defense had made only vague assertions about Maureen McDonnell 's planned testimony , failing to lay out specific exculpatory evidence that she might provide on her husband 's behalf . "
he,question.01,McDonnell would be willing testify in,,Affirmative,And he questioned why Maureen McDonnell would be willing testify in her husband 's trial only if it were severed from her own case . 
He,note.01,could be read into,,Affirmative,He noted that any testimony she might provide at the former governor 's trial could be read into the record at her own . 
she,provide.01,any testimony,,Affirmative,He noted that any testimony she might provide at the former governor 's trial could be read into the record at her own . 
he,say.01,could be used against her,,Affirmative,"All of that could be used against her , he said . "
He,speculate.01,defense wanted,,Affirmative,He speculated that the defense wanted to shield the jury deciding her fate from the theater of her live testimony . 
the defense,want.01,to shield,,Affirmative,He speculated that the defense wanted to shield the jury deciding her fate from the theater of her live testimony . 
the defense,shield.01,the jury,,Affirmative,He speculated that the defense wanted to shield the jury deciding her fate from the theater of her live testimony . 
the defense,decide.01,her fate,,Affirmative,He speculated that the defense wanted to shield the jury deciding her fate from the theater of her live testimony . 
defense attorneys,contend.01,- are not official,,Affirmative,The McDonnells ' defense attorneys have contended that the actions the McDonnells are accused of taking for Williams and Star - including arranging meetings between Williams and state officials and promoting Star 's products - are not official . 
The McDonnells ',arrange.01,meetings between Williams and,,Affirmative,The McDonnells ' defense attorneys have contended that the actions the McDonnells are accused of taking for Williams and Star - including arranging meetings between Williams and state officials and promoting Star 's products - are not official . 
Prosecutors,prove.01,McDonnells either performed or promised,,Affirmative,Prosecutors must prove that the McDonnells either performed or promised to perform official acts to substantiate the corruption charges . 
the McDonnells,perform.01,official acts,,Affirmative,Prosecutors must prove that the McDonnells either performed or promised to perform official acts to substantiate the corruption charges . 
The defense,note.01,that donors often have access to politicians,,Affirmative,"The defense noted that donors often have access to politicians , citing Gov. Terry McAuliffe 's newly formed political action committee 's fundraising materials , which promise a private dinner with the governor and his family , participation in a roundtable discussion and a monthly sit - down with policy experts in exchange for $ 100,000 . "
donors,have.03,access to politicians,,Affirmative,"The defense noted that donors often have access to politicians , citing Gov. Terry McAuliffe 's newly formed political action committee 's fundraising materials , which promise a private dinner with the governor and his family , participation in a roundtable discussion and a monthly sit - down with policy experts in exchange for $ 100,000 . "
donors,cite.01,"fundraising materials ,",,Affirmative,"The defense noted that donors often have access to politicians , citing Gov. Terry McAuliffe 's newly formed political action committee 's fundraising materials , which promise a private dinner with the governor and his family , participation in a roundtable discussion and a monthly sit - down with policy experts in exchange for $ 100,000 . "
solicitation,cause.01,problems for McAuliffe,,Affirmative,"The PAC 's solicitation caused problems for McAuliffe ( D ) , who later said that it went out without his knowledge . "
McAuliffe,say.01,that it went out without,,Affirmative,"The PAC 's solicitation caused problems for McAuliffe ( D ) , who later said that it went out without his knowledge . "
the McDonnells,take.01,the acts,,Affirmative,"Prosecutors have countered that the acts the McDonnells took for Williams were official , even if they were not particularly substantial . "
attorneys for McDonnell,file.01,paperwork,to subpoena,Affirmative,"Also on Monday , attorneys for McDonnell filed paperwork to subpoena 25 former members of his administration to testify on his behalf at trial . "
The breadth of,suggest.01,that McDonnell is confident,,Affirmative,The breadth of the list suggests that McDonnell is confident that his former employees will support his version of events - that he never sought special treatment for Williams . 
his former employees,support.01,his version of events,,Affirmative,The breadth of the list suggests that McDonnell is confident that his former employees will support his version of events - that he never sought special treatment for Williams . 
he,seek.01,special treatment for Williams,,Affirmative,The breadth of the list suggests that McDonnell is confident that his former employees will support his version of events - that he never sought special treatment for Williams . 
the judge,dismiss.01,the corruption charges,,Affirmative,"If the judge dismissed the corruption charges , the couple would face counts stemming from false information prosecutors say they put on financial documents.The McDonnells have disputed those charges , too , but did not formally move to have them dismissed . "
the couple in exchange for their help,face.01,counts stemming from,,Affirmative,"If the judge dismissed the corruption charges , the couple would face counts stemming from false information prosecutors say they put on financial documents.The McDonnells have disputed those charges , too , but did not formally move to have them dismissed . "
by,accompany.01,The McDonnells,,Affirmative,"The McDonnells were accompanied in court by the Rev. Wayne Ball of St. Patrick 's Catholic Church , where the couple worshiped while in the governor 's mansion . "
the couple,emerge.01,from,,Affirmative,"After the hearing , the couple emerged from the courthouse onto a sidewalk filled with reporters and TV cameras but ignored most of the questions called out to them . "
the couple,ignore.01,most of,,Affirmative,"After the hearing , the couple emerged from the courthouse onto a sidewalk filled with reporters and TV cameras but ignored most of the questions called out to them . "
a TV reporter,ask.01,if he had,,Affirmative,The former governor did respond when a TV reporter asked if he had any comment on his guilt or innocence . 
the former governor 's,have.03,any comment on,,Affirmative,The former governor did respond when a TV reporter asked if he had any comment on his guilt or innocence . 
he,add.01,Have,,Affirmative,"Have a nice day , he added before he and his wife climbed into the back seat of a waiting white Toyota , which bore the license plate 5BLESNG . "
"a waiting white Toyota ,",bear.01,the license plate,,Affirmative,"Have a nice day , he added before he and his wife climbed into the back seat of a waiting white Toyota , which bore the license plate 5BLESNG . "
Laura Vozzella,cover.01,Virginia politics for,,Affirmative,Laura Vozzella covers Virginia politics for The Washington Post . 
Jenna Portnoy,cover.01,Virginia politics for,,Affirmative,Jenna Portnoy covers Virginia politics for The Washington Post . 
Fact Checkers,contribute.01,"questions , information and facts",to,Affirmative,"Fact Checkers contribute questions , information and facts to The Fact Checker . "
Post contributors,write.01,articles or columns,,Affirmative,"Post contributors are n't staff , but may write articles or columns . "
Post reporters or editors,recommend.01,this comment or,,Affirmative,Washington Post reporters or editors recommend this comment or reader post . 
You,report.01,a comment,,Affirmative,You must be logged in to report a comment . 
our editors,find.02,particularly useful or relevant,,Affirmative,"Comments our editors find particularly useful or relevant are displayed in Top Comments , as are comments by users with these badges : . "
