A0,A0.35_Verb,A1,A2,Polarity,RelatedSentence
SYRIZA party candidate for Governor of,lead.02,the two races,,Affirmative,"ATHENS , May 19 ( Xinhua ) -- Greece 's main opposition Radical Left SYRIZA party candidate for Governor of Attica Region Rena Dourou and incumbent Mayor of the Municipality of Athens Yorgos Kaminis lead the two races which are considered as key barometers for the nationwide overall results in Sunday 's local elections and next Sunday 's polls for the European parliament , the first official estimates showed . "
the first official estimates,show.01,lead,,Affirmative,"ATHENS , May 19 ( Xinhua ) -- Greece 's main opposition Radical Left SYRIZA party candidate for Governor of Attica Region Rena Dourou and incumbent Mayor of the Municipality of Athens Yorgos Kaminis lead the two races which are considered as key barometers for the nationwide overall results in Sunday 's local elections and next Sunday 's polls for the European parliament , the first official estimates showed . "
Rena Dourou,win.01,23.8 percent,,Affirmative,"With about 11 percent of all votes counted , Dourou wins 23.8 percent with incumbent Governor Yannis Sgouros who had the support of the co-ruling socialists also qualifying in the second round next Sunday with 22 percent , according to the estimates released by the Interior Ministry on Sunday night . "
Governor Yannis Sgouros,have.03,the support of,,Affirmative,"With about 11 percent of all votes counted , Dourou wins 23.8 percent with incumbent Governor Yannis Sgouros who had the support of the co-ruling socialists also qualifying in the second round next Sunday with 22 percent , according to the estimates released by the Interior Ministry on Sunday night . "
by,release.01,the estimates released by,,Affirmative,"With about 11 percent of all votes counted , Dourou wins 23.8 percent with incumbent Governor Yannis Sgouros who had the support of the co-ruling socialists also qualifying in the second round next Sunday with 22 percent , according to the estimates released by the Interior Ministry on Sunday night . "
MP Elias Panagiotaros,win.01,11.1 percent,,Affirmative,"Euro parliament MP Yorgos Koumoutsakos of the conservative ruling New Democracy ( ND ) party garners 14.2 percent of votes , while neo-fascist Golden Dawn ( GD ) party MP Elias Panagiotaros wins 11.1 percent . "
by,support.01,Kaminis,,Affirmative,"In the Athens mayoral battle , Kaminis who was supported by the centre-Left and liberals , was marginally ahead with 21 percent of votes over 20.3 percent for SYRIZA 's candidate Gavriil Sakellaridis . "
by,support.01,Minister supported by,,Affirmative,"Aris Spiliotopoulos , a former Tourism and Education Minister supported by the conservative ruling New Democracy party ( ND ) ranked third with 17.1 percent , while GD spokesman Elias Kassidiaris fourth with 16.3 percent . "
by,back.01,Candidates in elections for municipal and regional councils under the Greek Constitution,,Affirmative,"Candidates in elections for municipal and regional councils under the Greek Constitution run as independents , but traditionally they are strongly backed by political parties which count the result among their wins or losses . "
political parties,count.01,the result among,,Affirmative,"Candidates in elections for municipal and regional councils under the Greek Constitution run as independents , but traditionally they are strongly backed by political parties which count the result among their wins or losses . "
million registered voters,cast.01,ballots,,Affirmative,About 9.8 million registered voters were eligible to cast ballots to elect their representatives over the next five years to a total of 325 municipalities and 13 regions across Greece . 
The battles for,have.03,a special significance for analysts among,,Affirmative,"The battles for the Municipality of Athens and the Region of Attica have a special significance for analysts among the parties and pollsters , since about half of the country 's population lives in the Greek capital and its suburbs . "
the debt crisis,hit.01,Greece,,Affirmative,"The top topic on the agenda was the debt crisis which hit Greece since 2009 and the parties ' strategies to address it , as it happened in the 2012 general elections which showed a country divided between pro-bailout and anti-bailout forces . "
the 2012 general elections,show.01,a country divided between pro-bailout and,,Affirmative,"The top topic on the agenda was the debt crisis which hit Greece since 2009 and the parties ' strategies to address it , as it happened in the 2012 general elections which showed a country divided between pro-bailout and anti-bailout forces . "
the early results,reveal.01,a divided country and,,Affirmative,"Even though the early results revealed again a divided country and the final official results of the first round of local polls are expected by Monday noon , both sides appeared satisfied and confident about the eventual outcome on May 25 . "
Greek voters,contribute.01,to strengthen,,Affirmative,"Greek voters can contribute to strengthen the sense of security that we can move forward , Prime Minister Antonis Samaras commented after the release of the first official estimates on the outcome of the first round . "
Greek voters,strengthen.01,the sense of security,,Affirmative,"Greek voters can contribute to strengthen the sense of security that we can move forward , Prime Minister Antonis Samaras commented after the release of the first official estimates on the outcome of the first round . "
Minister Antonis Samaras,comment.02,voters can contribute,,Affirmative,"Greek voters can contribute to strengthen the sense of security that we can move forward , Prime Minister Antonis Samaras commented after the release of the first official estimates on the outcome of the first round . "
Prime Minister Antonis Samaras,promote.02,stability,versus,Affirmative,He promoted stability versus the change sought by SYRIZA and other opposition parties . 
by SYRIZA and,seek.01,the change sought by SYRIZA and,,Affirmative,He promoted stability versus the change sought by SYRIZA and other opposition parties . 
citizens,take.01,a first step,,Affirmative,"Today citizens took a first step , next Sunday will be the start of a new era , SYRIZA party chief Alexis Tsipras said , stressing that the May 25 elections will be a sort of referendum on the bailout deals struck in 2010 with international lenders as well as a referendum on the government 's future . "
chief Alexis Tsipras,say.01,Sunday will be,,Affirmative,"Today citizens took a first step , next Sunday will be the start of a new era , SYRIZA party chief Alexis Tsipras said , stressing that the May 25 elections will be a sort of referendum on the bailout deals struck in 2010 with international lenders as well as a referendum on the government 's future . "
chief Alexis Tsipras,stress.01,elections will be,,Affirmative,"Today citizens took a first step , next Sunday will be the start of a new era , SYRIZA party chief Alexis Tsipras said , stressing that the May 25 elections will be a sort of referendum on the bailout deals struck in 2010 with international lenders as well as a referendum on the government 's future . "
political analysts in Athens,note.01,the alarming strong performance of,,Affirmative,"Beyond the conflicting signals for the strength of the ruling and main opposition parties , political analysts in Athens noted the alarming strong performance of GD candidates in the first elections after the beginning of the crackdown against the party last October after the murder of a Leftist activist by a GD supporter . "
almost the entire GD parliamentary group,face.01,charges for participating in,,Affirmative,"Even though almost the entire GD parliamentary group faces charges for participating in a criminal organization , the party seems to still capitalize on Greeks ' anger at austerity , as it had happened in the general elections when the party entered the parliament for first time winning seven percent of votes . "
almost the entire GD parliamentary group,participate.01,in,,Affirmative,"Even though almost the entire GD parliamentary group faces charges for participating in a criminal organization , the party seems to still capitalize on Greeks ' anger at austerity , as it had happened in the general elections when the party entered the parliament for first time winning seven percent of votes . "
the conservative ruling New Democracy -LRB- ND -RRB- party,capitalize.02,on,,Affirmative,"Even though almost the entire GD parliamentary group faces charges for participating in a criminal organization , the party seems to still capitalize on Greeks ' anger at austerity , as it had happened in the general elections when the party entered the parliament for first time winning seven percent of votes . "
the conservative ruling New Democracy -LRB- ND -RRB- party,enter.01,the European parliament,,Affirmative,"Even though almost the entire GD parliamentary group faces charges for participating in a criminal organization , the party seems to still capitalize on Greeks ' anger at austerity , as it had happened in the general elections when the party entered the parliament for first time winning seven percent of votes . "
the conservative ruling New Democracy -LRB- ND -RRB- party,win.01,seven percent of votes,,Affirmative,"Even though almost the entire GD parliamentary group faces charges for participating in a criminal organization , the party seems to still capitalize on Greeks ' anger at austerity , as it had happened in the general elections when the party entered the parliament for first time winning seven percent of votes . "
