A0,A0.35_Verb,A1,A2,Polarity,RelatedSentence
Ukrainian authorities,say.01,were killed by chloroform and,,Affirmative,Ukrainian authorities said 32 pro-Russian protesters who died during violent clashes in the Black Sea port Odessa were killed by chloroform and not the fire that ravaged the union building where they took shelter . 
by chloroform and,kill.01,32 pro-Russian protesters,,Affirmative,Ukrainian authorities said 32 pro-Russian protesters who died during violent clashes in the Black Sea port Odessa were killed by chloroform and not the fire that ravaged the union building where they took shelter . 
not the fire,ravage.01,the union building,,Affirmative,Ukrainian authorities said 32 pro-Russian protesters who died during violent clashes in the Black Sea port Odessa were killed by chloroform and not the fire that ravaged the union building where they took shelter . 
Ukrainian authorities,take.01,shelter,,Affirmative,Ukrainian authorities said 32 pro-Russian protesters who died during violent clashes in the Black Sea port Odessa were killed by chloroform and not the fire that ravaged the union building where they took shelter . 
Ministry Chief Investigator Vitaliy Sakal,say.01,police had arrested,,Affirmative,Interior Ministry Chief Investigator Vitaliy Sakal said police had arrested 12 people in connection with the case on both sides and 22 more were under suspicion . 
police,arrest.01,12 people,,Affirmative,Interior Ministry Chief Investigator Vitaliy Sakal said police had arrested 12 people in connection with the case on both sides and 22 more were under suspicion . 
the former,accuse.01,the latter of abusing,,Affirmative,"The deaths have fueled a war of words between the Russia and Ukraine , with the former accusing the latter of abusing Russian - speakers , while the government in Kiev says President Vladimir Putin wants to divide Ukraine before a May 25 presidential election . "
the government in Kiev,say.01,Putin wants,,Affirmative,"The deaths have fueled a war of words between the Russia and Ukraine , with the former accusing the latter of abusing Russian - speakers , while the government in Kiev says President Vladimir Putin wants to divide Ukraine before a May 25 presidential election . "
President Vladimir Putin,want.01,to divide Ukraine before,,Affirmative,"The deaths have fueled a war of words between the Russia and Ukraine , with the former accusing the latter of abusing Russian - speakers , while the government in Kiev says President Vladimir Putin wants to divide Ukraine before a May 25 presidential election . "
President Vladimir Putin,divide.02,Ukraine 's,,Affirmative,"The deaths have fueled a war of words between the Russia and Ukraine , with the former accusing the latter of abusing Russian - speakers , while the government in Kiev says President Vladimir Putin wants to divide Ukraine before a May 25 presidential election . "
both sides of,throw.01,Molotov cocktails,,Affirmative,"Six people were also killed in fighting nearby and 10 more died after jumping out of windows to escape the fire , which started after both sides of the violence threw Molotov cocktails , Sakal said . "
Interior Ministry Chief Investigator Vitaliy Sakal,say.01,people were also killed in fighting nearby,,Affirmative,"Six people were also killed in fighting nearby and 10 more died after jumping out of windows to escape the fire , which started after both sides of the violence threw Molotov cocktails , Sakal said . "
Interior Ministry Chief Investigator Vitaliy Sakal,say.01,indicated,,Affirmative,"He said the traces of chloroform found in the building indicated it was there for several days before the violence , and authorities were looking into how and why it came to be there . "
the traces of chloroform found in,indicate.01,it was there for,,Affirmative,"He said the traces of chloroform found in the building indicated it was there for several days before the violence , and authorities were looking into how and why it came to be there . "
Ukrainian authorities,look.01,into,,Affirmative,"He said the traces of chloroform found in the building indicated it was there for several days before the violence , and authorities were looking into how and why it came to be there . "
Ukraine 's,ask.02,to send specialists,Israel,Affirmative,"Ukraine has asked Israel to send specialists to assist the investigation , he said . "
Israel,send.02,specialists,,Affirmative,"Ukraine has asked Israel to send specialists to assist the investigation , he said . "
specialists,assist.01,the investigation,,Affirmative,"Ukraine has asked Israel to send specialists to assist the investigation , he said . "
Interior Ministry Chief Investigator Vitaliy Sakal,say.01,Ukraine has asked Israel,,Affirmative,"Ukraine has asked Israel to send specialists to assist the investigation , he said . "
Ukrainian forces,battle.01,armed separatist rebels,,Affirmative,"Ukrainian forces are battling armed separatist rebels who have declared independence for the country 's eastern Donetsk and Luhansk regions and have said they want join Russia , which annexed the Black Sea peninsula Crimea from Ukraine in March . "
armed separatist rebels,declare.02,independence for,,Affirmative,"Ukrainian forces are battling armed separatist rebels who have declared independence for the country 's eastern Donetsk and Luhansk regions and have said they want join Russia , which annexed the Black Sea peninsula Crimea from Ukraine in March . "
armed separatist rebels,say.01,"they want join Russia ,",,Affirmative,"Ukrainian forces are battling armed separatist rebels who have declared independence for the country 's eastern Donetsk and Luhansk regions and have said they want join Russia , which annexed the Black Sea peninsula Crimea from Ukraine in March . "
specialists,want.01,"join Russia ,",,Affirmative,"Ukrainian forces are battling armed separatist rebels who have declared independence for the country 's eastern Donetsk and Luhansk regions and have said they want join Russia , which annexed the Black Sea peninsula Crimea from Ukraine in March . "
specialists,join.01,"Russia ,",,Affirmative,"Ukrainian forces are battling armed separatist rebels who have declared independence for the country 's eastern Donetsk and Luhansk regions and have said they want join Russia , which annexed the Black Sea peninsula Crimea from Ukraine in March . "
"Russia ,",annex.01,Sea peninsula Crimea,from Ukraine,Affirmative,"Ukrainian forces are battling armed separatist rebels who have declared independence for the country 's eastern Donetsk and Luhansk regions and have said they want join Russia , which annexed the Black Sea peninsula Crimea from Ukraine in March . "
government soldiers,fight.01,"the insurgents ,",,Affirmative,"Two dozen government soldiers have died fighting the insurgents , whom the U.S. and European Union say Russia is supporting with money and special forces . "
the U.S. and,say.01,Russia is supporting with money and,,Affirmative,"Two dozen government soldiers have died fighting the insurgents , whom the U.S. and European Union say Russia is supporting with money and special forces . "
President Vladimir Putin,order.01,tens of thousands of,,Affirmative,"Putin ordered tens of thousands of Russian troops near the Ukrainian border back to base today , the Kremlin said . "
the Kremlin,say.01,Putin ordered,,Affirmative,"Putin ordered tens of thousands of Russian troops near the Ukrainian border back to base today , the Kremlin said . "
Atlantic Treaty Organization,say.01,it had seen,,Affirmative,The North Atlantic Treaty Organization said it had seen no sign of a withdrawal . 
The North Atlantic Treaty Organization,see.01,no sign of,,Affirmative,The North Atlantic Treaty Organization said it had seen no sign of a withdrawal . 
"Bloomberg ,",send.01,offers and promotions,me,Affirmative,"Bloomberg , on behalf of itself and select partners , may send me offers and promotions . "
you,subscribe.01,to,,Affirmative,Thank you for subscribing to our Daily Newsletter . 
You,receive.01,a confirmation email,,Affirmative,You will receive a confirmation email shortly at . 
