A0,A0.35_Verb,A1,A2,Polarity,RelatedSentence
DOHA :,preside.01,over,,Affirmative,"DOHA : The Emir H H Sheikh Tamim bin Hamad Al Thani ,  also Chairman of the Supreme Council For Economic Affairs And Investment , yesterday presided over the third meeting of ( SCEAI ) in 2014 at the Emiri Diwan . "
It,develop.02,Al Karanaa Industrial Area,,Affirmative,It was decided to develop Al Karanaa Industrial Area and fully dedicate it to small and medium enterprises ( SMEs ) . 
It,dedicate.01,Al Karanaa Industrial Area,to,Affirmative,It was decided to develop Al Karanaa Industrial Area and fully dedicate it to small and medium enterprises ( SMEs ) . 
Qatar News Agency,report.01,is,,Affirmative,"The Economic Zones Company affiliated to Qatar Authority for the Development of SMEs is to develop Al Karanaa Industrial Area , Qatar News Agency reported yesterday . "
by,attend.01,the third meeting of -LRB- SCEAI -RRB- in 2014,,Affirmative,"The meeting was attended by the Prime Minister and Interior Minister H E Sheikh Abdullah bin Nasser bin Khalifa Al Thani , also Deputy Chairman , SCEAI . "
the Prime Minister,add.01,agenda also included,,Affirmative,He added that the agenda also included latest developments related to the industry and petrochemicals affairs and projects of Qatar Petroleum International ( QPI ) . 
with,concern.02,Supreme Council For Economic Affairs And Investment,,Affirmative,The council is generally concerned with economic and energy affairs and the investment of the country 's surplus financial resources . 
