A0,A0.35_Verb,A1,A2,Polarity,RelatedSentenceEarly Monday morning AstraZeneca,note.01,the recent decline in,,Affirmative,"In the context of the above , AstraZeneca notes the recent decline in Pfizer 's share price , which has fallen by 5.3 % since the release of Pfizer 's Q1 2014 results . "
The Board,believe.01,structure brings,,Affirmative,The Board believes this structure brings increased uncertainty as regards the delivery of value for AstraZeneca shareholders . 
this structure,bring.01,increased uncertainty,,Affirmative,The Board believes this structure brings increased uncertainty as regards the delivery of value for AstraZeneca shareholders . 
The Board,believe.01,", remains inadequate",,Affirmative,"The Board believes that Pfizer 's Final Proposal , in relation to price , form of consideration and the four particular points that are central to the Board 's concerns around value , remains inadequate . "
the Board,reject.01,the Final Proposal,,Affirmative,"Accordingly , the Board has rejected the Final Proposal . "
by AstraZeneca,make.LV,This statement,,Affirmative,This statement is being made by AstraZeneca without prior agreement or approval of Pfizer . 
US drug giant Pfizer,make.02,it clear,,Affirmative,Pfizer has made it clear it wants to buy British - based AstraZeneca and that it will pay £63bn for it but there 's no official bid . 
US drug giant Pfizer,want.01,to buy,,Affirmative,Pfizer has made it clear it wants to buy British - based AstraZeneca and that it will pay £63bn for it but there 's no official bid . 
US drug giant Pfizer,buy.01,based AstraZeneca,,Affirmative,Pfizer has made it clear it wants to buy British - based AstraZeneca and that it will pay £63bn for it but there 's no official bid . 
AstraZeneca,make.02,it plain,,Affirmative,"AstraZeneca has made it plain it 's not interested , at least not for that amount , and the management have n't even held talks . "
the management,hold.04,talks,,Affirmative,"AstraZeneca has made it plain it 's not interested , at least not for that amount , and the management have n't even held talks . "
No. Pfizer,raise.01,its bid,,Affirmative,No. Pfizer can raise its bid or launch a hostile takeover offer in which it appeals directly to AstraZeneca 's shareholders to sell up - which they may do thinking it is a better deal . 
No. Pfizer,launch.01,a hostile takeover offer,,Affirmative,No. Pfizer can raise its bid or launch a hostile takeover offer in which it appeals directly to AstraZeneca 's shareholders to sell up - which they may do thinking it is a better deal . 
Early Monday morning AstraZeneca,appeal.03,to,,Affirmative,No. Pfizer can raise its bid or launch a hostile takeover offer in which it appeals directly to AstraZeneca 's shareholders to sell up - which they may do thinking it is a better deal . 
they,do.02,a hostile takeover offer,,Affirmative,No. Pfizer can raise its bid or launch a hostile takeover offer in which it appeals directly to AstraZeneca 's shareholders to sell up - which they may do thinking it is a better deal . 
buying AstraZeneca,allow.01,it to be domiciled in,,Affirmative,It 's made it pretty clear that buying AstraZeneca would allow it to be domiciled in the UK so it can pay tax to the British Government . 
it,pay.01,tax,to,Affirmative,It 's made it pretty clear that buying AstraZeneca would allow it to be domiciled in the UK so it can pay tax to the British Government . 
the US companies,pay.01,38 % of profits in,,Affirmative,Corporation tax in the UK is 20 % from next year but in the US companies pay 38 % of profits in similar taxes . 
boss,admit.01,this,,Affirmative,Uncertainty and potentially job losses - Pfizer 's boss has admitted this . 
it,guarantee.01,it will base,,Affirmative,"No , it has guaranteed it will base 20 % of its worldwide research and development staff in Britain - not quite the same thing . "
it,base.02,20 % of,,Affirmative,"No , it has guaranteed it will base 20 % of its worldwide research and development staff in Britain - not quite the same thing . "
US drug giant Pfizer,say.01,it will keep,,Affirmative,"It wo n't say how many people or where in the UK they will be based , although it has said it will keep AstraZeneca 's new Cambridge research facility . "
US drug giant Pfizer,keep.02,new Cambridge research facility,,Affirmative,"It wo n't say how many people or where in the UK they will be based , although it has said it will keep AstraZeneca 's new Cambridge research facility . "
Pfizer,insist.01,it will honour,,Affirmative,"In a way yes , in a way no. Under the Takeover Panel rules the guarantee is legally binding for one year although Pfizer insists it will honour its pledges for five years . "
it,honour.01,its pledges,,Affirmative,"In a way yes , in a way no. Under the Takeover Panel rules the guarantee is legally binding for one year although Pfizer insists it will honour its pledges for five years . "
a clause,say.01,obligations could be changed,,Affirmative,"However , crucially , there is a clause that says these obligations could be changed should circumstances significantly change ie plenty of wriggle room . "
circumstances,change.01,ie plenty of,,Affirmative,"However , crucially , there is a clause that says these obligations could be changed should circumstances significantly change ie plenty of wriggle room . "
drug to get from,take.10,10 years,,Affirmative,In addition it takes 10 years for a drug to get from the lab to the doctor 's surgery so a five - year guarantee means little to Britain 's scientific researchers . 
year guarantee,mean.01,little,to,Affirmative,In addition it takes 10 years for a drug to get from the lab to the doctor 's surgery so a five - year guarantee means little to Britain 's scientific researchers . 
The Enterprise Act,allow.01,it to step in under,,Affirmative,Ultimately no. The Enterprise Act only allows it to step in under the public interest test ie if it affects national security or financial stability - which it doesn't . 
The Enterprise Act,affect.01,national security or,,Affirmative,Ultimately no. The Enterprise Act only allows it to step in under the public interest test ie if it affects national security or financial stability - which it doesn't . 
The Enterprise Act,doesn't.01,national security or,,Affirmative,Ultimately no. The Enterprise Act only allows it to step in under the public interest test ie if it affects national security or financial stability - which it doesn't . 
Secretary Vince Cable,suggest.01,law could be changed,,Affirmative,Business Secretary Vince Cable has suggested the law could be changed to include scientific research and development as public interest . 
A merger,create.01,a huge firm,,Affirmative,A merger will create a huge firm . 
A merger,represent.01,the biggest ever takeover of,,Affirmative,It will represent the biggest ever takeover of a British firm by a foreign company . 
such big big pharma,ruin.01,research outfits,,Affirmative,There are very real concerns such big big pharma will completely ruin small science research outfits . 
AstraZeneca at the final price proposed by Pfizer,have.03,sites,,Affirmative,"Remember AstraZeneca and Pfizer have sites all over this world , this is not just about the UK and US politicians have also raised concerns over jobs . "
US drug giant Pfizer,pay.01,tax,to,Affirmative,Well Pfizer will be paying tax to the Government and investing in Britain - all good . 
US drug giant Pfizer,say.01,will bring,,Affirmative,"And it says that the combined power of both companies will bring improved treatments for conditions such as cancer , heart disease and diabetes . "
the combined power of,bring.01,improved treatments,,Affirmative,"And it says that the combined power of both companies will bring improved treatments for conditions such as cancer , heart disease and diabetes . "
unions worried about,worry.02,about,,Affirmative,MPs on House of Commons committees have been hearing from the firms and from unions worried about job cuts but ultimately that is just talk . 
Panel rules,indicate.01,its interest,,Affirmative,"Under Takeover Panel rules having indicated its interest on April 26 , Pfizer has until May 26 to make an official bid . "
"chief executive ,",speak.01,about,to,Affirmative,"AstraZeneca 's chief executive , Pascal Soriot speaks to Sky 's Ian King about Pfizer 's takeover bid . "
Bid,create.01,considerable risk,,Affirmative,Video : AstraZeneca chairman : ' Bid creates considerable risk ' 
