A0,A0.35_Verb,A1,A2,Polarity,RelatedSentence
A recent interview,remind.01,that attitude,us,Affirmative,A recent interview reminded us that attitude and drive win the game . 
Republican Primary,draw.02,support for one,,Affirmative,"Republican Primary draws near , support for one local Kenton County Resident continues to grow . "
County Resident,continue.01,to grow,,Affirmative,"Republican Primary draws near , support for one local Kenton County Resident continues to grow . "
Justice System,see.01,base continue,,Affirmative,"Justice System , has seen his base continue to broaden as the campaign moves into its last week . "
district judges,join.01,an ongoing swell in support for Nageleisen,,Affirmative,"district judges join an ongoing swell in support for Nageleisen from lawyers , law professors , and members of the local business community . "
the county attorney,conduct.01,a lot of,,Affirmative,The district court is where the county attorney conducts a lot of its business . 
these retired district Judges,support.01,me,,Affirmative,For these retired district Judges to openly support me tells me that they understand my breadth of experience and my ability to take on the job from day one . 
these retired district Judges,understand.01,my breadth of experience,,Affirmative,For these retired district Judges to openly support me tells me that they understand my breadth of experience and my ability to take on the job from day one . 
