A0,A0.35_Verb,A1,A2,Polarity,RelatedSentence
The boss of AstraZeneca,say.01,there will not be,,Affirmative,The boss of AstraZeneca says there will not be a deal or takeover deadline extension in its latest tussle with drug rival Pfizer . 
Bid,create.01,considerable risk ',,Affirmative,Video : AstraZeneca ' Sets Takeover Price ' Video : AstraZeneca chairman : ' Bid creates considerable risk ' The boss of AstraZeneca said there was no prospect of a deal with US drug giant Pfizer before a set deadline of May 26 . 
Chairman Leif Johansson,say.01,there was,,Affirmative,"Chairman Leif Johansson also said there was no likelihood of a deadline extension , under rules laid down by the Takeover Panel . "
by,lay.01,rules laid down by,,Affirmative,"Chairman Leif Johansson also said there was no likelihood of a deadline extension , under rules laid down by the Takeover Panel . "
Mr Johansson,say.01,"that it was Pfizer , not AstraZeneca ,",,Affirmative,"Mr Johansson said that it was Pfizer , not AstraZeneca , that called an end to discussions on Sunday afternoon about a potential takeover to create the world 's largest drug maker . "
"Pfizer , not AstraZeneca ,",call.03,an end to discussions on,,Affirmative,"Mr Johansson said that it was Pfizer , not AstraZeneca , that called an end to discussions on Sunday afternoon about a potential takeover to create the world 's largest drug maker . "
morning AstraZeneca,announce.01,a rejection of,,Affirmative,"Early Monday morning AstraZeneca announced a rejection of Pfizer 's final offer takeover bid , which valued the company at £69.3bn ( $ 119bn ) . "
"offer takeover bid ,",value.01,the company,at £69.3bn (,Affirmative,"Early Monday morning AstraZeneca announced a rejection of Pfizer 's final offer takeover bid , which valued the company at £69.3bn ( $ 119bn ) . "
The British drug firm,say.01,falls short of,,Affirmative,The British drug firm said the offer of £55 a share falls short of its value as an independent company and that its larger US rival had failed to make a compelling strategic business or value case . 
its larger US rival,make.05,case,,Affirmative,The British drug firm said the offer of £55 a share falls short of its value as an independent company and that its larger US rival had failed to make a compelling strategic business or value case . 
The British drug firm,say.01,proposals would bring uncertainty and risks,,Affirmative,It said the Pfizer proposals would bring uncertainty and risks for AstraZeneca shareholders . 
the Pfizer proposals,bring.01,uncertainty and risks,for,Affirmative,It said the Pfizer proposals would bring uncertainty and risks for AstraZeneca shareholders . 
Mr Johansson,tell.01,Sky News,,Affirmative,Mr Johansson told Sky News : We rejected the bid on three grounds . 
AstraZeneca shareholders,reject.01,the bid on,,Affirmative,Mr Johansson told Sky News : We rejected the bid on three grounds . 
AstraZeneca shareholders,think.01,it undervalues,,Affirmative,"First , we think it undervalues the opportunities we think AstraZeneca could have as an independent company . "
First,undervalue.01,the opportunities,,Affirmative,"First , we think it undervalues the opportunities we think AstraZeneca could have as an independent company . "
AstraZeneca shareholders,think.01,AstraZeneca could have as,,Affirmative,"First , we think it undervalues the opportunities we think AstraZeneca could have as an independent company . "
AstraZeneca shareholders,think.01,there is,,Affirmative,"Secondly , we think there is a long , drawn - out process , with very considerable execution risk ... "
we,think.01,there is,,Affirmative,"and thirdly , we think there is a clearly disruptive element in how we can best create value for shareholders and society by disrupting the way we get medicines to the market . "
we,create.01,value for shareholders and society,,Affirmative,"and thirdly , we think there is a clearly disruptive element in how we can best create value for shareholders and society by disrupting the way we get medicines to the market . "
we,get.01,medicines,,Affirmative,"and thirdly , we think there is a clearly disruptive element in how we can best create value for shareholders and society by disrupting the way we get medicines to the market . "
Mr Johansson,say.01,he had had made,,Affirmative,Mr Johansson said he had had made it clear that his board could only recommend a bid that was at least 10 % above an offer of £53.50 made by Pfizer on Friday evening . 
he,make.02,it clear,,Affirmative,Mr Johansson said he had had made it clear that his board could only recommend a bid that was at least 10 % above an offer of £53.50 made by Pfizer on Friday evening . 
his board,recommend.01,a bid,,Affirmative,Mr Johansson said he had had made it clear that his board could only recommend a bid that was at least 10 % above an offer of £53.50 made by Pfizer on Friday evening . 
by Pfizer,make.01,£53.50 made by Pfizer,,Affirmative,Mr Johansson said he had had made it clear that his board could only recommend a bid that was at least 10 % above an offer of £53.50 made by Pfizer on Friday evening . 
Pfizer,put.01,the value,on,Affirmative,"AstraZeneca shares plunged by more than 14 % in early Monday trading , driving its market value down to £52.1bn , £17bn less than the value Pfizer had put on the company . "
the board,reject.01,an offer of,,Affirmative,"On May 2 , New York - based Pfizer made an offer of £63bn ( $ 106bn )  for AstraZeneca , which the board rejected without hesitation . "
Investors,back.01,Early Monday morning AstraZeneca,,Affirmative,"Investors backed AstraZeneca in rejecting the cash - and - stock approach worth £50 a share , but many said they would want it to engage if Pfizer came back with an improved offer . "
Investors,reject.01,approach worth £50,,Affirmative,"Investors backed AstraZeneca in rejecting the cash - and - stock approach worth £50 a share , but many said they would want it to engage if Pfizer came back with an improved offer . "
many,say.01,they would want,,Affirmative,"Investors backed AstraZeneca in rejecting the cash - and - stock approach worth £50 a share , but many said they would want it to engage if Pfizer came back with an improved offer . "
they,want.01,it to engage,,Affirmative,"Investors backed AstraZeneca in rejecting the cash - and - stock approach worth £50 a share , but many said they would want it to engage if Pfizer came back with an improved offer . "
US drug giant Pfizer,say.01,it will not make,,Affirmative,"Pfizer has said it will not make a hostile offer directly to AstraZeneca shareholders , and would only proceed with an offer with the recommendation of AstraZeneca 's board . "
it,make.02,to,,Affirmative,"Pfizer has said it will not make a hostile offer directly to AstraZeneca shareholders , and would only proceed with an offer with the recommendation of AstraZeneca 's board . "
US drug giant Pfizer,proceed.01,with,,Affirmative,"Pfizer has said it will not make a hostile offer directly to AstraZeneca shareholders , and would only proceed with an offer with the recommendation of AstraZeneca 's board . "
City Editor Mark Kleinman,say.01,board has highlighted,,Affirmative,Sky News City Editor Mark Kleinman said : The AstraZeneca board has highlighted the inherent risks in doing a deal with Pfizer at any price - the risk to jobs that would be triggered from a merger of this kind . 
The AstraZeneca board,highlight.01,the inherent risks in doing,,Affirmative,Sky News City Editor Mark Kleinman said : The AstraZeneca board has highlighted the inherent risks in doing a deal with Pfizer at any price - the risk to jobs that would be triggered from a merger of this kind . 
it,put.01,a price tag,on itself,Affirmative,"But unusually in AstraZeneca 's statement , it has put a price tag on itself ... "
it,say.01,it would only be prepared,,Affirmative,it says it would only be prepared to make a recommendation to shareholders if the board of Pfizer were to make an offer that was at least 10 % above the £53.50 per share that was made privately on Friday . 
That,put.01,a price tag,on AstraZeneca of,Affirmative,That would put a price tag on AstraZeneca of about £59 a share - well over £70bn . 
The latest rejected bid,increase.01,the cash element,,Affirmative,"The latest rejected bid increased the cash element to 45 % , with AstraZeneca shareholders set to receive 1.747 shares in the enlarged company for each of their AstraZeneca shares and 2.476p in cash . "
AstraZeneca shareholders,set.08,to receive,,Affirmative,"The latest rejected bid increased the cash element to 45 % , with AstraZeneca shareholders set to receive 1.747 shares in the enlarged company for each of their AstraZeneca shares and 2.476p in cash . "
AstraZeneca shareholders,receive.01,1.747 shares,,Affirmative,"The latest rejected bid increased the cash element to 45 % , with AstraZeneca shareholders set to receive 1.747 shares in the enlarged company for each of their AstraZeneca shares and 2.476p in cash . "
Pfizer,want.01,to create,,Affirmative,"Pfizer wants to create the world 's largest drugs company , with its headquarters in New York and a tax base in Britain . "
Pfizer,create.01,largest drugs company,,Affirmative,"Pfizer wants to create the world 's largest drugs company , with its headquarters in New York and a tax base in Britain . "
The Board of,note.01,the announcement by,,Affirmative,The Board of AstraZeneca PLC ( AstraZeneca or the Company ) notes the announcement by Pfizer Inc . 
This proposal,undervalue.01,the Company and,,Affirmative,This proposal undervalues the Company and its attractive prospects and has been rejected by the Board of AstraZeneca . 
by,reject.01,This proposal,,Affirmative,This proposal undervalues the Company and its attractive prospects and has been rejected by the Board of AstraZeneca . 
"Leif Johansson , Chairman of AstraZeneca",say.01,had,,Affirmative,"Leif Johansson , Chairman of AstraZeneca said : Pascal Soriot , Marc Dunoyer and I had a lengthy discussion with Pfizer over the weekend about the proposal Pfizer made on Friday evening at a value of £53.50 per share . "
"Pascal Soriot ,",have.03,a lengthy discussion with Pfizer,,Affirmative,"Leif Johansson , Chairman of AstraZeneca said : Pascal Soriot , Marc Dunoyer and I had a lengthy discussion with Pfizer over the weekend about the proposal Pfizer made on Friday evening at a value of £53.50 per share . "
Pfizer,say.01,that it could consider,,Affirmative,"During this discussion , Pfizer said that it could consider only minor improvements in the financial terms of the Friday Proposal . "
it,consider.01,minor improvements in,,Affirmative,"During this discussion , Pfizer said that it could consider only minor improvements in the financial terms of the Friday Proposal . "
we,assume.02,"had been satisfactory ,",,Affirmative,"In response , we indicated , even assuming that other key aspects of any proposal had been satisfactory , that the price at which the Board of AstraZeneca would be prepared to provide a recommendation would have to be more than 10 % above the level contained in Pfizer 's Friday Proposal . "
the Board of AstraZeneca,provide.01,a recommendation,,Affirmative,"In response , we indicated , even assuming that other key aspects of any proposal had been satisfactory , that the price at which the Board of AstraZeneca would be prepared to provide a recommendation would have to be more than 10 % above the level contained in Pfizer 's Friday Proposal . "
in,contain.01,the level contained in,,Affirmative,"In response , we indicated , even assuming that other key aspects of any proposal had been satisfactory , that the price at which the Board of AstraZeneca would be prepared to provide a recommendation would have to be more than 10 % above the level contained in Pfizer 's Friday Proposal . "
a minor improvement,continue.01,to fall short of,,Affirmative,The Final Proposal is a minor improvement which continues to fall short of the Board 's view of value and has been rejected . 
by,drive.02,approach throughout,,Affirmative,Pfizer 's approach throughout its pursuit of AstraZeneca appears to have been fundamentally driven by the corporate financial benefits to its shareholders of cost savings and tax minimisation . 
Pfizer,make.02,case,,Affirmative,"From our first meeting in January to our latest discussion yesterday , and in the numerous phone calls in between , Pfizer has failed to make a compelling strategic , business or value case . "
AstraZeneca,create.01,a culture of innovation,,Affirmative,"AstraZeneca has created a culture of innovation , with science at the heart of its operations , which will continue to create significant value for patients , shareholders and all stakeholders of AstraZeneca . "
the heart of,create.01,significant value,,Affirmative,"AstraZeneca has created a culture of innovation , with science at the heart of its operations , which will continue to create significant value for patients , shareholders and all stakeholders of AstraZeneca . "
We,reject.01,Final Proposal,,Affirmative,"We have rejected Pfizer 's Final Proposal because it is inadequate and would present significant risks for shareholders , while also having serious consequences for the Company , our employees and the life - sciences sector in the UK , Sweden and the US . "
it,present.01,significant risks for shareholders,,Affirmative,"We have rejected Pfizer 's Final Proposal because it is inadequate and would present significant risks for shareholders , while also having serious consequences for the Company , our employees and the life - sciences sector in the UK , Sweden and the US . "
the Board,receive.01,a letter containing,,Affirmative,"After the close of business on 16 May 2014 , the Board received a letter containing a revised non-binding proposal from Pfizer comprising £21.57 in cash ( 40 % ) and 1.845 Pfizer shares ( 60 % ) per AstraZeneca share , representing a value of £53.50 per AstraZeneca share ( based on the closing price of Pfizer shares on 16 May 2014 ) ( the Friday Proposal ) . "
a letter containing,contain.01,a revised non-binding proposal from,,Affirmative,"After the close of business on 16 May 2014 , the Board received a letter containing a revised non-binding proposal from Pfizer comprising £21.57 in cash ( 40 % ) and 1.845 Pfizer shares ( 60 % ) per AstraZeneca share , representing a value of £53.50 per AstraZeneca share ( based on the closing price of Pfizer shares on 16 May 2014 ) ( the Friday Proposal ) . "
letter,provide.01,detail,,Affirmative,"Pfizer 's letter did not provide detail about other key aspects of its proposal , several of which are of importance to the Board 's evaluation . "
The Board of AstraZeneca,conclude.01,substantially undervalued,,Affirmative,The Board of AstraZeneca met on 17 May 2014 and concluded that the financial terms of the Friday Proposal substantially undervalued the Company and its attractive prospects . 
the financial terms of,undervalue.01,the Company and,,Affirmative,The Board of AstraZeneca met on 17 May 2014 and concluded that the financial terms of the Friday Proposal substantially undervalued the Company and its attractive prospects . 
the Board,reject.01,the Friday Proposal,,Affirmative,The Board wrote to Pfizer on the evening of 17 May 2014 to confirm that the Board had rejected the Friday Proposal . 
The Board,offer.01,to hold,,Affirmative,The Board offered to hold a meeting with Pfizer to explain its views around the substantial shortfall in value of the Friday Proposal . 
The Board,hold.04,a meeting with Pfizer,,Affirmative,The Board offered to hold a meeting with Pfizer to explain its views around the substantial shortfall in value of the Friday Proposal . 
a meeting with Pfizer,explain.01,its views around,,Affirmative,The Board offered to hold a meeting with Pfizer to explain its views around the substantial shortfall in value of the Friday Proposal . 
· The business operating model and segmentation,allow.01,AstraZeneca to deliver on,,Affirmative,"· The business operating model and segmentation which would allow AstraZeneca to deliver on its research and development pipeline and prospects ; and which would protect and preserve its culture of science and innovation , especially given the likelihood of material cost savings and research and development reductions ; · The details of Pfizer 's plans for cost savings , including around research and development , pipeline delivery and employment ; · Pfizer 's plans for protecting the certainty of delivery of the value of any offer at closing . "
AstraZeneca,deliver.01,on,,Affirmative,"· The business operating model and segmentation which would allow AstraZeneca to deliver on its research and development pipeline and prospects ; and which would protect and preserve its culture of science and innovation , especially given the likelihood of material cost savings and research and development reductions ; · The details of Pfizer 's plans for cost savings , including around research and development , pipeline delivery and employment ; · Pfizer 's plans for protecting the certainty of delivery of the value of any offer at closing . "
· The business operating model and segmentation,preserve.01,its culture of science and innovation,,Affirmative,"· The business operating model and segmentation which would allow AstraZeneca to deliver on its research and development pipeline and prospects ; and which would protect and preserve its culture of science and innovation , especially given the likelihood of material cost savings and research and development reductions ; · The details of Pfizer 's plans for cost savings , including around research and development , pipeline delivery and employment ; · Pfizer 's plans for protecting the certainty of delivery of the value of any offer at closing . "
Pfizer,request.01,meeting be held by,,Affirmative,Pfizer requested that this meeting be held by conference call . 
by,hold.04,this meeting,,Affirmative,Pfizer requested that this meeting be held by conference call . 
The Chairman of Pfizer,say.01,that Pfizer could consider,,Affirmative,The Chairman of Pfizer said that Pfizer could consider only minor improvements to the financial terms of the Friday Proposal . 
Pfizer,consider.01,only minor improvements to,,Affirmative,The Chairman of Pfizer said that Pfizer could consider only minor improvements to the financial terms of the Friday Proposal . 
the Board of AstraZeneca,provide.01,a recommendation,,Affirmative,"The Chairman of AstraZeneca responded that , even if the other key aspects of the Friday Proposal had been satisfactory , the price at which the Board of AstraZeneca would be prepared to provide a recommendation would have to be more than 10 % above the level contained in Pfizer 's Friday Proposal . "
in,contain.01,the level contained in,,Affirmative,"The Chairman of AstraZeneca responded that , even if the other key aspects of the Friday Proposal had been satisfactory , the price at which the Board of AstraZeneca would be prepared to provide a recommendation would have to be more than 10 % above the level contained in Pfizer 's Friday Proposal . "
US drug giant Pfizer,state.01,Proposal was final and,,Affirmative,Pfizer stated that its Friday Proposal was final and would not be amended . 
The Board of AstraZeneca,reconfirm.01,its rejection of,,Affirmative,The Board of AstraZeneca met on 18 May 2014 after this telephone discussion and reconfirmed its rejection of Pfizer 's Friday Proposal . 
Pfizer,announce.01,its Final Proposal,to,Affirmative,"A few hours later , without prior notice to AstraZeneca and contrary to its previous statement , Pfizer announced its Final Proposal to the market . "
The Board of AstraZeneca,reject.01,Final Proposal for reasons set out below,,Affirmative,The Board of AstraZeneca met again and rejected Pfizer 's Final Proposal for reasons set out below . 
AstraZeneca,accelerate.01,stage pipeline,,Affirmative,"· AstraZeneca has a growing and accelerating late stage pipeline , with aggregate risk - adjusted pipeline peak year sales potential of around $ 23 billion and non risk - adjusted pipeline peak year sales potential of around $ 63 billion ; · AstraZeneca 's five key growth platforms are sustaining near - term growth , AstraZeneca remains confident that 2017 revenues should be broadly in line with 2013 ; · AstraZeneca 's core earnings growth is expected to be in excess of revenue growth during the period from 2017 to 2023 as a result of operating leverage . "
five key growth platforms,sustain.01,term growth,,Affirmative,"· AstraZeneca has a growing and accelerating late stage pipeline , with aggregate risk - adjusted pipeline peak year sales potential of around $ 23 billion and non risk - adjusted pipeline peak year sales potential of around $ 63 billion ; · AstraZeneca 's five key growth platforms are sustaining near - term growth , AstraZeneca remains confident that 2017 revenues should be broadly in line with 2013 ; · AstraZeneca 's core earnings growth is expected to be in excess of revenue growth during the period from 2017 to 2023 as a result of operating leverage . "
Early Monday morning AstraZeneca,continue.01,to demonstrate,,Affirmative,"AstraZeneca continues to demonstrate strong momentum across all elements of its strategy , as evidenced by multiple recent significant pipeline developments in its core therapy areas . "
Early Monday morning AstraZeneca,demonstrate.01,strong momentum,,Affirmative,"AstraZeneca continues to demonstrate strong momentum across all elements of its strategy , as evidenced by multiple recent significant pipeline developments in its core therapy areas . "
"These pipeline developments , announced in 2014",underpin.01,confidence in,,Affirmative,"These pipeline developments , announced in 2014 after completion of the Company 's 2013 Long Range Plan , underpin the Board 's confidence in AstraZeneca 's revenue targets due to increased probabilities of success for key oncology and other specialty franchise pipeline assets . "
from,benefit.01,margins,,Affirmative,"As a result , AstraZeneca 's margins are expected to benefit from this improved revenue mix . "
the Board 's,believe.01,would deprive shareholders of,,Affirmative,"Given that AstraZeneca is at a point of inflection , the Board believes that selling AstraZeneca at the final price proposed by Pfizer would deprive shareholders of the value from potential future pipeline success . "
by Pfizer,propose.01,the final price proposed by Pfizer,,Affirmative,"Given that AstraZeneca is at a point of inflection , the Board believes that selling AstraZeneca at the final price proposed by Pfizer would deprive shareholders of the value from potential future pipeline success . "
selling AstraZeneca at,deprive.01,from,shareholders of,Affirmative,"Given that AstraZeneca is at a point of inflection , the Board believes that selling AstraZeneca at the final price proposed by Pfizer would deprive shareholders of the value from potential future pipeline success . "
the Board,believe.01,are not,,Affirmative,"Accordingly , the Board believes short term metrics , including premia over historical share prices , as referenced by Pfizer regarding the attractiveness of its proposals are not appropriate bases for assessing the value of AstraZeneca . "
many AstraZeneca shareholders,sell.01,Pfizer shares,,Affirmative,The majority of the consideration is in Pfizer shares which many AstraZeneca shareholders will be forced to sell . 
those AstraZeneca shareholders able,hold.01,Pfizer shares,,Affirmative,"Further , for those AstraZeneca shareholders able to hold Pfizer shares , the Board believes Pfizer 's proposals would materially alter the investment case and create risks and uncertainties . "
the Board,believe.01,proposals would materially alter,,Affirmative,"Further , for those AstraZeneca shareholders able to hold Pfizer shares , the Board believes Pfizer 's proposals would materially alter the investment case and create risks and uncertainties . "
proposals,alter.01,the investment case,,Affirmative,"Further , for those AstraZeneca shareholders able to hold Pfizer shares , the Board believes Pfizer 's proposals would materially alter the investment case and create risks and uncertainties . "
proposals,create.01,risks and uncertainties,,Affirmative,"Further , for those AstraZeneca shareholders able to hold Pfizer shares , the Board believes Pfizer 's proposals would materially alter the investment case and create risks and uncertainties . "
proposals,imply.01,a meaningful reduction in research and development potential and capabilities,,Affirmative,"· Pfizer 's proposals are predicated on the delivery of significant cost reductions and imply a meaningful reduction in research and development potential and capabilities ; · The associated integration would risk significant disruption to the delivery and value of AstraZeneca 's pipeline ; · Pfizer 's announced business segmentation , if it were applied to AstraZeneca 's business , would likely lead to value destruction . "
The associated integration,risk.01,significant disruption,,Affirmative,"· Pfizer 's proposals are predicated on the delivery of significant cost reductions and imply a meaningful reduction in research and development potential and capabilities ; · The associated integration would risk significant disruption to the delivery and value of AstraZeneca 's pipeline ; · Pfizer 's announced business segmentation , if it were applied to AstraZeneca 's business , would likely lead to value destruction . "
