'actor0', 'A0', 'Verb', 'A1', 'A2', 'Polarity', 'Sentence', 'actor1', 'File Name', 'Date'
'China', 'The Chinese', 'accuse.01', 'the United States', 'of hypocrisy', 'Affirmative', 'China has in the past accused the United States of hypocrisy as Washington conducts sweeping surveillance around the world . ', 'United States', 'newsText20482', 2014\05\19
'China', 'The Chinese', 'target.01', 'name American makers of', '', 'Affirmative', 'The Chinese targeted big - name American makers of nuclear and solar technology , stealing confidential business information , sensitive trade secrets and internal communications for competitive advantage , according to a grand jury indictment that the Justice Department said should be a national wake - up call about cyber intrusions . ', 'United States', 'newsText20535', 2014\05\19
'China', 'five Chinese hackers', 'target.01', 'the U.S. nuclear power , metals and', '', 'Affirmative', 'According to the indictment , hackers targeted the U.S. nuclear power , metals and solar products industries . ', 'United States', 'newsText20496', 2014\05\19
'Cuba', 'The Cuban government', 'host.01', 'the U.S. naval base on', '', 'Affirmative', 'The Cuban government opposes hosting the U.S. naval base on its soil . ', 'United States', 'newsText20377', 2014\05\19
'European Union', 'The European Union', 'plan.01', 'no new sanctions against Moscow', '', 'Affirmative', 'TOMSK , May 19 ( RIA Novosti ) - The European Union will work jointly with Russia as part of the Geneva deal to resolve the crisis in Ukraine and plans no new sanctions against Moscow , EU Ambassador to Russia Vigaudas Ushatskas told journalists on Monday . ', 'Russia', 'newsText20281', 2014\05\19
'European Union', 'The European Union', 'recognize.01', 'the recent referenda in Ukraine', 'as lawful', 'Affirmative', 'The European Union can not recognize the recent referenda in Ukraine as lawful , Head of the EU Delegation to Russia Vygaudas Usackas told students in Tomsk on May 19 . ', 'Ukraine', 'newsText20362', 2014\05\19
'European Union', 'The European Union', 'resolve.01', 'the crisis in Ukraine', '', 'Affirmative', 'TOMSK , May 19 ( RIA Novosti ) - The European Union will work jointly with Russia as part of the Geneva deal to resolve the crisis in Ukraine and plans no new sanctions against Moscow , EU Ambassador to Russia Vigaudas Ushatskas told journalists on Monday . ', 'Ukraine', 'newsText20281', 2014\05\19
'India', 'India', 'weaken.01', "Pakistan 's", '', 'Affirmative', "Mir Sarfaraz Bugti , Balochistan 's Home Minister also accused India for trying to carry out terrorist activities to weaken Pakistan . ", 'Pakistan', 'newsText20230', 2014\05\19
'India', 'Narendra Modi', 'introduce.02', 'economic reforms in India', '', 'Affirmative', 'Foreign Institutional Investors ( FIIs ) have invested close to $ 6bn in the last three months in India in the hope that Narendra Modi will introduce economic reforms after becoming prime minister . ', 'India', 'newsText20577', 2014\05\19
'India', 'New Delhi', 'accuse.01', 'Pakistan', 'of training and financing thousands of militants', 'Affirmative', 'In the 1990 s , New Delhi accused Pakistan of training and financing thousands of militants to infiltrate Indian - held Kashmir . ', 'Pakistan', 'newsText20214', 2014\05\19
'India', 'The Reserve Bank of India governor', 'hurt.01', 'Indian exporters', '', 'Affirmative', 'The Reserve Bank of India governor would not allow rupee to rise now because it will hurt Indian exporters . ', 'India', 'newsText20577', 2014\05\19
'India', 'designate Narendra Modi', 'visit.01', "Nepal , Koirala 's foreign affairs adviser Dinesh Bhattarai said", '', 'Affirmative', "Prime Minister Sushil Koirala yesterday invited India 's PM - designate Narendra Modi to visit Nepal and expressed hope that bilateral ties between the two neighbours will be further strengthened under his premiership . ", 'Nepal', 'newsText20180', 2014\05\19
'India', 'the new government in India', 'take.01', 'a tough stance towards Pakistan', '', 'Affirmative', "According to the report , the hard - line BJP 's win has led to fears that the new government in India may take a tough stance towards Pakistan . ", 'Pakistan', 'newsText20224', 2014\05\19
'Iraq', 'Shiite groups from Lebanon and Iraq', 'send.02', '29,172 Syrian rebel fighters as well as 13,529 Sunni Islamist fighters', 'to back up', 'Affirmative', "Shiite groups from Lebanon and Iraq who are loyal to Iran 's Islamist regime , al - Assad 's main ally , have sent fighters to back up his overstretched forces while Sunni militants from other countries have joined jihadist groups fighting in Syria . ", 'Syria', 'newsText20697', 2014\05\19
'Japan', 'Japan', 'take.21', 'less Iranian oil', '', 'Affirmative', 'Japan , however , was taking on less Iranian oil . ', 'Iran', 'newsText20268', 2014\05\19
'Japan', "Japan 's", 'open.01', "Japan 's agricultural market", '', 'Affirmative', 'Amari said he told other ministers at the meeting that Japan will try its best to open the market even though it can not open its agricultural product fully . ', 'Japan', 'newsText20187', 2014\05\19
'Japan', "Japan 's", 'open.01', "Japan 's agricultural market", '', 'Affirmative', 'The problem is that Japan has promised to open the market and yet to protect sacred sectors , she said in an email to Xinhua . ', 'Japan', 'newsText20187', 2014\05\19
'Lebanon', 'Shiite groups from Lebanon and Iraq', 'send.02', '29,172 Syrian rebel fighters as well as 13,529 Sunni Islamist fighters', 'to back up', 'Affirmative', "Shiite groups from Lebanon and Iraq who are loyal to Iran 's Islamist regime , al - Assad 's main ally , have sent fighters to back up his overstretched forces while Sunni militants from other countries have joined jihadist groups fighting in Syria . ", 'Syria', 'newsText20697', 2014\05\19
'Lebanon', 'extremists entering Lebanon from Syria', 'enter.01', 'Lebanon', '', 'Affirmative', 'It was Arsal , however , that Hezbollah officials repeatedly branded as the principal gateway for extremists entering Lebanon from Syria . ', 'Lebanon', 'newsText20680', 2014\05\19
'Lebanon', 'the many Lebanese Sunnis', 'see.01', 'the Syrian rebel cause as', '', 'Affirmative', "For while Hezbollah may tout its recent advances in Syria 's Qalamoun region on the Lebanese border as a grand victory against terrorism , this will only harden the hostility felt toward the Shiite group by the many Lebanese Sunnis who continue to see the Syrian rebel cause as a just struggle against tyranny . ", 'Syria', 'newsText20680', 2014\05\19
'Malaysia', 'Datuk Seri Najib Razak', 'care.01', 'about Malaysians', '', 'Affirmative', "\xc2\xa0 Like I said , he does n't care about Malaysians as a whole . ", 'Malaysia', 'newsText20151', 2014\05\19
'Malaysia', 'Datuk Seri Najib Razak', 'meet.03', 'with Obama', '', 'Affirmative', '\xc2\xa0 Najib dares to meet with Obama and take a selfie with him , a President who has endured a lifetime of racial abuse and slurs\xc2\xa0while just ignoring them & letting them go and still trying to help those who curse him as equally as everyone else ; and yet Najib threatens a law suit when faced with similar circumstances on a very small scale comparatively . ', 'United States', 'newsText20151', 2014\05\19
'Malaysia', 'few Malaysians', 'take.01', 'the 1Malaysia slogan', '', 'Affirmative', 'Today , very few Malaysians take that slogan seriously because of what is happening . ', 'Malaysia', 'newsText20151', 2014\05\19
'Mali', "Maliki 's critics", 'fault.01', 'Prime Minister Nouri Maliki', 'for', 'Affirmative', 'They fault him for his prosecution of his war on ISIL in western Anbar province that has raged for five months , displaced over 420,000 Sunnis and failed to put a dent in violence around the country . ', 'Mali', 'newsText20142', 2014\05\19
'Mali', "Maliki 's critics", 'fault.01', "Prime Minister Nouri Maliki won the largest share of Iraqi parliamentary seats in last month 's national elections , dealing a blow to Shi'ite , Sunni and Kurdish rivals who opposed his serving a third term", 'for', 'Affirmative', 'They fault him for his prosecution of his war on ISIL in western Anbar province that has raged for five months , displaced over 420,000 Sunnis and failed to put a dent in violence around the country . ', 'Mali', 'newsText20143', 2014\05\19
'Nepal', 'Minister Sushil Koirala', 'invite.01', 'designate Narendra Modi', 'to visit Nepal', 'Affirmative', "Prime Minister Sushil Koirala yesterday invited India 's PM - designate Narendra Modi to visit Nepal and expressed hope that bilateral ties between the two neighbours will be further strengthened under his premiership . ", 'India', 'newsText20180', 2014\05\19
'New Zealand', 'Oliver Ibbetson -LRB- Wellington -RRB- , who will spend a year studying Chinese in Kaohsiung , Taiwan before embarking on a two-year global MBA programme in Taipei .', 'learn.01', 'Chinese', '', 'Affirmative', 'Ibbetson became interested in learning Chinese after the Asia New Zealand Foundation sponsored his attendance at the Seminar for Youth Public Participation in Taipei last year , where he maintained a number of connections and friendships . ', 'China', 'newsText20189', 2014\05\19
'New Zealand', '\xc2\xb7 Hayden Montgomerie ( Wellington ) ,', 'study.01', ', Bangkok , Thailand', '', 'Affirmative', '\xc2\xb7 Hayden Montgomerie ( Wellington ) , who will study a Master of Business Administration at Assumption University , Bangkok , Thailand . ', 'Thailand', 'newsText20189', 2014\05\19
'Pakistan', 'Pakistan', 'establish.01', 'Sweden Friendship Group', '', 'Affirmative', 'Pakistan has established a Pak - Sweden Friendship Group and establishment of a separate Friendship Group for Pakistan in the Swedish Parliament would be beneficial for both of the countries , he said while talking to a Swedish parliamentary delegation led by Speaker Per Westerberg that called on him on Monday . ', 'Sweden', 'newsText20217', 2014\05\19
'Pakistan', 'Pakistani security officials', 'add.01', 'were being smuggled from Afghanistan to Balochistan', '', 'Affirmative', 'The officials further added that the weapons and explosives seized from Gulistan area were being smuggled from Afghanistan to Balochistan . ', 'Afghanistan', 'newsText20230', 2014\05\19
'Pakistan', 'Prime Minister Nawaz Sharif', 'say.01', 'Pakistan has established', '', 'Affirmative', 'Pakistan has established a Pak - Sweden Friendship Group and establishment of a separate Friendship Group for Pakistan in the Swedish Parliament would be beneficial for both of the countries , he said while talking to a Swedish parliamentary delegation led by Speaker Per Westerberg that called on him on Monday . ', 'Pakistan', 'newsText20217', 2014\05\19
'Pakistan', 'The recent signals from Pakistan', 'curb.01', 'anti-Indian religious extremists , trade and water', '', 'Affirmative', 'The recent signals from Pakistan have been uniformly negative , whether on Kashmir , curbing anti-Indian religious extremists , trade and water , and these have been capped by the expulsion of two Indian journalists despite the much touted media role in improving relations as signified , for example , by the Aman ki Asha initiative . ', 'India', 'newsText20427', 2014\05\19
'Qatar', 'by Qatar and', 'pursue.01', 'the comprehensive reform policy pursued by Qatar and', '', 'Affirmative', 'He explained that the report highlighted the importance and centrality of the promotion and protection of human rights in the comprehensive reform policy pursued by Qatar and the overall vision for development as part of Qatar National Vision 2030 . ', 'Qatar', 'newsText20249', 2014\05\19
'Russia', 'Calls for\xc2\xa0protecting Russians', 'for\xc2\xa0protecting.01', 'Russians', '', 'Affirmative', "Calls for\xc2\xa0protecting Russians from\xc2\xa0supposedly pernicious Western values have intensified in\xc2\xa0the wake of\xc2\xa0the protests that toppled Yanukovych 's Moscow - backed administration and\xc2\xa0Western sanctions over Russia 's takeover of\xc2\xa0Crimea . ", 'Russia', 'newsText20366', 2014\05\19
'Russia', 'Moscow', 'approve.01', 'table conference for reconciliation of Ukraine', '', 'Affirmative', 'The minister added that Moscow approved the round - table conference for reconciliation of Ukraine , more officials of the south - east of Ukraine could have been invited . ', 'Ukraine', 'newsText20280', 2014\05\19
'Russia', 'Moscow', 'approve.01', 'table conference for reconciliation of Ukraine', '', 'Affirmative', 'The minister added that Moscow approved the round - table conference for reconciliation of Ukraine , more officials of the south - east of Ukraine could have been invited . ', 'Ukraine', 'newsText20280', 2014\05\19
'Russia', 'Moscow', 'join.01', 'New Russia', '', 'Affirmative', 'The republics declared themselves sovereign states last Monday , with Donetsk planning to ask Moscow to join Russia . ', 'Russia', 'newsText20270', 2014\05\19
'Russia', 'Moscow', 'join.01', 'New Russia', '', 'Affirmative', 'The republics declared themselves sovereign states last Monday , with Donetsk planning to ask Moscow to join Russia . ', 'Russia', 'newsText20271', 2014\05\19
'Russia', 'President Vladimir Putin', 'order.01', 'troops deployed in regions near Ukraine', '', 'Affirmative', 'MOSCOW ( AP ) Russian President Vladimir Putin has ordered troops deployed in regions near Ukraine to return to their home bases , the Kremlin said Monday . ', 'Ukraine', 'newsText20488', 2014\05\19
'Russia', 'President Vladimir Putin', 'order.01', 'troops deployed near Ukraine', '', 'Affirmative', 'On Monday , Russian President Vladimir Putin ordered troops deployed near Ukraine to return to their home bases and praised the launch of a dialogue between the Ukrainian government and its opponents . ', 'Ukraine', 'newsText20543', 2014\05\19
'Russia', 'President Vladimir Putin', 'order.01', 'troops deployed near Ukraine', '', 'Affirmative', 'On Monday , Russian President Vladimir Putin ordered troops deployed near Ukraine to return to their home bases and praised the launch of a dialogue between the Ukrainian government and its opponents . ', 'Ukraine', 'newsText20544', 2014\05\19
'Russia', 'Russian Foreign Minister Sergey Lavrov', 'say.01', 'that Russia was still insisting on', '', 'Affirmative', 'Lavrov said that Russia was still insisting on a stop to the counter-terrorism operation . ', 'Russia', 'newsText20280', 2014\05\19
'Russia', 'Russian Foreign Minister Sergey Lavrov', 'say.01', 'that Russia was still insisting on', '', 'Affirmative', 'Lavrov said that Russia was still insisting on a stop to the counter-terrorism operation . ', 'Russia', 'newsText20280', 2014\05\19
'Russia', 'Russian President Vladimir Putin', 'de-escalate.01', 'the crisis over Ukraine ,', '', 'Affirmative', "The move appears to indicate Putin 's intention to de-escalate the crisis over Ukraine , the worst in Russia 's relations with the West since the end of the Cold War . ", 'Ukraine', 'newsText20488', 2014\05\19
'Russia', 'Russian President Vladimir Putin', 'order.01', 'Russian soldiers', 'to pull back', 'Affirmative', 'This follows reports that President Vladimir Putin had ordered Russian soldiers to pull back . ', 'Russia', 'newsText20361', 2014\05\19
'Russia', 'Russian troops', 'invade.01', 'Ukraine', '', 'Affirmative', 'Kiev and the West worry Russian troops could be used to invade Ukraine in support of rebels . ', 'Ukraine', 'newsText20363', 2014\05\19
'Russia', 'the Russian Federal Security Service', 'say.01', ', has returned to Russia', '', 'Affirmative', "The Russian humanitarian convoy , which has brought humanitarian aid to Ukraine 's Luhansk Region , has returned to Russia , the Russian Federal Security Service says in a statement . ", 'Russia', 'newsText20280', 2014\05\19
'South Sudan', "South Sudan 's", 'defy.01', 'order and Sudan', '', 'Affirmative', "\xc2\xa0 The two countries came closer to all - out conflict Thursday as South Sudan looked ready to defy the Security Council 's order and Sudan threatened retaliation . ", 'Sudan', 'newsText20305', 2014\05\19
'Sudan', "South Sudan 's", 'defy.01', 'order and Sudan', '', 'Affirmative', "\xc2\xa0 The two countries came closer to all - out conflict Thursday as South Sudan looked ready to defy the Security Council 's order and Sudan threatened retaliation . ", 'Sudan', 'newsText20305', 2014\05\19
'Syria', 'extremists entering Lebanon from Syria', 'enter.01', 'Lebanon', '', 'Affirmative', 'It was Arsal , however , that Hezbollah officials repeatedly branded as the principal gateway for extremists entering Lebanon from Syria . ', 'Lebanon', 'newsText20680', 2014\05\19
'Taiwan', 'Oliver Ibbetson -LRB- Wellington -RRB- , who will spend a year studying Chinese in Kaohsiung , Taiwan before embarking on a two-year global MBA programme in Taipei .', 'learn.01', 'Chinese', '', 'Affirmative', 'Ibbetson became interested in learning Chinese after the Asia New Zealand Foundation sponsored his attendance at the Seminar for Youth Public Participation in Taipei last year , where he maintained a number of connections and friendships . ', 'China', 'newsText20189', 2014\05\19
'Ukraine', 'Ukrainian police and', 'accuse.01', 'pro-Russia gunmen', 'of seizing', 'Affirmative', 'Ukrainian police and election officials accuse pro-Russia gunmen there of seizing election commission offices and threatening members in an effort to derail the presidential vote . ', 'Russia', 'newsText20543', 2014\05\19
'Ukraine', 'a route bypassing Ukraine', 'bypass.01', "Ukraine 's", '', 'Affirmative', 'Members of the European Parliament have urged limiting cooperation with Russian energy companies , including halting construction of the South Stream project , which is planned to deliver Russian natural gas to Europe via a route bypassing Ukraine . ', 'Ukraine', 'newsText20281', 2014\05\19
'United Nations', 'The United Nations Security Council', 'urge.01', 'the two Sudans', 'to take steps', 'Affirmative', 'The council also urged the two Sudans to take steps to immediately establish a safe demilitarized border zone and activate their Joint Border Verification and Monitoring Mechanism . ', 'Sudan', 'newsText20305', 2014\05\19
'United States', 'A U.S. grand jury', 'indict.01', 'five Chinese individuals', 'on', 'Affirmative', 'A U.S. grand jury indicted five Chinese individuals on cyber espionage charges for allegedly targeting six American companies and stealing trade secrets , the U.S. Justice Department said on Monday , publicly accusing China of cyber spying for the first time . ', 'China', 'newsText20684', 2014\05\19
'United States', 'American presidents , like', 'urge.01', 'the United States', 'to rethink', 'Affirmative', 'Several current and former Latin American presidents , like Fernando Henrique Cardoso , have urged the United States to rethink its failed war on drugs , to no avail . ', 'United States', 'newsText20377', 2014\05\19
'United States', 'Barack Obama', 'congratulate.01', 'Barack Obama', 'on', 'Affirmative', 'On Friday , Obama called up Modi to congratulate him on his election victory and invited him to the White House . ', 'United States', 'newsText20529', 2014\05\19
'United States', 'Barack Obama', 'congratulate.01', 'Barack Obama', 'on', 'Affirmative', 'On Friday , Obama called up Modi to congratulate him on his election victory and invited him to the White House . ', 'United States', 'newsText20530', 2014\05\19
'United States', 'Barack Obama', 'invite.01', 'Barack Obama', 'to', 'Affirmative', 'On Friday , Obama called up Modi to congratulate him on his election victory and invited him to the White House . ', 'United States', 'newsText20529', 2014\05\19
'United States', 'Barack Obama', 'invite.01', 'Barack Obama', 'to', 'Affirmative', 'On Friday , Obama called up Modi to congratulate him on his election victory and invited him to the White House . ', 'United States', 'newsText20530', 2014\05\19
'United States', 'Obama', 'tell.01', 'U.S. sees it not through', 'Xi', 'Affirmative', 'He said Obama told Xi the U.S. sees it not through the prism of security but out of concern over theft of trade secrets . ', 'United States', 'newsText20422', 2014\05\19
'United States', 'Obama', 'tell.01', 'U.S. sees it not through', 'Xi', 'Affirmative', 'He said Obama told Xi the U.S. sees it not through the prism of security but out of concern over theft of trade secrets . ', 'United States', 'newsText20475', 2014\05\19
'United States', 'President Barack Obama', 'urge.01', 'his Russian counterpart', 'to recognize', 'Affirmative', 'President Barack Obama urged his Russian counterpart Vladimir Putin to recognize the legitimacy of Poroshenko in early June . ', 'Russia', 'newsText20280', 2014\05\19
'United States', "President Barack Obama 's", 'say.01', 'Chinese now know', '', 'Affirmative', "The Chinese now know that this is a serious problem in the bilateral relationship , and one they ca n't simply ignore , he said . ", 'China', 'newsText20482', 2014\05\19
'United States', 'State John Kerry when he visited Beijing last month', 'visit.01', "Beijing 's", '', 'Affirmative', "The State Department voiced regret over China 's move on the working group and said it expected a wide-ranging annual dialogue in July , for which Kerry is expected to visit Beijing , to go ahead as scheduled . ", 'China', 'newsText20482', 2014\05\19
'United States', 'The U.S. Department of Justice Monday', 'charge.01', 'five Chinese military officials', 'with', 'Affirmative', 'The U.S. Department of Justice Monday announced it was charging five Chinese military officials with computer hacking and economic espionage crimes , in an unprecedented legal move sure to roil relations between the two superpowers . ', 'China', 'newsText20504', 2014\05\19
'United States', 'The White House', 'announce.01', 'Obama will meet', '', 'Affirmative', 'The White House has announced President Obama will meet the Prime Minister in Washington DC on Friday , 20 June . ', 'United States', 'newsText20188', 2014\05\19
'United States', 'U.S. officials up to', 'call.01', 'China', '', 'Affirmative', "U.S. officials up to and including President Barack Obama have publicly called out China for benefiting from alleged hacking of American businesses before , but Monday 's charges mark the first formal action taken against officials of any nation for such crimes . ", 'China', 'newsText20504', 2014\05\19
'United States', 'by ObamaCare', 'create.01', 'bureaucratic jobs created by ObamaCare', '', 'Affirmative', 'Simply look at all the thousands and thousands of bureaucratic jobs created by ObamaCare that will not provide a smidgeon of healthcare . ', 'United States', 'newsText20385', 2014\05\19
'United States', 'the U.S.', 'invade.01', 'Cuba', '', 'Affirmative', 'In 1898 , the U.S. got involved , invading Cuba and occupying the island after forcing Spain to give it . ', 'Cuba', 'newsText20377', 2014\05\19
'United States', 'the U.S. Justice Department', 'accuse.01', 'China', 'of cyber spying for', 'Affirmative', 'A U.S. grand jury indicted five Chinese individuals on cyber espionage charges for allegedly targeting six American companies and stealing trade secrets , the U.S. Justice Department said on Monday , publicly accusing China of cyber spying for the first time . ', 'China', 'newsText20684', 2014\05\19
'United States', 'the United States', 'establish.01', 'the U.S. military base at Guant\xc3\xa1namo', '', 'Affirmative', 'The United States then forced Cuba to accept the odious Platt Amendent to its Constitution , which allowed the United States to intervene in the country militarily and established the U.S. military base at Guant\xc3\xa1namo . ', 'United States', 'newsText20377', 2014\05\19
'United States', 'the United States', 'force.01', 'Cuba', 'to accept', 'Affirmative', 'The United States then forced Cuba to accept the odious Platt Amendent to its Constitution , which allowed the United States to intervene in the country militarily and established the U.S. military base at Guant\xc3\xa1namo . ', 'Cuba', 'newsText20377', 2014\05\19
'United States', 'the United States', 'take.01', 'a stronger position on Syria', '', 'Affirmative', "He said the United States should have taken a stronger position on Syria , particularly after it crossed Obama 's red line by using chemical weapons in its ongoing civil war . ", 'Syria', 'newsText20486', 2014\05\19
'United States', 'the United States', 'take.01', 'a stronger position on Syria', '', 'Affirmative', "He said the United States should have taken a stronger position on Syria , particularly after it crossed Obama 's red line by using chemical weapons in its ongoing civil war . ", 'Syria', 'newsText20490', 2014\05\19
'United States', 'the United States on Monday', 'accuse.01', 'the American companies', 'of hacking', 'Affirmative', 'After years of complaining that China is engaged in stealing trade secrets from American companies , the United States on Monday for the first time filed cyber - espionage charges against individuals belonging to a unit of the Chinese military , accusing them of hacking trade secrets since 2006 from five domestic manufacturers and the steelworkers union . ', 'United States', 'newsText20574', 2014\05\19
'United States', 'the University of Chicago', 'publish.01', 'The economic impact study -- conducted by the Anderson Economic Group at the behest of the University of Chicago --', '', 'Affirmative', 'The University of Chicago published the study as it , along with other universities in Chicago , Honolulu and New York , prepare to submit their bids for the Obama library before the deadline of June 16 . ', 'United States', 'newsText20520', 2014\05\19
