A0,A0.35_Verb,A1,A2,Polarity,RelatedSentence
A MIDWIFE,tell.01,to hurry up and have,a pregnant woman,Affirmative,"A MIDWIFE who was desperate to get home after ordering a takeaway curry told a pregnant woman to hurry up and have her baby , a tribunal has heard . "
a pregnant woman,have.03,her baby,,Affirmative,"A MIDWIFE who was desperate to get home after ordering a takeaway curry told a pregnant woman to hurry up and have her baby , a tribunal has heard . "
Jeanette Matthews,say.01,I 'm going,,Affirmative,"Jeanette Matthews allegedly threatened the expectant mother , saying : If you do n't hurry up and have the baby I 'm going to cut you . "
A MIDWIFE who was desperate to get home after ordering a takeaway curry,have.03,her baby,,Affirmative,"Jeanette Matthews allegedly threatened the expectant mother , saying : If you do n't hurry up and have the baby I 'm going to cut you . "
Jeanette Matthews,cut.01,A MIDWIFE who was desperate to get home after ordering a takeaway curry,,Affirmative,"Jeanette Matthews allegedly threatened the expectant mother , saying : If you do n't hurry up and have the baby I 'm going to cut you . "
A MIDWIFE who was desperate to get home after ordering a takeaway curry,tell.01,ward was,her,Affirmative,"The midwife also told her that the labour ward was short staffed and that she did not want to be there , the Nursing and Midwifery Council heard . "
A MIDWIFE who was desperate to get home after ordering a takeaway curry,want.01,to be there,,Affirmative,"The midwife also told her that the labour ward was short staffed and that she did not want to be there , the Nursing and Midwifery Council heard . "
"Greg Unwin , for",say.01,complaint was received from,,Affirmative,"Greg Unwin , for the NMC , said : A complaint was received from a patient or the patient 's mother in relation to the registrant 's conduct on the 20 February 2011 . "
Patient A,deliver.01,her baby,,Affirmative,Patient A was admitted to Airedale General Hospital on the 19 February and delivered her baby during the night shift of the early hours of the 20 February . 
the allocated midwife for the ` Patient A ' on the labour ward at the Airedale General Hospital in Keighley,ask.01,A to stop using,Patient,Affirmative,"It is said that the registrant was rude in her conduct , that she inappropriately asked Patient A to stop using pain relief and that she had the patient in the lithotomy position . "
the allocated midwife for the ` Patient A ' on the labour ward at the Airedale General Hospital in Keighley,have.03,the patient in,,Affirmative,"It is said that the registrant was rude in her conduct , that she inappropriately asked Patient A to stop using pain relief and that she had the patient in the lithotomy position . "
Mr Unwin,say.01,registrant denied,,Affirmative,"Mr Unwin said that when asked about the incident , the registrant denied she had told the patient to stop using her pain relief . "
the registrant 's,deny.01,she had told,,Affirmative,"Mr Unwin said that when asked about the incident , the registrant denied she had told the patient to stop using her pain relief . "
the allocated midwife for the ` Patient A ' on the labour ward at the Airedale General Hospital in Keighley,tell.01,to stop using,the patient,Affirmative,"Mr Unwin said that when asked about the incident , the registrant denied she had told the patient to stop using her pain relief . "
Jeanette Matthews,claim.01,she had obtained,,Affirmative,"Matthews also claimed she had obtained proper consent before putting the patient into the lithotomy position , the panel heard . "
Jeanette Matthews,obtain.01,proper consent,,Affirmative,"Matthews also claimed she had obtained proper consent before putting the patient into the lithotomy position , the panel heard . "
Jeanette Matthews,put.01,the patient 's,into,Affirmative,"Matthews also claimed she had obtained proper consent before putting the patient into the lithotomy position , the panel heard . "
the panel,hear.01,Matthews also claimed,,Affirmative,"Matthews also claimed she had obtained proper consent before putting the patient into the lithotomy position , the panel heard . "
Jeanette Matthews,face.01,a series of charges relating to,,Affirmative,She faces a series of charges relating to alleged misconduct and lack of competence at the NMC tribunal in central London which she has chosen not to attend . 
Jeanette Matthews,choose.01,not to attend,,Affirmative,She faces a series of charges relating to alleged misconduct and lack of competence at the NMC tribunal in central London which she has chosen not to attend . 
Jeanette Matthews,attend.01,a series of charges relating to,,Affirmative,She faces a series of charges relating to alleged misconduct and lack of competence at the NMC tribunal in central London which she has chosen not to attend . 
you,have.03,a complaint about,,Affirmative,"If you have a complaint about editorial content which relates to inaccuracy or intrusion , then contact the Editor by clicking here . "
"Greg Unwin , for the NMC",contact.01,the PCC,,Affirmative,If you remain dissatisfied with the response provided then you can contact the PCC by clicking here . 
Yorkshire Post,provide.01,"news , events and",,Affirmative,"Yorkshire Post provides news , events and sport features from the Yorkshire area . "
you,enjoy.01,all the features of,,Affirmative,For you to enjoy all the features of this website Yorkshire Post requires permission to use cookies . 
For you to enjoy,require.01,permission,,Affirmative,For you to enjoy all the features of this website Yorkshire Post requires permission to use cookies . 
"Greg Unwin , for the NMC",visit.01,a website,,Affirmative,"Cookies are small data files which are sent to your browser ( Internet Explorer , Firefox , Chrome etc ) from a website you visit . "
by,collect.01,a type of cookie,,Affirmative,This is a type of cookie which is collected by Adobe Flash media player ( it is also called a Local Shared Object ) - a piece of software you may already have on your electronic device to help you watch online videos and listen to podcasts . 
you,have.03,on,,Affirmative,This is a type of cookie which is collected by Adobe Flash media player ( it is also called a Local Shared Object ) - a piece of software you may already have on your electronic device to help you watch online videos and listen to podcasts . 
you,help.01,you watch,,Affirmative,This is a type of cookie which is collected by Adobe Flash media player ( it is also called a Local Shared Object ) - a piece of software you may already have on your electronic device to help you watch online videos and listen to podcasts . 
you,watch.01,online videos,,Affirmative,This is a type of cookie which is collected by Adobe Flash media player ( it is also called a Local Shared Object ) - a piece of software you may already have on your electronic device to help you watch online videos and listen to podcasts . 
you,listen.01,to podcasts,,Affirmative,This is a type of cookie which is collected by Adobe Flash media player ( it is also called a Local Shared Object ) - a piece of software you may already have on your electronic device to help you watch online videos and listen to podcasts . 
"Greg Unwin , for the NMC",set.02,your browser,either to reject,Affirmative,"Yes there are a number of options available , you can set your browser either to reject all cookies , to allow only trusted sites to set them , or to only accept them from the site you are currently on . "
"Greg Unwin , for the NMC",reject.01,all cookies,,Affirmative,"Yes there are a number of options available , you can set your browser either to reject all cookies , to allow only trusted sites to set them , or to only accept them from the site you are currently on . "
sites,set.02,them,,Affirmative,"Yes there are a number of options available , you can set your browser either to reject all cookies , to allow only trusted sites to set them , or to only accept them from the site you are currently on . "
"Greg Unwin , for the NMC",delete.01,all cookies,,Affirmative,"However , please note - if you block / delete all cookies , some features of our websites , such as remembering your login details , or the site branding for your local newspaper may not function as a result . "
some features of,function.01,as,,Affirmative,"However , please note - if you block / delete all cookies , some features of our websites , such as remembering your login details , or the site branding for your local newspaper may not function as a result . "
by some of,use.01,A tool used by some of,to target adverts to you,Affirmative,A tool used by some of our advertisers to target adverts to you based on pages you have visited in the past . 
you,visit.01,pages,,Affirmative,A tool used by some of our advertisers to target adverts to you based on pages you have visited in the past . 
To opt out of,visit.01,website,,Affirmative,To opt out of this type of targeting you can visit the ' Your Online Choices ' website by clicking here . 
Our sites,contain.01,advertising,,Affirmative,Our sites contain advertising from Google ; these use cookies to ensure you get adverts relevant to you . 
these,use.01,cookies,to ensure,Affirmative,Our sites contain advertising from Google ; these use cookies to ensure you get adverts relevant to you . 
you,get.01,adverts relevant to you,,Affirmative,Our sites contain advertising from Google ; these use cookies to ensure you get adverts relevant to you . 
You,tailor.01,the type of ads,,Affirmative,You can tailor the type of ads you receive by visiting here or to opt out of this type of targeting you can visit the ' Your Online Choices ' website by clicking here . 
you,receive.01,the type of ads,,Affirmative,You can tailor the type of ads you receive by visiting here or to opt out of this type of targeting you can visit the ' Your Online Choices ' website by clicking here . 
You,opt.01,out of,,Affirmative,You can tailor the type of ads you receive by visiting here or to opt out of this type of targeting you can visit the ' Your Online Choices ' website by clicking here . 
You,visit.01,website,,Affirmative,You can tailor the type of ads you receive by visiting here or to opt out of this type of targeting you can visit the ' Your Online Choices ' website by clicking here . 
This,help.01,us identify,,Affirmative,This is used to help us identify unique visitors to our websites . 
us,identify.01,unique visitors,,Affirmative,This is used to help us identify unique visitors to our websites . 
we,use.01,this,to uniquely identify individuals and,Affirmative,This data is anonymous and we can not use this to uniquely identify individuals and their usage of the sites . 
we,identify.01,individuals and,,Affirmative,This data is anonymous and we can not use this to uniquely identify individuals and their usage of the sites . 
ad,serve.01,serving technology,,Affirmative,"This comes from our ad serving technology and is used to track how many times you have seen a particular ad on our sites , so that you do n't just see one advert but an even spread . "
you,see.01,a particular ad,,Affirmative,"This comes from our ad serving technology and is used to track how many times you have seen a particular ad on our sites , so that you do n't just see one advert but an even spread . "
you,see.01,one advert,,Affirmative,"This comes from our ad serving technology and is used to track how many times you have seen a particular ad on our sites , so that you do n't just see one advert but an even spread . "
by us,use.01,This information,for,Affirmative,This information is not used by us for any other type of audience recording or monitoring . 
"Our Classified websites ( Photos , Motors , Jobs and",use.01,cookies,to ensure,Affirmative,"Our Classified websites ( Photos , Motors , Jobs and Property Today ) use cookies to ensure you get the correct local newspaper branding and content when you visit them . "
you,get.01,the correct local newspaper branding and content,,Affirmative,"Our Classified websites ( Photos , Motors , Jobs and Property Today ) use cookies to ensure you get the correct local newspaper branding and content when you visit them . "
you,visit.01,them,,Affirmative,"Our Classified websites ( Photos , Motors , Jobs and Property Today ) use cookies to ensure you get the correct local newspaper branding and content when you visit them . "
These cookies,store.01,identifiable information,,Affirmative,These cookies store no personally identifiable information . 
We,use.01,Grapeshot,as,Affirmative,"We use Grapeshot as a contextual targeting technology , allowing us to create custom groups of stories outside out of our usual site navigation . "
We,allow.01,us to create,,Affirmative,"We use Grapeshot as a contextual targeting technology , allowing us to create custom groups of stories outside out of our usual site navigation . "
us,create.01,custom groups of stories outside out of,,Affirmative,"We use Grapeshot as a contextual targeting technology , allowing us to create custom groups of stories outside out of our usual site navigation . "
Grapeshot,store.01,the categories of story,,Affirmative,Grapeshot stores the categories of story you have been exposed to . 
Their privacy policy and opt out option,opt.01,option,,Affirmative,Their privacy policy and opt out option can be accessed here . 
Our partner for,increase.01,the usability of,,Affirmative,Our partner for Newspaper subscriptions online stores data from the forms you complete in these to increase the usability of the site and enhance user experience . 
This,provide.01,networking widget found in many of,,Affirmative,Add This provides the social networking widget found in many of our pages . 
This widget,give.01,the tools,you,Affirmative,"This widget gives you the tools to bookmark our websites , blog , share , tweet and email our content to a friend . "
