A0,A0.35_Verb,A1,A2,Polarity,RelatedSentence
announced interim market rules of,help.01,advance,,Affirmative,"There are growing concerns among operators in the Nigeria 's Electricity Supply Industry ( NESI ) , as to how the newly announced interim market rules of the Nigerian Electricity Regulatory Commission ( NERC ) will help advance the sector into the anticipated Transition Electricity Market ( TEM ) . "
companies,attend.01,the May edition of,,Affirmative,"THISDAY gathered from industry operators , especially Chief Executive Officers ( CEOs ) of some distribution and generation companies that attended the May edition of the monthly industry stakeholders ' meeting with NERC in Abuja that certain provisions in the interim market rules may need to be adjusted for the industry to swiftly achieve TEM . "
certain provisions in,need.01,to be adjusted,,Affirmative,"THISDAY gathered from industry operators , especially Chief Executive Officers ( CEOs ) of some distribution and generation companies that attended the May edition of the monthly industry stakeholders ' meeting with NERC in Abuja that certain provisions in the interim market rules may need to be adjusted for the industry to swiftly achieve TEM . "
the Nigeria 's Electricity Supply Industry -LRB- NESI -RRB-,achieve.01,TEM,,Affirmative,"THISDAY gathered from industry operators , especially Chief Executive Officers ( CEOs ) of some distribution and generation companies that attended the May edition of the monthly industry stakeholders ' meeting with NERC in Abuja that certain provisions in the interim market rules may need to be adjusted for the industry to swiftly achieve TEM . "
the federal government 's,continue.01,to show,,Affirmative,"Some of the CEOs who on conditions of anonymity , stated that with the federal government 's June target for improved electricity delivery in sight , the need for the regulator to consider adjusting certain aspects of the interim market rules may after all become necessary particularly as the government continues to show good commitment to improving gas supply to thermal power plants . "
the federal government 's,show.01,good commitment to improving,,Affirmative,"Some of the CEOs who on conditions of anonymity , stated that with the federal government 's June target for improved electricity delivery in sight , the need for the regulator to consider adjusting certain aspects of the interim market rules may after all become necessary particularly as the government continues to show good commitment to improving gas supply to thermal power plants . "
the federal government 's,improve.01,gas supply,,Affirmative,"Some of the CEOs who on conditions of anonymity , stated that with the federal government 's June target for improved electricity delivery in sight , the need for the regulator to consider adjusting certain aspects of the interim market rules may after all become necessary particularly as the government continues to show good commitment to improving gas supply to thermal power plants . "
one of them,state.01,may not be,,Affirmative,"Although , it is not clear if recommendations on this and other issues had been made to NERC by the operators that are open to possible adjustments in the rules , one of them however stated that the choice of the commission to push the market to achieve TEM at once may not be the best and stands to act as a setback to the gradual attainment of efficiency in the sector . "
the market,achieve.01,TEM,,Affirmative,"Although , it is not clear if recommendations on this and other issues had been made to NERC by the operators that are open to possible adjustments in the rules , one of them however stated that the choice of the commission to push the market to achieve TEM at once may not be the best and stands to act as a setback to the gradual attainment of efficiency in the sector . "
The rule,manage.01,the probable revenue shortfall in,,Affirmative,"The rule would also manage the probable revenue shortfall in the industry by determining the revenue allowable to participants and service providers during the period , establish the payment arrangements and flow of funds from distribution companies through the Market Operator to all beneficiaries , as well as establish the sources of funds required to ameliorate the probable shortfall in revenues collected by the distribution companies during the interim period . "
The rule,establish.01,the payment arrangements and flow of funds,,Affirmative,"The rule would also manage the probable revenue shortfall in the industry by determining the revenue allowable to participants and service providers during the period , establish the payment arrangements and flow of funds from distribution companies through the Market Operator to all beneficiaries , as well as establish the sources of funds required to ameliorate the probable shortfall in revenues collected by the distribution companies during the interim period . "
by,collect.01,revenues collected by,,Affirmative,"The rule would also manage the probable revenue shortfall in the industry by determining the revenue allowable to participants and service providers during the period , establish the payment arrangements and flow of funds from distribution companies through the Market Operator to all beneficiaries , as well as establish the sources of funds required to ameliorate the probable shortfall in revenues collected by the distribution companies during the interim period . "
The rule,state.01,companies shall make,,Affirmative,It also stated that the distribution companies shall make certain monthly baseline revenue remittances to the Market Operator . 
the privatised generation and distribution companies,make.02,revenue remittances,,Affirmative,It also stated that the distribution companies shall make certain monthly baseline revenue remittances to the Market Operator . 
distribution companies,make.02,certain monthly baseline revenue remittances,,Affirmative,"For example , Abuja , Benin , Eko , Enugu , Ibadan and Ikeja electricity distribution companies are mandated to make baseline remittances as a percentage of the Market Operator 's invoice in the order 65.13 , 53.12 , 98.24 , 55.93 , 74.03 and 90.66 per cents respectively . "
Yola distribution company,make.05,cent remittance,to,Affirmative,Yola distribution company is however expected to make 25 per cent remittance to the Market Operator ; these remittances are expected to be in line with the amount of electricity allocated to the various distribution companies . 
one of,say.01,"see , these are some of",,Affirmative,"But one of the CEOs said : You see , these are some of the things that we think should be discussed with the regulator . "
the various distribution companies,think.01,should be discussed with,,Affirmative,"But one of the CEOs said : You see , these are some of the things that we think should be discussed with the regulator . "
the various distribution companies,work.01,towards TEM,,Affirmative,"This privatisation came with some measure of sacrifice , we must be very jealous in guiding it and we are of the opinion that as much as we work towards TEM , that this interim rules are good but they can not just sustain the sector . "
these,sustain.01,the sector,,Affirmative,"This privatisation came with some measure of sacrifice , we must be very jealous in guiding it and we are of the opinion that as much as we work towards TEM , that this interim rules are good but they can not just sustain the sector . "
the various distribution companies,achieve.01,TEM,,Affirmative,"We stand the risk of losing whatever little gains we 've recorded with this privatisation if we remain rigid , the truth remains that we can not just achieve TEM in one fell swoop as the regulator envisages . "
you,do.02,cent remittance,,Affirmative,"What stops the regulator from saying , Ok , you Eko disco , you are doing 98 per cent remittance already , you sign your vesting contract with the bulk trader to guarantee your maximum power needs but with a caveat that if there is a general drop , you 'll be affected minimally . "
you,sign.02,your vesting contract with,,Affirmative,"What stops the regulator from saying , Ok , you Eko disco , you are doing 98 per cent remittance already , you sign your vesting contract with the bulk trader to guarantee your maximum power needs but with a caveat that if there is a general drop , you 'll be affected minimally . "
you,guarantee.01,your maximum power,,Affirmative,"What stops the regulator from saying , Ok , you Eko disco , you are doing 98 per cent remittance already , you sign your vesting contract with the bulk trader to guarantee your maximum power needs but with a caveat that if there is a general drop , you 'll be affected minimally . "
"the bulk trader to guarantee your maximum power needs but with a caveat that if there is a general drop , you 'll be affected minimally",activate.01,"PPAs telling them ,",,Affirmative,"And then , the bulk trader goes to the generation companies and activates its PPAs telling them , you Egbin , give me 20 per cent of your daily production and I 'll guarantee you prompt payment . "
its PPAs,tell.01,"Egbin , give me",them,Affirmative,"And then , the bulk trader goes to the generation companies and activates its PPAs telling them , you Egbin , give me 20 per cent of your daily production and I 'll guarantee you prompt payment . "
the privatised generation and distribution companies and NBET,give.01,20 per cent of,me,Affirmative,"And then , the bulk trader goes to the generation companies and activates its PPAs telling them , you Egbin , give me 20 per cent of your daily production and I 'll guarantee you prompt payment . "
you,guarantee.01,prompt payment,you,Affirmative,"And then , the bulk trader goes to the generation companies and activates its PPAs telling them , you Egbin , give me 20 per cent of your daily production and I 'll guarantee you prompt payment . "
the various distribution companies,begin.01,to achieve efficiency in bits,,Affirmative,"That way , we begin to achieve efficiency in bits until it assimilates into the entire market , he added . "
the various distribution companies,achieve.01,efficiency in bits,,Affirmative,"That way , we begin to achieve efficiency in bits until it assimilates into the entire market , he added . "
you,add.01,"way , we begin",,Affirmative,"That way , we begin to achieve efficiency in bits until it assimilates into the entire market , he added . "
The CEO,say.01,proposing is,,Affirmative,The CEO further said : What we are simply proposing is that we should adopt a systematic progression into TEM other than waiting for everyone to achieve certain level of remittance . 
the various distribution companies,adopt.01,a systematic progression,into TEM other than waiting,Affirmative,The CEO further said : What we are simply proposing is that we should adopt a systematic progression into TEM other than waiting for everyone to achieve certain level of remittance . 
everyone,achieve.01,certain level of remittance,,Affirmative,The CEO further said : What we are simply proposing is that we should adopt a systematic progression into TEM other than waiting for everyone to achieve certain level of remittance . 
the various distribution companies,allow.01,discos to activate,,Affirmative,"Let us allow the viable discos to activate their vesting contracts with the NBET and conduct real trading because you do n't expect Eko for instance to wait for Yola that is just doing about 25 per cent and sometimes zero now before it can activate its contract with the bulk trader , it will be unfair . "
the viable discos,activate.01,their vesting contracts with,,Affirmative,"Let us allow the viable discos to activate their vesting contracts with the NBET and conduct real trading because you do n't expect Eko for instance to wait for Yola that is just doing about 25 per cent and sometimes zero now before it can activate its contract with the bulk trader , it will be unfair . "
the viable discos,conduct.01,real trading,,Affirmative,"Let us allow the viable discos to activate their vesting contracts with the NBET and conduct real trading because you do n't expect Eko for instance to wait for Yola that is just doing about 25 per cent and sometimes zero now before it can activate its contract with the bulk trader , it will be unfair . "
you,expect.01,Eko,,Affirmative,"Let us allow the viable discos to activate their vesting contracts with the NBET and conduct real trading because you do n't expect Eko for instance to wait for Yola that is just doing about 25 per cent and sometimes zero now before it can activate its contract with the bulk trader , it will be unfair . "
the NBET,activate.01,its contract with,,Affirmative,"Let us allow the viable discos to activate their vesting contracts with the NBET and conduct real trading because you do n't expect Eko for instance to wait for Yola that is just doing about 25 per cent and sometimes zero now before it can activate its contract with the bulk trader , it will be unfair . "
the CEO,explain.01,are constantly on,,Affirmative,"While stating that Nigeria 's power sector privatisation was achieved with so much sacrifice , the CEO explained that operators in the sector are constantly on the edge to see that the processes are managed well to guarantee success . "
operators in,see.01,processes are managed well,,Affirmative,"While stating that Nigeria 's power sector privatisation was achieved with so much sacrifice , the CEO explained that operators in the sector are constantly on the edge to see that the processes are managed well to guarantee success . "
the processes,guarantee.01,success,,Affirmative,"While stating that Nigeria 's power sector privatisation was achieved with so much sacrifice , the CEO explained that operators in the sector are constantly on the edge to see that the processes are managed well to guarantee success . "
the CEO of,note.01,that operators were,,Affirmative,"Similarly , the CEO of Egbin power plant , Mike Uzoigwe , noted that operators were increasingly worried about poor revenue profile of the sector and would want an improvement to keep the sector afloat . "
operators in the sector,want.01,an improvement,,Affirmative,"Similarly , the CEO of Egbin power plant , Mike Uzoigwe , noted that operators were increasingly worried about poor revenue profile of the sector and would want an improvement to keep the sector afloat . "
Mike Uzoigwe,explain.01,was yet,,Affirmative,"Uzoigwe explained that Egbin 's investment of about N7 billion for capacity upgrade and reliability was yet to pay off , adding that it has rather incurred a loss of N570 million from November 1 , 2013 . "
Egbin 's investment of about N7 billion for capacity upgrade and reliability,incur.01,a loss of,,Affirmative,"Uzoigwe explained that Egbin 's investment of about N7 billion for capacity upgrade and reliability was yet to pay off , adding that it has rather incurred a loss of N570 million from November 1 , 2013 . "
our books,show.01,that we are losing revenue to,,Affirmative,"As at the end of last month , our books showed that we are losing revenue to the tune of about N570 million doing business from November 1 to date . "
operators in the sector,lose.02,revenue,to,Affirmative,"As at the end of last month , our books showed that we are losing revenue to the tune of about N570 million doing business from November 1 to date . "
the tune of,do.02,business,,Affirmative,"As at the end of last month , our books showed that we are losing revenue to the tune of about N570 million doing business from November 1 to date . "
any further investor,look.01,in,,Affirmative,"The revenue profile in the electricity industry is very poor and if any further investor will look in , it will give results that may not be desirable for the country . "
The revenue profile in the electricity industry,give.01,results,,Affirmative,"The revenue profile in the electricity industry is very poor and if any further investor will look in , it will give results that may not be desirable for the country . "
Two factors,impinge.01,on,,Affirmative,"Two factors are impinging on our moving forward , those are the fact that consumers are not metered , the second is the issue of gas . "
operators in the sector,overstate.01,the problem,,Affirmative,"We can never overstate the problem that lack of gas is causing the industry , Uzoigwe said . "
lack of gas,cause.01,the Nigeria 's Electricity Supply Industry -LRB- NESI -RRB-,,Affirmative,"We can never overstate the problem that lack of gas is causing the industry , Uzoigwe said . "
Mike Uzoigwe,say.01,We can never overstate,,Affirmative,"We can never overstate the problem that lack of gas is causing the industry , Uzoigwe said . "
operators in the sector,keep.02,you,,Affirmative,We 'll also keep you updated by email whenever someone else comments on this page . 
someone else,comment.01,on,,Affirmative,We 'll also keep you updated by email whenever someone else comments on this page . 
by,approve.01,your comment,,Affirmative,Your comment will appear on this page once it has been approved by a moderator . 
you,like.02,to search for,,Affirmative,Please enter some keywords that you 'd like to search for . 
you,search.01,some keywords,for,Affirmative,Please enter some keywords that you 'd like to search for . 
THISDAYLIVE,care.01,about you,,Affirmative,"THISDAYLIVE cares about you , help us to report better ! "
