A0,A0.35_Verb,A1,A2,Polarity,RelatedSentence
a.m. Aucklanders,join.01,a global movement calling for,,Affirmative,Tuesday 20 May 2014 5:20 a.m. Aucklanders are joining a global movement calling for the safe return of more than 200 schoolgirls kidnapped in Nigeria last month . 
a global movement calling for,call.03,for,,Affirmative,Tuesday 20 May 2014 5:20 a.m. Aucklanders are joining a global movement calling for the safe return of more than 200 schoolgirls kidnapped in Nigeria last month . 
student Lydia Hollister - Jones,say.01,heart breaks,,Affirmative,"My heart breaks not only for the girls , but for their mothers , brothers , aunties and uncles , sisters and grandparents , says protest organiser Auckland University student Lydia Hollister - Jones . "
5:20 a.m. Aucklanders,afford.01,to sit idly by and wait for,,Affirmative,We simply ca n't afford to sit idly by and wait for the rest of the world to respond . 
Amnesty International New Zealand executive director Grant Bayldon,say.01,"the march ,",,Affirmative,"Amnesty International New Zealand executive director Grant Bayldon will speak at the march , which he says is an important opportunity for Aucklanders to call on Nigerian authorities and supporting countries to do everything in their power to secure the safe release of the girls . "
countries,do.02,everything in,,Affirmative,"Amnesty International New Zealand executive director Grant Bayldon will speak at the march , which he says is an important opportunity for Aucklanders to call on Nigerian authorities and supporting countries to do everything in their power to secure the safe release of the girls . "
by,abduct.01,The 276 teenage girls,,Affirmative,The 276 teenage girls were abducted from a school in Chibok in northeastern Borno by Boko Haram Islamists on April 14 . 
many people,call.03,for,,Affirmative,"# BringBackOurGirls rallies have been held around the world and many people have called for the girls ' release , including US First Lady Michelle Obama and former prime minister Helen Clark . "
